Questions,Correct,A,B,C,D
"Which countrys first president was Václav Havel, a writer and dramatist?", Czech Republic,Hungary,Poland,Czech Republic,Slovakia
Which Nordic country was first to enter the European Union?, Denmark,Denmark,Sweden,Finland,Norway
Which European Union member is home to Santa Claus?, Finland,Finland,Cyprus,Turkey,Sweden
"Which of the EU founding members is the country of Liberté, Égalité, Fraternité?", France,France,UK,Germany,Italy
Which European Union member has the greatest number of islands?, Greece,Greece,Italy,UK,Denmark
Which country is the only member of the European Union that is partly located in Africa?, Spain,France,UK,Spain,Malta
Which EU member has a significant part of its territory below sea level?, The Netherlands,Belgium,The Netherlands,Poland,Estonia
"This European Union member was once known for huge migration of its people, mainly to the US and UK. Nowadays, however, it attracts many immigrants from new EU members.", Ireland,Spain,Ireland,Italy,Germany
"Which EU member was the largest country in Europe in XIV century, but now has land area of just 65 000 sq. km?", Lithuania,Denmark,Lithuania,Austria,Netherlands
Which mini country was among the European Union founding members?, Luxembourg,Luxembourg,Malta,Monaco,Liechtenstien
In which European Union member the native people make up only 60% of the total population?, Latvia,Poland,Austria,Latvia,France
Which former British colony joined the European Union in 2004?, Malta,Gibraltar,Ireland,Syria,Malta
Which country is the biggest contributor to the European Union budget?, Germany,UK,Germany,Italy,France
Which country has twice rejected European Union membership in national referendums?, Norway,Poland,Norway,Turkey,UK
Which European Union member was the first country to reject communist rule and thus sparkle the liberation of so called Eastern Block?, Poland,Czech Republic,Romania,Germany,Poland
Where is the European Unions westernmost point not counting overseas territories?, In Portugals Azores islands,In Spains Canary islands,In Portugals Azores islands,In Iceland,In Ireland
Which EU member state was known to the ancient Greeks and Romans as Dacia?, Romania,Macedonia,Bulgaria,Romania,Slovenia
Which country is the youngest independent state to be a member of the European Union? (It has been an independent country only since 1993.), Slovakia,Montenegro,Slovenia,Slovakia,Cyprus
In May 2004 the European Union accepted 10 new countries. Which of them was first to adopt the Euro as its national currency?, Slovenia,Slovenia,Poland,Slovakia,Estonia
Which country associated with banking is not a member of the European Union?, Switzerland,Luxembourg,UK,Austria,Switzerland
In which country is the European Union’s biggest lake located?, In Sweden,In Finland,In Poland,In Sweden,In Hungary
"Which Muslim country was recognized as a candidate for accession in the EU on December 12th, 1999 at the Helsinki summit of the European Council?", Turkey,Israel,Morocco,Syria,Turkey
"All but three European Union official languages are from the Indo-European family. They are Finnish, Estonian and which other language?", Hungarian,Greek,Hungarian,Polsih,Bulgarian
Most of the European Union members are also part of a Schengen Agreement that allows their citizens to travel without passports across the member states. Which EU member is outside of the Schengen group?, UK,Lithuania,UK,Poland,Denmark
Which member of the European Union completely surrounds two countries that are outside of the club?, Italy,Austria,France,Spain,Italy
The Shaolin temples are perhaps the Buddhist monasteries best known in the West. The word Shaolin means this., Young Forest,Blue Sky,Silent Soul,Young Forest,Pure Water
Which EU country or US state is not entirely situated on (an) island(s)?, Rhode Island,UK,Hawaii,Rhode Island,Cyprus
Which country or state was the first to be attacked in WWII?, Poland,Denmark,Hawaii,Poland,US Virgin Islands
Where was the colonial settlement New Amsterdam located?, The state of New York,UK,New Jersey,Holland,The state of New York
Which of these is the largest in terms of area?, Germany,Georgia,Florida,Germany,Finland
Which of these peaks is the highest?, McKinley (Alaska),Grossglockner (Austria),McKinley (Alaska),Mont Blanc (France),Mount Elbert (Colorado)
Which of the following metropolitan areas is the largest in terms of population?, New York City,London,New York City,Paris,Los Angeles
"Which river, flowing entirely through a single country or state, is the longest?", Vistula (Poland),Vistula (Poland),Loire (France),Iowa (Iowa),Illinois (Illinois)
"What is the location of the worlds largest particle physics laboratory, established in 1954?", In neither of them,In the EU,Both have laboratories of equal size.,In the US,In neither of them
Which of the following countries and states shares its name with its capital city?, Luxembourg,New York,Malta,Luxembourg,Oklahoma
Which of these cities was established first?, Madrid (Spain),New York City (New York),Copenhagen (Denmark),Madrid (Spain),Boston (Massachusetts)
Which of the following flags doesnt include a cross?, the flag of Alaska,the flag of Mississippi,the flag of the UK,the flag of Denmark,the flag of Alaska
Birmingham is the most populous city of which country or US state?, Alabama,Austria,Alabama,the UK,Utah
Which one of these is not a Greek Mediterranean island?, Minorca,Minorca,Lemnos,Crete,Santorini
Which one of these Mediterranean islands is the smallest in area?, Corfu,Corsica,Cyprus,Crete,Corfu
"What two colors are featured on the flag and coat of arms of Malta, a country consisting of seven Mediterranean islands?", White and red,Green and black,Yellow and purple,White and red,Blue and yellow
"Which one of these Mediterranean islands, belonging to Italy, is the largest in area?", Sardinia,Sardinia,Procida,Capri,Ischia
"This island, on which the volcano Etna is situated, is the largest Mediterranean island.", Sicily,Sicily,Corsica,Rhodes,Sardinia
Which French Mediterranean island is the birthplace of Napoléon Bonaparte?, Corsica,Cyprus,Gozo,Corsica,Montecristo
"On April 11, 2002, Al-Qaeda carried out a terrorist attack near a synagogue on which Tunisian island?", Djerba,Djerba,Yalikavak,Salih Ada,Kargi Adasi
Which one of these Mediterranean islands does not belong to the group of the Balearic Islands?, Capri,Ibiza,Mallorca,Capri,Formentera
Which of these Mediterranean islands belongs to Croatia and is home of the endangered Griffon Vulture?, Cres,Filfla,Procida,Cres,Gorgona
What motto do North Carolina license plates carry?, First In Flight,The Old North State,First In Flight,Nothing Finer,Tarheel State
North Carolina has been well represented on the American Idol TV series Which contestant from the state became Americas Idol in 2004?, Fantasia Barrino,Fantasia Barrino,Kerrier Ann Pickler,Clay Aiken,Taylor Hicks
"In 1838 the Federal Indian Removal Policy was forced into effect by The Treaty of New Echota. Twenty Cherokee Indians, none elected officials of the Cherokee Nation, signed over all Cherokee Territory east of the Mississippi for five million dollars. The Cherokee Indians were then forced to march from their home in the mountain of North Carolina to Okalahoma. This journey became know by what name?", Trail of Tears,Journey of No Return,Trail of Tears,Cherokee Death March,March of Sorrow
"This military complex in North Carolina is one of the largest in the world and home to the 82 Airborne, the Golden Knights, and U.S. Army Special Operations Command.", Fort Bragg,Fort Bragg,Fort Campbell,Fort Polk,Fort Dix
Riga is the capital of which Baltic country?, Latvia,Estonia,Lithuania,Belarus,Latvia
What country gained independence from the British Mandate for Palestine in 1948?, Israel,Syria,Sierra Leone,Jordan,Israel
What city is the capital of Madagascar?, Antananarivo,Antananarivo,Toamasina,Harare,Maputo
What river encountered during the Lewis and Clark expedition (1804-1806) flows directly into the Pacific Ocean between Washington and Oregon?, Columbia,Missouri,Snake,Columbia,Colorado
Which explorer was the first to reach the South Pole?, Roald Amundsen,Richard Byrd,Sir Robert Falcon Scott,Roald Amundsen,Sir Ernest Henry Shackleton
What sea captain claimed British possession of the eastern part of Australia in 1770 naming it New South Wales?, James Cook,James Cook,Horatio Nelson,Cuthbert Collingwood,Arthur Phillip
In what South American country was Che Ernesto Guevara born?, Argentina,Paraguay,Argentina,Bolivia,Suriname
Near what sea was the ancient city of Troy located ?, Aegean,Aegean,Mediterranean,Ionian,Adriatic
Which of these rivers runs through the Czech Republic and Germany?, Elbe River,Elbe River,Rhine River,Danube River,Rhone River
Name the European co-principality whose heads of state are the President of France and the Bishop of Urgel., Andorra,Andorra,Vatican City,San Marino,Malta
"After World War II, this country was split into two states which were not reunited until 1990.", Germany,France,Spain,Austria,Germany
Mount Erebus is a volcano located on this continent., Antarctica,Antarctica,Europe,South America,Asia
Rastafarianism is a religion that venerates Haile Selassie as a god. Haile Selassie was the emperor of the third most populous country in Africa. Name that country., Ethiopia,Libya,Ethiopia,Mozambique,Gabon
Name Asias most densely populated country which has about three million people and an area of less than 250 square miles (402 km²)., Singapore,Hokkaido,Taiwan,Laos,Singapore
In what city in Switzerland is the headquarters of the World Trade Organization (WTO) located?, Geneva,Geneva,Berne,Born,Bamako
What is a ridge of coral in the sea called?, Coral Reef,Atoll,Coral Reef,None of these,Coral Island
"The Dead Sea Scrolls, found in caves at Qumran, are believed to have been made by a group of people called what?", Essenes,BHais,Sircurai,Essenes,Sarafai
What is the average salinity of the Dead Sea?, 30 %,11 %,30 %,49 %,54 %
What body of water feeds the Dead Sea?, The Jordan River,The Euphrates River,The Mediterranean Ocean,The Red Sea,The Jordan River
The Bible tells the story of a woman that was turned into a pillar of salt near the Dead Sea. Who was her famous husband?, Lot,Issac,Abraham,Pharoah,Lot
"The Dead Sea, the lowest point on Earth, is how far below sea level?", 418 meters,349  meters,418 meters,517  meters,2608 meters
What was the name of the great fortification built in 37-31 BC by Roman king Herod I on a high hill above the Dead Sea?, Masada,Masada,Kadesh-Barnea,Herods Citadel,Vespasians Citadel
The Dead Sea is part of the Great Rift Valley. How far does this valley extend in length?, 3700 miles,6700 miles,697 miles,1697 miles,3700 miles
"Nelsons Column, built to commemorate Admiral Horatio Nelsons death, is a monument in this famous London square.", Trafalgar Square,Soho Square,Leicester Square,Piccadilly Circus,Trafalgar Square
"Tiananmen Square, which has been the site of a number of political events and student protests, is located in what Chinese city?", Beijing,Beijing,Shanghai,Guangzhou,Taipei
"The Kremlin, a historic fortified complex at the heart of Moscow, overlooks this square to the east.", Red Square,Black Square,Azadi Square,Palace Square,Red Square
"What iconic world landmark, sometimes called the Crossroads of the World, was formerly named Longacre Square?", Times Square,Grosvenor Square,Times Square,Madison Square,St Jamess Square
"What famous square is located in Vatican City, the papal enclave within Rome?", St. Peters Square,Campo dei Fiori,St. Pauls Square,St. Peters Square,Piazza San Marco
"Grand Place, which is known for its large flower carpet, is the main square of this capital European city.", Brussels,Berlin,Paris,Strasbourg,Brussels
Which square is not correctly matched with the capital city in which it is located?, Azadi Square - Karachi,Red Square - Moscow,Senate Square - Helsinki,Azadi Square - Karachi,Leicester Square - London
"Piazza San Marco (St Marks Square), which Napoleon allegedly called The drawing room of Europe, is the principal square of this Italian city.", Venice,Florence,Venice,Rome,Milan
"What city in Eastern Europe, often associated with the story of Dracula, is also famous for Revolution Square, which was the site of a 1989 revolt?", Bucharest,Bucharest,Warsaw,Budapest,Prague
What former president has addressed more than a million people on many occasions on Plaza de la Revolución in Havana?, Fidel Castro,Benito Mussolini,Fidel Castro,Salvador Allende,Francisco Franco
What is the name of the sea that borders the Netherlands?, North Sea,Red Sea,Black Sea,North Sea,Mediterranean Sea
What are the three colours of the national flag of the Netherlands from top to bottom?," Red, white, and blue","Red, white, and blue","Blue, yellow, and red","Red, blue, and white","Green, red, and white"
What is the capital city of the Netherlands?, Amsterdam,Amsterdam,Amersfort,The Hague,Zwolle
What two countries border the Netherlands?, Belgium and Germany,Germany and Lithuania,Germany and France,France and Belgium,Belgium and Germany
"Demographically, the Netherlands matches which of this characteristics?", All of these,All of these,Its population is first in average height in the world.,It is one of most densely populated countries in the world.,It is one of the most densely cabled countries in the world.
What Mediterranean island is divided between a Greek community and a Turkish community (although the latter is not internationally recognized as a separate entity)?, Cyprus,Cyprus,Crete,Corsica,Malta
What South American island is shared by Chile and Argentina?, Tierra Del Fuego,Islas Malvinas,Tierra Del Fuego,Islas Galapagos,Isla De Pascua
What island is shared by Indonesia and the nation of East Timor?, Timor,Timor,New Guinea,Borneo,Flores
"What European island is partially occupied by a neighbouring island nation, which has led to centuries of dispute?", Ireland,Sardinia,Sicily,Iceland,Ireland
Which of these islands is shared by three countries?, Borneo,Luzon,Ireland,Madagascar,Borneo
What is the name of the island shared by Haiti and the Dominican Republic?, Hispaniola,Ile dHaiti,Hispaniola,Isla Dominica,Carib Island
What island is shared by the nations of Indonesia and Papua New Guinea?, New Guinea,Bougainville,New Guinea,Timor,Borneo
This tiny Caribbean island is shared by France and the Netherlands., St. Martin,St. Lucia,St. Mark,St. Martin,St. Bartholomew
The tiny island of Märket / Märketin in the Baltic Sea is shared by these two nations., Finland and Sweden,Sweden and Denmark,Finland and Estonia,Finland and Russia,Finland and Sweden
"The island of Sebatik, located east of Borneo, is shared by Indonesia and what other nation?", Malaysia,The Philippines,Singapore,Malaysia,Brunei
What portion of the Earth’s surface do oceans cover?, More than two thirds,More than two thirds,One third,Half of it,One fourth
"The Marianas Trench, the deepest location on the surface of the Earths crust, lies in this ocean.", The Pacific Ocean,The Pacific Ocean,The Southern Ocean,The Indian Ocean,The Atlantic Ocean
Which one of these Asian rivers does not flow into the Indian Ocean?, Saigon,Zambezi,Saigon,Indus,Ganges
What sea is known to be the only sea without shores?, The Sargasso Sea,The Sargasso Sea,The Norwegian Sea,The Labrador Sea,The Celtic Sea
The Bering Sea is a part of which ocean?, The Pacific Ocean,The Arctic Ocean,The Pacific Ocean,The Indian Ocean,The Atlantic Ocean
The Mediterranean Sea is connected to the Atlantic Ocean by this strait., The Strait of Gibraltar,The Strait of Gibraltar,The Dardanelles,Strait of Magellan,Strait of Dover
"The famous Île Notre-Dame, an artificial island built from earth excavated for a metropolitan railway, is located in which country?", Canada,England,Canada,France,Switzerland
"What is the popular name of the artificial island in Tokyo Bay, whose name is Yume No Shima in Japanese?", Dream Island,Dream Island,Water Lilly,Wind Island,Sun Island
"What is the name of the Peruvian floating islands, located in Lake Titicaca?", Uros,Chaka,Laka,Uros,Barro
"Which man-made island, located to the southwest of Singapore, was created by joining several natural islands?", Jurong Island,Formoza,Jurong Island,Spiral Island,Neeltje-Jans
What is the name of the artificial island located in the Gatun Lake portion of the Panama Canal?, Barro Colorado Island,Thilafushi,Shui Keng Teng,Chubu,Barro Colorado Island
"Which 20-kilometre artificial island, situated in the river Danube, was nicknamed the Copa Kagrana?", Donauinsel,Peberholm,Burj al-Arab,Odaiba,Donauinsel
"Rokko island, constructed between 1973 and 1992, is an artificial island situated in which country?", Japan,France,China,The Netherlands,Japan
"Which artificial island is situated in San Francisco Bay, between San Francisco and Oakland?", Treasure Island,Hulhumalé,Treasure Island,Port Island,Flakfortet
"This artificial island, whose name literally means Pepper Islet, is part of the Oresund Bridge, connecting Denmark with Sweden.", Peberholm,Peberholm,Kansai,Flakfortet,Palm Islands
"Spiral Island, a small Mexican artificial floating island, was situated on the coast of which sea?", The Caribbean Sea,The Black Sea,The Caribbean Sea,The Aegean Sea,The North Sea
The history of EU began on 25th of March 1957 when the European Economic Community was formed. What is the founding act called?, Treaty of Rome,Treaty of Paris,Schengen Agreement,Schuman Declaration,Treaty of Rome
Which country was not among the founding states of the European Economic Community (the European Union predecessor)?, UK,Luxembourg,Italy,France,UK
When did Ireland join the European Union?, 1973,1995,1973,1960,1986
The citizens of which country rejected the idea of joining the EU in 1972 and again in 1994?, Norway,Norway,Denmark,Iceland,Finland
The EU has been a western club for most of its history. But which of these western countries has stayed out of the EU?, Switzerland,Belgium,Spain,Switzerland,Luxembourg
Which former Yugoslavian republic was the first to be admitted to the European Union?, Slovenia,Macedonia,Serbia,Croatia,Slovenia
The 6th European Union enlargement took place on May 1 2004. How many countries were admitted then?, 10,8,12,10,14
Many countries held national referenda before joining the European Union. Which of the following nations showed the highest support for joining (92% in favour)?, Slovakia,Poland,Ireland,Lithuania,Slovakia
What kind of agreement is the Schengen Agreement?, It allows EU citizens to travel without passports within the EU borders.,It is a visionary chapter about a further EU enlargement.,It allows EU citizens to travel without passports within the EU borders.,"It regulates the relationships with non-EU countries, especially Russia.",It introduced a common currency - the Euro.
When did the euro become the official currency of the Eurozone?, 2002,1999,1994,2002,2004
The flag of which US state features a white American Bison on a blue field?, Wyoming,Nevada,Wyoming,Texas,South Dakota
The name of which US state means large creek in the Seneca language?, Ohio,Idaho,Ohio,Texas,Wisconsin
"Montgomery is the capital city of this US state, and its largest city is Birmingham.", Alabama,Arizona,Alaska,Arkansas,Alabama
Everglades National Park is located in this US state., Florida,Hawaii,Nevada,Georgia,Florida
"The state drink of this US state is milk, its state bird is the Western Meadowlark, its state flower is the Wild Prairie Rose, and its state slogan is Legendary.", North Dakota,North Dakota,South Dakota,North Carolina,South Carolina
"According to one theory, the name of this US state comes from the French word for hurricane.", Oregon,Arizona,Oregon,Colorado,Vermont
Baton Rouge is the capital of what US state?, Louisiana,New Hampshire,Maine,Louisiana,North Carolina
"The largest city in what US state hosts Summerfest, or The Worlds Largest Music Festival?", Wisconsin,New Jersey,Wisconsin,Kentucky,Maryland
The name of this US state means great river and its symbol is the magnolia tree., Mississippi,Missouri,Massachusetts,Mississippi,Minnesota
"Which US state has been nicknamed The First State, The Small Wonder, Blue Hen State, and The Diamond State?", Delaware,Pennsylvania,Virginia,Delaware,New York
What are the largest cities in the Philippines in terms of land area?, Davao City and Puerto Princesa City,Manila and Davao City,Zamballes and Puerto Princesa City,Zamballes and Manila,Davao City and Puerto Princesa City
"The Philippines has the worlds largest deposit of heavy water which can be used for atomic energy, in spectroscopy, and as an automobile fuel. What makes heavy water different from water?", The presence of deuterium,An extra hydrogen molecule,One  less hydrogen molecule making it HO not H2O,An extra oxygen molecule,The presence of deuterium
"From 1888-1889, American traders Simon and Thomas Metcalfe brought some men from Manila to the Western Hemisphere. Which state did they bring them to?", Alaska,California,Mexico,Oregon,Alaska
Who was the first  female  President of the Philippines?, Corazon Aquino,Eleanor Concepcion,Louiza Rizal,Ramona  Magsaysay,Corazon Aquino
Who is the first Filipino-American to become Governor of a US state?, Benjamin Cayetano,Franklin  Rakata,Jose Nisperos,Jose Rizal,Benjamin Cayetano
"On December 7, 1941 the Japanese launched a sneak attack on Pearl Harbor. On that day they also launched a similar attack on this American airbase in the Philippines."," Angeles, Pampanga, Philippines","Subic Bay, Luzon, Philippines","Capas Air Base,Tarlac, Philippines","Angeles, Pampanga, Philippines","Clark Air Force Base, Pampanga, Philippines"
Which best  describes the religious distribution of the populace of the Philippines?," 82% Catholic, 9% Protestant, 5% Muslim and  3 % Buddhist","82% Catholic, 9% Protestant, 5% Muslim and  3 % Buddhist","92 % Catholic, 7 % Muslim, 1% all others","57 % Muslim, 40 % Protestant, 1 % Catholic","41% Catholic, 38 % Muslim, 10% Buddhist , 9 % Protestant"
This US President was born in South Carolina although he lived in Tennessee when he became president., Andrew Jackson,William Henry Harrison,Zachary Taylor,Andrew Jackson,Jimmy Carter
Which of the following states borders South Carolina?, Georgia,Alabama,Tennessee,Virginia,Georgia
What South Carolina Senator lived to be one hundred years old while still holding office?, Strom Thurmond,Strom Thurmond,Mike Mansfield,"James, (Jimmy)  Byrnes",Fritz Hollings
"Francis Marion fought the British in the swamps of South Carolina during the Revolutionary War, using guerrilla tactics, that the communist Vietcong in Vietnam would have understood well. For this Marion was given the following nickname.", The Swamp Fox,The Swamp Fox,The Yankee Ghost,The Carolina Gamecock,The Fighting Gator
The Grand Strand is a long stretch of sandy beach situated near which of the following?, Myrtle Beach,Hilton Head,Follie Beach,Myrtle Beach,Charleston
The city of Fargo is the largest city in which of these U.S. states?, North Dakota,North Carolina,South Dakota,North Dakota,South Carolina
Name the capital city of the U.S. state of Washington., Olympia,Seattle,Olympia,Madison,Boise
Which U.S. state has been nicknamed The Cornhusker State?, Nebraska,Nevada,Ohio,Nebraska,Wyoming
Topeka is the capital city of which U.S. state?, Kansas,Kansas,Arkansas,Missouri,Colorado
Which of these nicknames refers to the U.S. state of Idaho?, Gem State,Emerald State,Pearl State,Gem State,Golden State
What does the name of the U.S. state of Utah mean in the Ute language?, People of the mountains,Spirits of the rivers,Children of the winds,People of the mountains,Land around the great lake
Saint Paul is the capital city of what US state?, Minnesota,Missouri,Minnesota,Mississippi,None of these
"The Black Sea drains into the Atlantic Ocean via the Sea of Marmara and the Mediterranean Sea on the South West. On the other, North East side of the Black Sea, there is a small sea which is connected to the Black Sea via the Strait of Kerch. Name this sea.", The Sea of Azov,The White Sea,The Caspian Sea,The Aral Sea,The Sea of Azov
Six countries are located along the Black Sea border. Which one among them has the longest Black Sea coast line (not including the Sea of Azov coast line)?, Turkey,Romania,Turkey,Russia,Ukraine
"Not counting Istanbul, which of these cities is located on Bosphorus on the side of the Sea of Marmara and is the biggest city on the coast of the Black Sea?"," Odessa, Ukraine","Trabzon, Turkey","Sukhumi, Georgia","Varna, Bulgaria","Odessa, Ukraine"
"The names of three large rivers flowing into the Black Sea begin with a letter D. Danube, the largest of the three, flows through ten European countries and enters the Black Sea in Romania. The other two end their flow in this country.", Ukraine,Bulgaria,Turkey,Ukraine,Russia
The Black Sea city of Sukhumi is the capital of this republic that proclaimed its independence from Georgia in the 90s., Abkhazia,Ajaria,Iberia,Ossetia,Abkhazia
"The Black Sea, whose waters are known to be meromictic, is the largest water basin in the world where water layers do not intermix, and, thus, lack the dissolved form of what?", Oxygen,Salt,Nitrogen,Oxygen,Hydrogen Sulfide
"The Crimean peninsula has been under the control of multiple powers over the centuries. Although it is considered to be an autonomous republic, it is a part of this nation.", Ukraine,Ukraine,Romania,Bulgaria,Russia
"From the viewpoint of physical geography and ecology, the Ukrainian territories to the north of the Black Sea are known to contain what?", Steppes or plains,Low hills and forests,Steppes or plains,Mountains,Sand desert
