Questions,Correct,A,B,C,D
What is the capital of Afghanistan?, Kabul,Tirana,Kabul,Dushanbe,Tashkent
What is the capital of Australia?, Canberra,Canberra,Sydney,Melbourne,Ottawa
What is the capital of Belgium?, Brussels,Amsterdam,Luxemburg,Brussels,Stockholm
What is the capital of Greece?, Athens,Ankara,Athens,Sofia,Thessaloniki
What is the capital of Italy?, Rome,Venice,Rome,Naples,Milan
What is the capital of Israel?, Jerusalem,Tel Aviv,Kabul,Jerusalem,Islamabad
What is the capital of Germany?, Berlin,Frankfurt,Berlin,Munich,Hamburg
What is the capital of Norway?, Oslo,Stockholm,Helsinki,Oslo,Copenhagen
"What is the capital and largest city of Hawaii, the 50th US state?", Honolulu,Little Rock,Dover,Frankfort,Honolulu
"When the streams Biya and Katun join in Altai Krai, they form this mighty river. It is located in West Siberia, Russia and has many names- the Siberian Tatars call it Omar or Umar, the Samoyedes- Kolta or Kuay and to the Ostiaks it is known as the As, Yag, Kolta and Yema. It joins the Irtysh river, forming the longest river flow in Russia. What is its name?", Ob,Ural,Volga,Ob,Lena
"Although the Amazon river is generally regarded as the second-longest in the world, it is the river with greatest total flow, carrying more than the Mississippi, Nile, and Yangtze rivers combined.  It ends in the Atlantic Ocean, but it is believed to begin its long journey from this mountain peak.", Nevado Mismi,Nevado Mismi,Misti,Cotopaxi,Mount Chimborazo
"This is the longest river in Asia and its Chinese name, Chang Jiang, is literally translated to Long River. The critically endangered Chinese River Dolphin and Chinese paddlefish live only in this river. It takes its source in the Qinghai Province, flows for 6,380km (3964miles) and finally empties into the East China Sea. What is the name of this river?", Yangtze,Irtysh,Huai River,Yangtze,Mekong
"Huang He is the second-longest river in China. Its source is in the Kunlun Mountains at 4,500m (14,764 feet) above sea level. Due to the silts that the river carries, the color of its waters becomes so unnatural that it gave the name of the river . What is the color of the waters of Huang He?", Yellow,Brown,Orange,Yellow,Red
"It is the second-longest river in the United States. The longest one, Missouri, joins it to form the longest river flow in North America. This river flows through ten states- Minnesota, Wisconsin, Iowa, Illinois, Missouri, Kentucky, Arkansas, Tennessee, Mississippi and Louisiana and mouths into the Gulf of Mexico. I am not going to ask you about its name, but about its source. What is the origin of the Mississippi river?", Lake Itasca,Lake Superior,Lake Pepin,Lake Itasca,Cass Lake
"This is the twelfth-longest river in the world. It runs through China, Myanmar, Thailand, Laos, Cambodia and Vietnam. There are various theories about the source and the exact length of the river because there are several effluents of it that are too difficult to explore. Due to the many rapids and waterfalls, as well as the extreme changes in the flow of the river, sailing is extremely difficult. What is the name of this river?", Mekong,Mekong,Saskatchewan,Angara,Brahmaputra
"The longest river in Europe is Volga. But do you know which is the second longest one? It flows through several major European cities, such as Ulm, Vienna, Bratislava, Budapest and Belgrade. The river empties in the Black Sea on the terrirories of Romania and Ukraine.", Danube,Don,Dniepr,Danube,Emba
"The Ganges river is considered to be a holy in India. There is a Hindu legend that the river was created from the sweat of the feet of Vishnu, collected by Brahma. According to Hindu beliefs, if you bathe in the waters of Ganges, it will wash away your sins. However this is not very hygienic, as the river is badly polluted by cremated corpses, carcasses, waste from factories and more.  Where does this river empty?", The Bay of Bengal,The Bay of Bengal,Lop Nur,The Quarry Bay,Kara Sea
"Victoria Falls is one of the most spectacular waterfalls in the world. The falls are named after Queen Victoria by David Livingstone, the explorer who visited them in 1855. The falls are 128 m (420 ft) high and are situated on this river.", Zambezi,Zambezi,Congo,Gambia,Orange
"The Nile is generally considered the longest river in the world.  The source of this mighty river remained unknown for centuries. Finally Lake Victoria was decided to be its source, although there are other theories. Lake Victoria is located on the territories of these three countries."," Uganda, Kenya and Tanzania","Sudan, Ethiopia and Kenya","Zambia, Angola and Sudan","Uganda, Kenya and Tanzania","Egypt, Morocco and Zimbabwe"
"Name the line, which is the same distance from the North Pole and South Pole and runs horizontally around the world.", Equator,Tropic of Capricorn,Equator,Tropic of Cancer,Prime Meridian
"What term refers to the horizontal line, 23.5 degrees S, which passes through South America, Africa, and Australia?", Tropic of Capricorn,Tropic of Cancer,Prime Meridian,Tropic of Capricorn,Equator
Which continents are entirely in the Southern Hemisphere?, Australia and Antarctica,"South America, Africa, and Australia",Australia and Antarctica,"South America, Australia and Antarctica",South America and Australia
"Which continents (landmasses, not peripheral islands) are entirely in the Northern Hemisphere?"," North America, Europe, and Asia",North America and Europe,"Europe, Africa and Asia","North America, Africa, and Asia","North America, Europe, and Asia"
Which continents are entirely in the Western Hemisphere?, North America and South America,"North America, Europe, and Asia","Europe, Asia, Africa, Australia",Australia and Antarctica,North America and South America
Which feature on a map helps determine direction?, a compass rose,a key,a legend,a compass rose,a scale
Which of these is not a type of map projection?, Crusoe,Robinson,Crusoe,Mercator,Interrupted
Which of these continents is largest (by territory)?, North America,South America,Antarctica,North America,Europe
Which of these countries is smallest (by territory)?, San Marino,Seychelles,Liechtenstein,San Marino,Marshall Islands
Which of these US cities is largest (by population)?, Houston,Houston,Phoenix,Philadelphia,San Antonio
Which of these mountains is highest?, Mount McKinley,Puncak Jaya,Mount McKinley,Mount Elbrus,Mount Kilimanjaro
Which of these lakes is deepest?, Tanganyika,Caspian Sea,Malawi or Nyasa,Tanganyika,Issyk-Kul
Which of these rivers is longest?, Huang,Lena,Huang,Amur,Ob-Irtysh
Which of these seas is largest?, Mediterranean,Bering,Arabian Sea,Mediterranean,Gulf of Mexico
Which of these deserts is largest?, Syrian,Chihuahuan,Syrian,Thar,Great Sandy
Which of these inhabited places is wettest?, Moulein,Moulein,Sylhet,Baguio,Lae
Which of these oceans has the greatest depth?, Pacific Ocean,Pacific Ocean,Indian Ocean,Atlantic Ocean,Arctic Ocean
"The rivers - the Tajo, the Ebro, the Duero, and the Guadiana, are located in this country.", Spain,Columbia,Portugal,Spain,Brazil
"The volcanoes - Akan, Aso, Mount Fuji and Rausu are located in this country.", Japan,Japan,Malaysia,North Korea,Indonesia
"Onega, Khanka and Chudskoye are three of the many lakes in this country.", Russia,Kazakhstan,Mongolia,Ukraine,Russia
The valleys of the Yellow River and the Pearl River are two of the seven main national valleys in this country., China,Burma,China,Thailand,India
"Pico da Bandeira, Pico do Cruzeiro and Pedra da Mina are three of the numerous mountains located in this South American country.", Brazil,Argentina,Chili,Brazil,Peru
Chauvet Cave and Meyrieres Cave are two caves located in this European state., France,France,Netherlands,Spain,Belgium
Kainji Lake and Lake Chad are considered lakes of this country., Nigeria,Niger,Nigeria,Cameroon,Chad
"Mitchell, Jardine, Staaten, Flinders, Leichhardt, and Nicholson are just few of the rivers in this country.", Australia,Indonesia,Australia,Papua New Guinea,New Zealand
"Kaskaspakte, Akka and Sielmmacohkka are three mountains in this country.", Sweden,Norway,Finland,Denmark,Sweden
Dasht-e Kavir and Kavir-e Lut are deserts located in this Asian country., Iran,India,Iran,Pakistan,Iraq
Which two countries border the Dead Sea?, Jordan and Israel,Jordan and Israel,Lebanon and Jordan,Syria and Jordan,Lebanon and Israel
What are the Tropic of Cancer and the Tropic of Capricorn?, Lines of latitude,Lines of latitude,Lines of longitude,Parallel to the Greenwhich Meridian,None of these
Which statement about the emu and the kangaroo is not true?, Both are indigenous only to Australia.,Both are indigenous only to Australia.,Both are on the national emblem of Australia.,Both are incapable of flying.,Both are incapable of  walking backwards.
What was the former name of the city of Istanbul ?, Constantinople,Constantinople,Persia,Zaire,Siam
Where would you find the shortest river in the world?, Montana,Wales,Ecuador,Tasmania,Montana
What major geographical feature is located at 23.5 degrees North latitude?, The Tropic of Cancer,The Equator,The Arctic Circle,The Tropic of Capricorn,The Tropic of Cancer
Which would be found at 39 degrees 43 minutes North latitude?, The majority of the Mason-Dixon Line.,The Tropic of Cancer,The Tropic of Capricorn,The majority of the Mason-Dixon Line.,The border between Canada and  Washington State.
Which country held the record for the highest birth rate in the 2005 world statistics?, Niger,Niger,Uganda,Mali,Vatican City
How many US states border the Gulf of Mexico?, 5,4,3,5,10
"Measuring at the Equator, what is the closest approximation of the Earths circumference?"," 24,900 miles","24,900,000 miles","24,900 miles","249,000 miles","2,490,000 miles"
The people of which country watched the most TV per week in 2005?, Thailand,Thailand,The Philippines,The USA,Egypt
How many US states border the Pacific Ocean?, 5,11,4,5,3
Which one of these ski resorts is not located in the Alps?, Mont-Tremblant,Kitzbuhel,Zermatt,Mont-Tremblant,Chamonix-Mont-Blanc
The tallest mountain peak in the US is Mount McKinley. This is the second tallest., Mount Saint Elias,Mount Saint Elias,Glacier Peak,Mount Washington,Gannett Peak
Which one of these mountains is not a volcano?, Mount Aspiring,Mauna Kea,Mount St. Helens,Mount Vesuvius,Mount Aspiring
"The highest mountain peak on our planet is Mount Everest. It was first climbed by Edmund Hillary and Tenzing Norgay on May 29, 1953. What is the home country of Sir Edmund Hillary?", New Zealand,United Kingdom,The United States,France,New Zealand
"Which saltwater lake, bordered on the west by Azerbaijan and Russia, is the largest inland body of water in the world?", Caspian Sea,Tanganyika,Victoria,Baikal,Caspian Sea
"This country, situated in North Europe, has almost 200 000 lakes - more than any other country in the world.", Finland,Finland,Sweden,The Netherlands,Georgia
"Which body of water, situated in Southern Siberia, is the deepest and oldest freshwater lake on Earth?", Baikal,Onega,Ladoga,Huron,Baikal
"This water body, which is South Americas largest freshwater lake, is the highest commercially navigable lake.", Titicaca,Nyasa,Nicaragua,Titicaca,Michigan
This country has more than 60% of worlds lakes due to its special drainage system., Canada,Australia,Russia,Canada,The USA
"This freshwater-lake island, with a surface area of 2,766 km², is the biggest on Earth.", Manitoulin Island,Islandlake,Ainslie,Manitoulin Island,Isle of Wight
"What Canadian lake is the largest in the world, located on an island?", Nettilling Lake,Nettilling Lake,Aral,Winnipeg,Michigan
"This is the lowest lake on Earth, situated at about 400 meters below sea level on the border between Israel and Jordan.", Dead Sea,Issyk-Kul,Balkhash,Urmia,Dead Sea
Which tiny lake located in Tibet is the highest lake on Earth?, Lhagba Pool,Lhagba Pool,Rush Lake,Laguna Lobato,Poquentica Lake
"With a surface area of about 82,000 km², this lake between Ontario and Minnesota is the largest single freshwater lake in the world.", Lake Superior,Turkana,Michigan,Lake Superior,Onega
"The word volcano comes from the name of the Roman god of fire, Vulcan. Who is the analogue of Vulcan in Greek mythology?", Hephaestus,Hephaestus,Helios,Hermes,Zeus
"If magma contains more than 65% silica, the lava is called this.", felsic or acidic,felsic or acidic,thick,mafic or basic,dense
Which of the following states of America is an inland one and has an official motto that does not come from Latin?, Montana,Montana,Virginia,Oklahoma,South Carolina
"Which of the following states has an official motto In God we trust, which is also the official motto of the United States of America?", Florida,Georgia,Washington,South Dakota,Florida
Three of these US states have an official motto related to liberty. Spot the odd one., Oklahoma,Iowa,Oklahoma,New Jersey,New Hampshire
"This famous Latin maxim, which is the official motto of South Carolina, means While I breathe, I hope.", Dum spiro spero,Si quaeris peninsulam amoenam circumspice,Nil sine numine,Salus populi suprema lex esto,Dum spiro spero
Three of the following US states have a motto consisting of one single word in English. Which one does not belong to the group?, West Virginia,Utah,Texas,West Virginia,Rhode Island
"North to the Future is the official motto of this US state, which is the largest in area.", Alaska,Texas,Alaska,Nevada,Colorado
"Which of the following maxims, meaning The people rule, is the official state motto of Arkansas?", Regnat populus,Esto perpetua,Regnat populus,Dirigo,Ditat Deus
"This famous exclamation, which has been attributed to ancient scientist Archimedes, is the official state motto of California.", Eureka,Excelsior!,Virtute et armis,Ad astra per aspera,Eureka
The official motto of this state in the Pacific Northwest of the United States comes from Chinook Jargon., Washington,Wisconsin,Washington,Pennsylvania,New York
Which of these states has an official motto that doesnt include the word rights in it?, Indiana,Iowa,Indiana,Wyoming,Alabama
"Which volcano, located on Ross Island, Antarctica, is the southernmost active volcano on Earth?", Mount Erebus,Mayon Volcano,Cold Bay Volcano,Mount Erebus,Teide
"This volcano, which is the largest in Europe, is located on the largest island in the Mediterranean Sea.", Mount Etna,Mount Etna,Hekla,El Misti,Santorini
"Popocatépetl, a volcano whose name means Smoking Mountain, is 70 km away from the capital of which American country?", Mexico,Mexico,Peru,Canada,Argentina
"Mount Vesuvius, that is notorious for the destruction of two Roman cities in the year 79, was linked most closely to which hero and demigod?", Hercules,Asclepius,Apollo,Zeus,Hercules
"What is the biggest extinct volcano in Ecuador, situated in the Andes mountain.", Chimborazo,Chimborazo,Ojos Del Salado,Llullaillaco,Cotopaxi
"This dormant volcano, which is 66 km northeast of Tehran, is the symbol of Iranian resistance against foreign rule.", Mount Damavand,Mount Hood,Krakatoa,Mount Damavand,Krafla
"This active volcano, whose name means long mountain in Hawaiian, is one of the five peaks that form the Island of Hawaii.", Mauna Loa,Cotopaxi,Mauna Loa,Mount Kea,Hekla
What volcano located on the island of Tenerife represents the highest mountain on Spanish territories?, Teide,Teide,Stromboli,Santorini,Duvalo
"The name of this volcano, located on the Alaska Peninsula, means new eruption.", Novarupta,Newatsa,Mount Rainier,Novarupta,Mount Hood
Which is the volcanically active region that is situated in a famous national US park and has a territory of 55 kilometers by 72 kilometers?, Yellowstone Caldera,Yosemite Valley,Yellowstone Caldera,Mount Shasta,Cold Bay Volcano
Where is the southernmost point in all 50 states?, Hawaii,Texas,Hawaii,Florida,California
"And where is the lowest point in the USA, North America, and western hemisphere? I need the state and national park name."," California, Death Valley NP","Maine, Acadia NP","California, Death Valley NP","Arizona, Grand Canyon NP","Wyoming, Yellowstone NP"
The state with the largest area in the lower 48 is?, Texas,California,Texas,Montana,Arizona
"England, Norway, Belgium and Denmark all border this sea.", North sea,Baltic sea,Black sea,North sea,Aegean sea
"Towards the beginning of the new millennium, three of these four countries had a population of approximately 32 million people. Which is the odd one?", Colombia,Algeria,Kenya,Colombia,Morocco
"Ireland, Germany and Austria are famous for the high consumption of this alcohol.", Beer,Brandy,Beer,Wine,Vodka
"This island is well known in scientific fields for being home of five percent of the worlds plant and animal species, with 80% of them unique to it. The island is also the fourth biggest on Earth, with population of about 17,500,000 people.", Madagascar,Greenland,Madagascar,New Guinea,Tasmania
"In Greek mythology, this island is the legendary birthplace of the goddess of beauty, love, and passion, the charming Aphrodite, where according to the legend, she emerged from the sea foam.", Cyprus,Crete,Cyprus,Limnos,Rhodes
"Because of its spectacular nature forms, one of this insular countrys islands has been a set for the filming of many movie productions, including the highly successful, Lord of the Rings and The Chronicles of Narnia.", New Zealand,The Philippines,New Zealand,Indonesia,New Guinea
"Despite being the largest in the world, this island is sparsely populated, due to its unfavourable climate.", Greenland,Greenland,New Guinea,Victoria Island,Madagascar
"Being the most populous in the world, with bigger population than Australia and Antarctica, the density of this islands inhabitants forced the countrys government to start transmigration programs, aimed at resettling people to other, less-crowded parts of the country.", Java,Java,Sumatra,Borneo,Sulawesi
"This is the largest island in the Mediterranean Sea, famous for one of the worlds most active volcanoes - Etna.", Sicily,Sicily,Crete,Sardinia,Corse
"Al Nakheel Properties, one of the leading real estate developers in Dubai and creator of the worldwide famous Palm Islands, is also the initiator of another grand project of artificial islands, which resembles the shape of what?", The globe,A seashell,The globe,A human face,A dolphin
"Which of the following is a traditional Vietnamese clothing, worn primarily by women?", Áo dài,Qipao,Áo dài,Nhu,Raglan
The gowni is a typical national costume in which African country?, Tanzania,Tanzania,Malawi,Uganda,Indonesia
These knee-breeches made of leather are a traditional Bavarian garment., Lederhosen,Kilt,Lederhosen,Kisen,Wrestlers
"Hijab, which is also a term meaning barrier, is worn as a traditional clothing in which countries?", Arabic,African,European,Arabic,Latin
Which of these national costumes is closely related to Sikhism - a religion that comes from 16th-century northern India?, Turban,Khalsa,Sari,Turban,Sayyid
Barong is the embroidered formal garment of which country in South-East Asia?, The Philippines,Russia,Indonesia,The Philippines,Japan
Which of these national costumes does not belong to a European nation?, Hanfu,Hanfu,Tracht,Kilt,Kroje
Which one of the following national costumes is not Chinese?, Kente cloth,Kente cloth,Qipao,Cheongsam,Mao suit
Which of these pieces of clothing is worn on the head?, Fez,Fez,Mitumba,Koto,Kiondo
"Three of the enlisted national garments are African, while the fourth one is Norwegian. Which one?", Bunad,Sanafil,Bunad,Dashiki,Boubou
"According to the legend, which of these is a part of the Three Fortunate Concealments that protect Britain from any danger coming from the sea?", The head of Bran the Blessed,The head of Bran the Blessed,Stone of Destiny,The Dragons,The bones of Gwerthefyr the Blessed
While driving or walking down Kings Cross Road and Farringdon Road in London few people are aware that unseen beneath them runs which river?, River Fleet,River Thames,River Avon (Shakespeares Avon),River Rhodda,River Fleet
Who made the statue of King Richard I outside the Houses of Parliament in Old Palace Yard in London?, Baron Carlo Marochetti,John Doubleday,Baron Carlo Marochetti,Sir George Frampton,Joseph Edgar Boehm
"The Great Pavement, a hidden, unknown to most tourists and seldom-displayed treasure, is located in which building in London?", Westminster Abbey,Buckingham Palace,Tate Gallery,St Jamess Palace,Westminster Abbey
"The Old Royal Observatory, which is a part of the National Maritime Museum in London, was built in what year?", 1675,1675,1765,1567,1657
"This famous writer, whose house was at 17 Gough Square in London, said: When a man is tired of London, he is tired of life, for there is in London all life can afford.", Dr Samuel Johnson,Charles Dickens,Dr Samuel Johnson,Thomas Chestre,Tomas John Dibdin
"The Badwater basin, the lowest point in North America, is located in which US valley?", Death Valley,Sun Valley,Death Valley,Big Smoky Valley,Hudson Valley
"The Big Smoky Valley, that runs between the Toiyabe Range and the Toquima Range, is located in which US state?", Nevada,Minnesota,Indiana,Oregon,Nevada
The Grand Valley is an extended populated agricultural valley located along which US river?, Colorado River,Alabama River,Mississippi River,Colorado River,Missouri River
"Which scenic US valley was described by conservationist John Muir in the following way: (...) None can escape its charms. Its natural beauty cleans and warms like a fire, and you will be willing to stay forever in one place like a tree.?", Yosemite Valley,Willamette Valley,Yosemite Valley,Sun Valley,Yakima Valley
This densely populated valley in the state of Utah is enclosed by steep mountains in every direction except the northwest., Salt Lake Valley,St. Lawrence Valley,Livermore Valley,Las Vegas Valley,Salt Lake Valley
The Shenandoah Valley in western Virginia derives its name from a Native American expression meaning what?, Beautiful Daughter of the Stars,Beautiful Daughter of the Fields,Beautiful Mother of the Fruits,Beautiful Mother of the Land,Beautiful Daughter of the Stars
"Owens Valley, the arid ranching valley of the Owens River, stretches for approximately 75 miles (120 km) on the territory of which US state?", California,California,Arkansas,Alabama,Arizona
"According to the 2000 Census, what is the approximate population of The Bronx, New York?", 1.3 million,"530,000",1.3 million,"930,000","130,000"
"Who was the first European to see The Bronx, NY?", Henry Hudson,Henry Hutchinson,Jonas Bronck,Henry Hudson,Jonas Valerian
"Which one of these statements is true about The Bronx, NY?", The only borough that is not an island,The only borough with a zoo,The only borough  that has no colleges,The only borough that is not an island,The highest  borough above sea level .
"In 1643, a Native American uprising killed this unauthorized Puritan preacher of a dissident church discussion group, and pioneer in Rhode Island and the Bronx.", Anne Hutchinson,Peter Cooper,Richard Morris,Anne Hutchinson,Roger Williams
"This oldest house in The Bronx, build in 1748, is New York Citys first house museum, operated since 1897 as a public museum by The National Society of Colonial Dames in the State of New York.", Van Cortlandt House,Valerian House,Van Cortlandt House,Throgs Neck,Fordam Arms
"In 1776, 400 British and Hessian troops land in The Bronx.  A group of 400 American troops held them off while Washington got the main army away safely.  What was this battle called ?", The Battle of Pells Point,The Battle of Pells Point,The Battle of Throgs Neck,The Battle of Eastchester,The Battle of The Bronx
"The first college in The Bronx, known as this today, was built in 1884.", Fordham University,Mercy College,Manhattan College,Fordham University,Lehman College
Edgar Allen Poe wrote this famous poem in The Bronx in 1846., Annabel Lee,Call Me Ishmal,Our American War,Annabel Lee,Hiawatha
"In 1899, this  world famous institution was opened in The Bronx.", The Bronx Zoo,Columbia University,The U.S. Olympic Hall of Fame,The Bronx Zoo,The American Hall of Fame
This world famous building opened in The Bronx in 1923., Yankee Stadium,The Top of the Sixes,Yankee Stadium,The Louis Morris Building,The Shlump Towers
"What are the colors on the flag of  The Bronx, NY?"," Blue, White, Orange","Red, White, Blue","Blue, White, Green","Blue, White, Orange","Red, Green, Orange"
Little Rock is the capital and most populous city of this US state., Arkansas,Arkansas,Wichita,Kansas,Topeka
"What US state borders the states of Virginia, Kentucky, Ohio, Pennsylvania and Maryland?", West Virginia,Tennessee,Virginia,West Virginia,North Carolina
Which US state is nicknamed The Pine Tree State?, Maine,New Hampshire,Missouri,Massachusetts,Maine
The southern region of what US state is known as Little Egypt?, Illinois,Virginia,Illinois,Ohio,Maryland
"The capital city of this US state is Trenton, and its largest city is Newark.", New Jersey,Montana,New Hampshire,New Mexico,New Jersey
The name of which American state means red people in the Choctaw language?, Oklahoma,Ohio,Oklahoma,North Dakota,Oregon
What US state is known as The Volunteer State?, Tennessee,Utah,Delaware,Tennessee,Colorado
The flag of what US state features a gold torch and nineteen stars on a blue rectangular field?, Indiana,Illinois,Idaho,Indiana,Iowa
What US state is known as the Peach State?, Georgia,Louisiana,Georgia,Montana,Connecticut
The name of this US state means flat water and is derived from the name of the Platte River that flows through the state., Nebraska,Montana,Nebraska,Utah,Oklahoma
Which country is known as Österreich in their native language?, Austria,Bulgaria,Germany,Austria,The Netherlands
Which countrys capital city is considered de facto capital of the European Union?, Belgiums,UKs,Hollands,Belgiums,Frances
Which country has the river Danube as most of its northern border?, Bulgaria,Austria,Hungary,Bulgaria,Romania
Which EU member is divided into a Greek and a Turkish part?, Cyprus,Greece,Slovenia,Cyprus,Bulgaria
