Questions,Correct,A,B,C,D
"The Black Sea reaches the maximum depth of 2,210 m. Its neighbor, the Sea of Azov, is unique in terms of sea depth for what reason?", It is the shallowest sea in the world.,Its floor sinks constantly because it is located on a large basalt plate.,It is the shallowest sea in the world.,It has almost perfectly flat sea floor with a depth of 1370 m.,"It has no established sea floor, it changes constantly with currents."
All these entities are located around the Black Sea except for one. Name the exception., Ural mountains,Ural mountains,Balkan peninsula,Caucasus mountains,Anatolia
The summit ridge of Mount Everest marks the border between which two Asian countries?, China and Nepal,India and China,Nepal and India,China and Georgia,China and Nepal
The locals of Nepal call the highest mount in the world - Mount Everest -  Sagarmatha. What is the meaning of this name in Sanskrit?, Head of the Sky,Holy Mountain,Ice Zone,Leader Among the Others,Head of the Sky
"The highest mountain in the world is named after Sir George Everest, a famous Welshman. What was his profession?", Surveyor and geographer,Defender of human rights,Actor,Surveyor and geographer,President
"The Himalayan range, part of which is Mount Everest, stretches across five different countries in Asia. Which of the following countries is not among them?", Israel,Israel,Bhutan,Pakistan,India
"Edmund Hillary, the first mountaineer to reach mount Everest, was from what country?", New Zealand,The USA,Great Britain,Norway,New Zealand
"What nationality was mathematician and surveyor Radhanath Sikdar, who was the first person to measure the height of Everest?", Bengali-Indian,Bengali-Indian,Chinese,Pakistani,Tibetan
Which of the following paths is one of the two most popular climbing routes to Mount Everest?, The southeast ridge from Nepal,The south ridge from Tibet,The east ridge from Pakistan,The west ridge from India,The southeast ridge from Nepal
What nationality was Junko Tabei - the first woman to reach the peak of Mount Everest?, Japanese,Japanese,Chinese,Indian,Nepalese
"This Italian climber, who was in the first expedition to reach Mount Everest without oxygen tanks, later became the first person to climb the summit alone.", Reinhold Messner,Reinhold Messner,Laurie Skreslet,Jerzy Kukuczka,Tim Macartney
"The term death zone refers to high altitudes, where the amount of oxygen cannot sustain human life and altitude acclimatization becomes impossible.  While this definition still applies, mount Everests death zone is significantly more difficult to survive.  Why?", Extremely low temperatures result in quick freezing of body parts,Visibility is decreased due to constant snowstorms,Extremely low temperatures result in quick freezing of body parts,High wind velocity causes deadly avalanches,Polar bears pose a serious threat to climbers
What is the largest island on the planet in terms of territory?, Greenland,Madagascar,Sumatra,Greenland,New Guinea
"This island, located north of Australia, is the second-largest island on the planet.", New Guinea,Tasmania,New Guinea,South Island,Sri Lanka
"This is the third-largest island on the planet, and it is also known as Kalimantan.", Borneo,Bali,Borneo,Taiwan,Java
"This is the fourth-largest island in the world, and it is home to 5% of the plant and animal species on the planet.", Madagascar,Jamaica,Madagascar,Tasmania,Cuba
"This is the largest European island, and the ninth-largest island on the planet.", None of these,Sicily,Sardinia,None of these,Cyprus
"What is the largest island of Canada, and the fifth-largest island in the world?", Baffin Island,Victoria Island,Baffin Island,Banks Island,Devon Island
What is the most populous island in the world?, Java,Java,Cuba,Borneo,Honshu
This island is located in the Indian Ocean and is also known as Ceylon., Sri Lanka,Borneo,Taiwan,Sumatra,Sri Lanka
The capital of this island country is Kingston., Jamaica,Jamaica,Haiti,Hispaniola,Cuba
What is the largest island in the Mediterranean Sea?, Sicily,Crete,Corsica,Sicily,Cyprus
"In 1728, he became the first person to sail into the Arctic Ocean and proved that Asia and North America are not joined by land.", Bering,Cook,Bering,Scott,Peary
Who is given credit  for being the first person to reach the North Pole?, Peary,Peary,Bering,Amundsen,Scott
"What happened at the North Pole on August 3, 1958?", A submarine travelled underwater under the Pole.,"The northernmost US city, Naavetau, was founded.",The first airport in the Arctic was built.,A submarine travelled underwater under the Pole.,The last Arctic Moa was killed.
The first time Antarctica was officially visited is a subject of controversy. Three people have claimed to have achieved this feat. Which of these is not one them?, James Cook,Edward Bransfield,Nathaniel B. Palmer,Fabian von Bellinghausen,James Cook
Which statement is true about the explorer and glaciologist Albert P. Crary?, He was the first person to reach both the North and South Poles.,He was the first person to set foot on Antarctica.,He was the first pilot to fly across the South Pole.,He was the first person to build a home above the Arctic Circle.,He was the first person to reach both the North and South Poles.
Who was the first person to reach the South Pole?, Amundsen,Scott,Amundsen,Henson,Peary
Where are the origins of the Rhine?, Switzerland,Switzerland,Austria,Belgium,Germany
What is the longest river in France?, Loire,Loire,Maine,Odet,Erdre
"What river rises in the northwestern Czech Republic, flows through Germany and into the North Sea?", Elbe,Elbe,Viskan,Morava,Oste
What river named after a mythological figure is the longest river of Great Britain?, Severn,Trent,Great Ouse,Thames,Severn
What river flows through ten European countries and is the longest in the European Union?, Danube,Rhine,Dnieper,Danube,Elbe
What river that flows through Spain and Portugal is the longest river on the Iberian Peninsula?, Tagus,Guadiana,Duero,Guadalquivir,Tagus
What is the longest river in Poland and the ninth longest in Europe?, Vistula,Wda,Nogat,Vistula,Dunajec
In what country does the River Po rise?, Italy,France,Italy,Belgium,Switzerland
"This bridge, that spans the Tagus River, is the longest bridge in Europe.", Vasco da Gama Bridge,Vizcaya Bridge,Guadiana International Bridge,Vasco da Gama Bridge,Merida Bridge
How would you say What is your name? in Tagalog?, Ano ang pangalan mo?,Ilang taong gulang ka na?,Ano ang ginagawa mo?,Ano ang pangalan mo?,Saan ka nakatira?
The Filipino word pangalan means name in English. What does the word pangngalan mean?, noun,address,adjective,noun,verb
What does the Filipino word salita mean in English?, word,word,phrase,sentence,meaning
How will you say I Love You in Filipino?, Mahal Kita,Mahal Kita,Ikaw Na Nga,Sino Ka,Hindi Ko Alam
Who is considered the Father of Filipino Language?, Manuel Quezon,Gloria Macapagal-Arroyo,Ferdinand Marcos,Emilio Aguinaldo,Manuel Quezon
"This western half of this island is part of Indonesia, while the eastern half is a nation which gained independence in 2002, following hundreds of years of European colonialism and 25 years of Indonesian occupation.", Timor,Borneo,Sumatra,Timor,Celebes
Which Indonesian island is shared by four Indonesian provinces and two other nations: the eastern half of Malaysia and the tiny oil-rich sultanate of Brunei?, Borneo,New Guinea,Sumatra,Borneo,Flores
"These islands were the original spice islands, which have drawn traders from all over the world for thousands of years, and were a major factor in causing the European age of exploration, as explorers set out to find the fabled East Indies."," Ternate, Tidore and Banda","Ternate, Tidore and Banda","Timor, Flores and Sumba",Celebes and New Guinea,Sumatra and Borneo
"Which Indonesian island was in the news in 2003 when the remains of an extinct variety of small hominids (popularly referred to as Hobbits), measuring about 3 feet in height, were found there?", Flores,Sumatra,New Guinea,Timor,Flores
"This island, the second largest in the world, is shared by Indonesia and another country. Because of its impenetrable swamps, jungles and towering mountains, it wasnt explored by outsiders until the past 100 years, and new tribes of humans with stone-age societies are still being discovered in the interior.", New Guinea,New Guinea,Flores,Celebes,Sumatra
"This island is the third largest in Indonesia, and is probably known for its coffee. It is also home to unique (and endangered) species of elephants, tigers, and rhinoceroses. It is also one of two islands which have indigenous orangutans.", Sumatra,Timor,Sumatra,New Guinea,Celebes
"Which of these describes best the location of the volcanic island of Krakatau (sometimes erroneously called Krakatoa), which had a well-known and devastating eruption on August 23, 1883?", Between Java and Sumatra,West of New Guinea,East of Java,Between Java and Sumatra,Off the coast of Borneo
"This volcano, located on the island of Sumbawa, erupted in 1815, generally regarded as the largest volcanic eruption in recorded history. The eruption killed thousands, and changed global climatic patterns.", Tambora,Merapi,Krakatau,Mandiri,Tambora
"Wichita, the county seat of Sedgwick County, is nicknamed what?", Air Capital,Air Capital,Mountain Capital,Plain Capital,River capital
What is the capital and largest city of Italy?, Rome,Milan,Genoa,Rome,Venice
What large mountain range is located entirely within the territory of Italy?, Apennines,Alps,Andes,Apennines,Carpathians
Italy is a major world exporter of which of the following?, All of these,All of these,Sport and luxury vehicles,Motor vehicles,Fashion items
"What is the meaning of the Italian word riavvolgere, from which the name of the popular Italian dish ravioli originated?", To wrap,Poor peasant,Onion,To wrap,To indulge
Which of these colors is not present on the national flag of the Italian Republic?, Blue,White,Red,Blue,Green
What is the title of the national anthem of the Italian Republic?, The Song of the Italians,The Italian Anthem,The Song of the Italians,"Italia, Land of Glory",Italian Dream
What is the meaning of the name of Italy according to scientists who have studied its origin?, Land of young cattle,Land of the holy water,Land of the lamb,Land of young cattle,Land of mountains
What is the shape of the Italian Peninsula?, Boot,Skull,Boot,Dog,Hand
In which of these years did the Italian national football team win the FIFA World Cup?, All of these,1982,2006,All of these,1938
Maryland Day is celebrated every year on what date?, March 25th,The first day of crab season,Preakness Saturday,March 25th,March 1st
Which was the seat of colonial government in Maryland until 1708?, St. Mary’s City,Annapolis,Port Tobacco,Baltimore,St. Mary’s City
The Mason Dixon Line is a demarcation line surveyed between 1763 and 1767 by Charles Mason and Jeremiah Dixon to determine what?, The boundary between Maryland and Pennsylvania,The boundary between the confederacy and the union,The boundary between the slave states and free states,The boundary between Maryland and Pennsylvania,The boundary between southern colonies and northern colonies
What are Maryland’s two official state nicknames?, “The Old Line State” and “The Free State”,“The Old Line State” and “The Free State”,“The Crab State” and “Our Chesapeake Heritage”,“The Crab State” and “The Old Line State”,“The Free State” and “Our Chesapeake Heritage”
"Maryland derives its name from its Catholic founders, who named the state after which historic person?", Queen Henrietta Maria of France,"Mary, Queen of Scots",Mary Magdalene,The Virgin Mary,Queen Henrietta Maria of France
What is the state sport of Maryland?, Jousting,Steeplechase,Jousting,Lacrosse,Horse racing
Which of the following famous people is NOT a Marylander?, Valerie Bertinelli,John Wilkes Booth,Frederick Douglass,Tom Clancy,Valerie Bertinelli
Which is the state flower of Maryland?, Black-eyed Susan,Mountain Laurel,Peach Blossom,Black-eyed Susan,Flowering Dogwood
How tall is Mount Everest?," 8,849 m","8,859 m","8,849 m","8,850 m","8,840 m"
What is the Tibetan name of Mt. Everest?, Chomolungma,Appa Sherpa,Sagarmatha,Chomolungma,Temba Tsheri
The term Death Zone refers to what altitude?," above 8,000 m","above 8,100 m","above 8,000 m","above 7,900 m","above 7,500 m"
What is considered to be the final major hurdle before reaching the summit of Mt. Everest from the South Col Route?, Hillary Step,Hillary Step,"First Step, Second Step and Third Step",Kangshung face,Lhotse face
"Who is the first American to ascend all fourteen peaks over 8,000m without oxygen?", Ed Viesturs,Reinhold Messner,Peter Habeler,Ed Viesturs,George Mallory
"During Roman occupation, this city, popular nowadays as the Heaven of Romance, was called Lutetia.", Paris,Venice,Paris,London,Rome
In what European city are Piazza San Marco and Canale Grande located?, Venice,Venice,Lisbon,Madrid,Florence
"In what country will you find the impressive Neuschwanstein Castle, which was the inspiration for Sleeping Beauty Castle at Disneyland Park?", Germany,Denmark,Austria,Germany,England
"What is the birthplace of Johann Strauss II, also known as The Waltz King?", Vienna,Salzburg,Vienna,Berlin,Prague
What popular tourist destination stands at the foot of the Maritime Alps?, Monte Carlo,Monte Carlo,Verona,Vatican City,Lisbon
"This city, situated on the River Vltava, is sometimes called the mother of cities, the city of a hundred spires and the golden city.", Prague,Athens,Rome,Prague,Bucharest
What city is home of Broadway Theatre?, New York,Washington,Boston,New Orleans,New York
This island in the Pacific Ocean is surrounded by a lagoon and a barrier reef., Bora Bora,Bora Bora,Cyprus,Thasos,Tupai
"The city of Casablanca, which is the setting of the classic 1942 movie, starring Humphrey Bogart and Ingrid Bergman, is located in what African country?", Morocco,Egypt,Morocco,Tunisia,Algeria
What islands are knows as “The beautiful garland in the Indian Ocean”?, Maldives Islands,Aeolian Islands,Pontine Islands,Flegrean Islands,Maldives Islands
"This island, located in the Caribbean Sea, is the largest island of an archipelago called Greater Antilles. The city of Havana is located on it.", Cuba,Cuba,Hispaniola,Haiti,Jamaica
"This island, also known as Formosa, is the largest island of the Republic of China.", Taiwan,Matsu,Taiwan,Penghu,Honshu
"What island, located in the North Pacific Ocean, is also known as the Big Island?", Hawaii,Cuba,Haiti,Hawaii,Maui
This island country whose capital is Nicosia is the third-largest Mediterranean island., Cyprus,Cyprus,Crete,Malta,Lesbos
This island is one of Indonesias 33 provinces., Bali,Java,Sumatra,Bali,Lombok
"This European island is situated in the North Atlantic Ocean, south of the Arctic Circle. Its largest city is Reykjavik.", Iceland,Iceland,Ireland,Greenland,None of these
"This is the sixth largest island in the world, and the largest island that is entirely in Indonesia.", Sumatra,Sumatra,New Guinea,Java,Borneo
"This island, sometimes called island of inspiration, is part of a very large country, and has a unique fauna.", Tasmania,Hawaii,Tasmania,Madagascar,Greenland
Valletta is the capital city of this island country in the Mediterranean., Malta,Majorca,Malta,Corsica,Cyprus
Name the largest of the Canary Islands., Tenerife,Tenerife,Gran Canaria,La Palma,Montana Clara
What is the name of the capital and largest city of Spain?, Madrid,Madrid,Rome,Milan,Valencia
What is the meaning of the name of Spain according to a popular theory?, All of these,Land of rabbits,All of these,Edge,Land of the setting sun
Spain does not share a border with which one of these countries?, Germany,Germany,Portugal,France,Andorra
What is the official language spoken on the territory of Spain?, Spanish,All of these,Spanish and Galician,Spanish and Basque,Spanish
When is the national holiday called Hispanic Day celebrated annually in Spain?, October 12,October 12,August 15,December 6,December 8
What is the title of the national anthem of Spain?, The Royal March,My Precious Kingdom,God Save Spain,Proud Spain,The Royal March
What are the colors of the three vertical stripes on the national flag of Spain?," Red, yellow, red","Blue, white, blue","Yellow, red and black","Red, yellow, red","White, blue and red"
What is the main ingredient of the traditional Spanish dish paella?, Rice,Lentils,Rice,Dough,Potatoes
Which of these popular musicians was not born in Spain?, Shakira,Paco de Lucia,Shakira,Alejandro Sanz,Enrique Iglesias
Spanish painter and sculptor Pablo Picasso is known for co-founding what art movement?, Cubism,Cubism,Expressionism,Surrealism,Neorealism
In which section of Israel is Eilat located?, South,East,West,South,North
When was the city of Eilat founded?, 1951,1951,1939,1941,1929
What is the population of Eilat according to the Israel Central Bureau of Statistics end of 2004 census?," 45,800","45,800","179,400","79,200","129,700"
What best describes the climate of Eilat?, Hot and dry all year,Hot and dry all year,Humid and hot  summers and humid and cool winters,"Humid, hot summers and dry, cool winters","Hot, dry summers and humid, cool winters"
Which city is a sister city to Eilat?," Los Angeles, California","Hollywood, Florida","West Palm Beach, Florida","Los Angeles, California","Boca Raton, Florida"
Which is the major source of revenue for the Eilat area?, Tourism,Agriculture,Tourism,Jewelry,Mining
"In 1967, Egypt effectively blockaded Eilat by closing this area to Israel.", The Straits of Tiran,The Golan Heights,The Sinai Peninsula,The Straits of Tiran,The Suez Canal
The Peace Treaty between Jordan and Israel was signed near Eilat. In what year did this happen?," October, 1994","October, 2004","October,1968","October, 1975","October, 1994"
Where does the Freedom Trail begin and end?," Boston Common, Charlestown Navy Yard","Kings Chapel, Bunker Hill Monument","Trinity Church, Long Wharf","Boston Public Gardens, Old North Church","Boston Common, Charlestown Navy Yard"
"On October 24, 1901, Annie Edson Taylor became the first person to go over the Niagara Falls in a barrel as a publicity stunt. How old was she at the time?", 63,63,23,43,33
What is the famous Niagara boat called?, Maid of the Mist,Niagara-on-the-Lake,Lady Horseshoe,Maid of the Mist,Lady of the Mist
Name the smallest of the three waterfalls that make up the Niagara Falls., Bridal Veil Falls,Bridal Veil Falls,There are only two waterfalls that make up the Niagara Falls.,Goat Falls,Horseshoe
Approximately what percentage of the water of the Niagara River flows over the Horseshoe Falls?, 90%,70%,90%,50%,10%
The flow of the water over the American Falls was completely blocked from June to November in what year?, 1969,1942,1969,1983,1936
How long is the crest of the American Falls if measured along the jagged lip of the falls?, 950  feet  (290 m),393  feet  (120 m),950  feet  (290 m),688  feet  (210 m),1310 feet  (400 m)
What event related to the Niagara Falls occurred on March 29th 1848?, The flow of water over both falls stopped to the point where people could walk around the riverbed.,The flow of water over both falls stopped to the point where people could walk around the riverbed.,The flow of water was stopped completely over the American Falls.,The waterfalls were named,"A third, much smaller waterfall was discovered."
"The cities of Niagara Falls, Ontario and Niagara Falls, New York are connected by three bridges. Which of them is the oldest one?", Whirlpool Rapids Bridge,Whirlpool Rapids Bridge,Rainbow Bridge,Kingston Bridge,Lewiston-Queenston Bridge
"When was the Skylon Tower, Niagaras most famous landmark, built?", in the 1960s,in the 1950s,in the 1940s,in the 1960s,in the 1990s
"Around the year 1859, Jean-François Blondin crossed the gorge below Niagara Falls on a tightrope 1100 feet (335 m) long, 160 feet (50 m) above the water. He made this accomplishment several times including which of the following theatrical variations?", All of these,All of these,He carried his manager on his back.,He sat down midway while he cooked and ate an omelette.,He was blindfolded.
Which U.S. state is nicknamed The Natural State?, Arkansas,Alabama,Alaska,Arizona,Arkansas
What nickname has been given to the U.S. state of Oregon?, Beaver State,All of these,Marmot State,Beaver State,Otter State
What U.S. state is nicknamed Land of Infinite Variety?, South Dakota,South Carolina,Florida,Delaware,South Dakota
Which of these nicknames has been given to the U.S. state of Colorado?, Switzerland of America,Sweden of America,Himalayas of America,All of these,Switzerland of America
Which of these nicknames has been given to the U.S. state of Illinois?, Corn State,Corn State,Rubber State,Cotton State,Paper State
"This U.S. state was nicknamed Vacationland, and the nickname is used on license plates.", Maine,Hawaii,Maine,Nevada,California
The Independence State is one of the nicknames of this U.S. state., Pennsylvania,Virginia,New Hampshire,Pennsylvania,West Virginia
Which U.S. state is nicknamed The Cowboy State?, Wyoming,Texas,Iowa,Wyoming,Idaho
What nickname has been given to the U.S. state of Rhode Island?, Ocean State,Ocean State,Marine State,Island State,All of these
The nickname Queen State has been given to this U.S. state., Maryland,West Virginia,Virginia,All of these,Maryland
"Which country, Slovakia or Slovenia, used to be part of Yugoslavia?", Slovenia,Slovenia,Both,Slovakia,None of them
Which former empire were both Slovenia and Slovakia part of?, Austria-Hungary,Austria-Hungary,Byzantium,Ottoman Empire,Roman Empire
"Slovakia and Slovenia joined the European Union on the same day (May 1, 2004). Which of them was first to accept the euro currency?", Slovenia,None of them has accepted the EURO currency.,Both did on the day of their accession to the EU.,Slovakia,Slovenia
What is the capital of Slovakia?, Bratislava,Ljubljana,Prague,Zagreb,Bratislava
What is the capital of Slovenia?, Ljubljana,Prague,Bratislava,Ljubljana,Zagreb
Which country borders both Slovenia and Slovakia?, Austria,Serbia,Austria,Poland,Germany
Which statement concerning Slovakia and Slovenia is true?, Slovenia has access to the Adriatic Sea.,Both countries have access to the Black Sea.,Slovenia has access to the Adriatic Sea.,Slovakia has access to the Baltic Sea.,Both countries are landlocked.
The Danube river flows through many Central European countries. Which of these statements concerning Slovakia and Slovenia is true?," Of the two countries, only Slovakia has Danubian banks.",The Danube does not flow through either of the 2 countries.,The Danube originates in Slovakia and then enters Slovenia.,"Of the two countries, only Slovakia has Danubian banks.",The Danube originates in Slovenia and then flows through Slovakia.
Which of these statements regarding Slovakia and Slovenia is true?, Only Slovenia is an Alpine country.,Only Slovakia is an Alpine country.,Only Slovenia is an Alpine country.,None of them is an Alpine country.,Both are Alpine countries.
"Which country, Slovakia or Slovenia, borders a country that did not join the European Union in the period 1951-2007?", Both share borders with countries that did not became EU members during this period.,Only Slovakia borders a country that did not join the EU during this period.,Both share borders only with countries that became EU members during this period.,Both share borders with countries that did not became EU members during this period.,Only Slovenia borders a country that did not join the EU during this period.
What design is depicted on the national flag of Switzerland?, Cross,Sun,Cross,Star,Leaf
Switzerland is often associated with this product which is produced at the highest quality in the country., All of these,Chocolate,Watches,All of these,Cheese
What is the unofficial national motto of Switzerland?," One for all, all for one",Progress ans prosperity,In God we trust,"One for all, all for one",Higher and stronger
What is the capital city of Switzerland?, Bern,Bonn,Bern,Berlin,Zurich
What mountain covers about 65% of the territory of Switzerland?, the Alps,the Apennines,the Andes,Ararat,the Alps
What language is adopted as official for the territory of Switzerland?, All of these,German,Italian,French,All of these
What is the title of the national anthem of Switzerland?, Swiss Psalm,Swiss Vow,Swiss Song,Swiss Anthem,Swiss Psalm
What is the main ingredient of the traditional Swiss dish Rosti?, Potatoes,Cheese,Cabbage,Fish,Potatoes
What is the largest city in Switzerland?, Zurich,Geneva,Zurich,Bern,Munich
Which of these famous philosophers was of Swiss descent?, Jean-Jacques Rousseau,Jean-Jacques Rousseau,Michel Foucault,Friedrich Schiller,Jean-Paul Sartre
Which of these is the capital and the largest city in North Korea?, Pyongyang,Nampho,Hungnam,Sinuiju,Pyongyang
What type of climate does North Korea have?, Continental,Oceanic,Humid subtropical,Continental,Tropical
"Which of these seas surrounds the Korean Peninsula, in the northern part of which North Korea is located?", All of these,All of these,East China Sea,Sea of Japan,Yellow Sea
The establishment of the Democratic Peoples Republic of Korea in this year set the official beginning of North Koreas history., 1948,1940,1950,1948,1945
Which of these statements is true about the division of Korea into two parts?, All of these,Korea was divided at the 38th parallel.,North Korea was to be administered by the Soviet union.,All of these,It followed the end of World War II.
Which of these natural disasters is known to hit the lands of North Korea on the regular?, All of these,All of these,Droughts,Floods,Typhoons
What is the official language that is spoken in North Korea?, Korean,All of these,Russian,Korean,Japanese
Which of these religious movements has many adherents among the people of North Korea?, All of these,Korean shamanism,Cheondoism,All of these,Buddhism
