Questions,Correct,A,B,C,D
"This character, often regarded as one of Shakespeares most malevolent villains, is an expert manipulator, who states, I am not what I am.", Iago,Polonius,Claudius,Cassius,Iago
"This complex Shakespearean character, who is a villain at one point and a victim at another, demanded a pound of flesh and rendered no mercy.", Shylock,Horatio,Tubal,Antonio,Shylock
"This character, who commits a number of villainous acts throughout the course of the play King Lear, is the illegitimate son of the Earl of Gloucester.", Edmund,Edmund,Antonio,Edgar,Philip
What character from the play Julius Caesar incites the conspiracy against Caesar and plays a leading role in his assassination?, Cassius,Brutus,Taurus,Arviragus,Cassius
Name King Lears brutal son-in-law who gouged out Gloucesters eyes in Shakespeares tragedy King Lear., Duke of Cornwall,Duke of Burgundy,Edmund,Earl of Kent,Duke of Cornwall
"In the play Cymbeline, this dishonest Roman soldier tricked Posthumos into believing that he had seduced his wife, Imogen.", Iachimo,Iachimo,Philario,Brutus,Cassius
"In what Shakespearean comedy did Don John acknowledge, though I cannot be said to be a flattering honest man, it must not be denied but I am plain-dealing villain?", Much Ado About Nothing,The Comedy of Errors,Much Ado About Nothing,The Taming of the Shrew,Measure for Measure
"Why does the group of eco-terrorists, featured in the book Ark Angel, call themselves Force Three?", The Earth is the third nearest planet to the sun.,It does not say.,The Earth is the third nearest planet to the sun.,The group has three main goals.,"When the group was created, there were three members in it."
"In the book Ark Angel, what are the nicknames Alex Rider gives to the four men who break into St. Dominics hospital looking for Paul Drevin?"," Combat Jacket, Spectacles, Steel Watch, Silver Tooth","Canvas Jacket, Spectacles, Steel Watch, Silver Tooth","Combat Jacket, Spectacles, Steel Watch, Silver Tooth","Canvas Jacket, Spectacles, Metal Watch, Silver Tooth","Combat Jacket, Spectacles, Metal Watch, Steel Tooth"
Fictional character Alex Rider says that the leader of Force Three has what parts of the world tattooed on the back of his head?, Russia and China,Brazil and West Africa,Russia and China,The US and Canada,Europe
"In the novel Ark Angel, what natural disaster does Alex Rider think would occur if the leader of Force Three was to sneeze?", Earthquake,Landslide,Earthquake,Tsunami,Volcanic Eruption
"In the sixth book in the Alex Rider series, what were Force Three going to send with the ransom note to Nikolei Drevin in order to show him that they meant business?", One of their captives fingers.,One of their captives toes.,A picture of their captive.,A lock of their captives hair.,One of their captives fingers.
"In Ark Angel, after Force Three find out that the boy they captured is not Paul Drevin, but Alex Rider, they try to kill him by doing what?", They lock Alex in a room and set the building aflame.,They lock Alex in a room and leave him there to starve to death.,They lock Alex in a room and leave a time bomb right outside.,They lock Alex in a room and weaken the supports of the building so that it falls down.,They lock Alex in a room and set the building aflame.
What was the name of Alexs guardian in the novel Ark Angel?, Jack Starbright,Mrs. Jones,Alan Blunt,Jack Starbright,Diana Meacher
One aspect of the physical constitution of fictional officer Hornblowers isolates him from a simple human pleasure. What is it?, Tone deafness prevents Hornblower from enjoying or even comprehending music.,Hornblower has no sense of smell or taste resulting in joyless eating.,Poor eyesight and color blindness result in his inability to comprehend beauty and art.,"Dyslexia, or a dyslexia-like condition, prevents Hornblower from being able to read and write.",Tone deafness prevents Hornblower from enjoying or even comprehending music.
What was the name of the first wife of fictional British Royal Navy officer Horatio Hornblower?, Maria,Penny,Maggie,Mildred,Maria
Which of these is true about the second wife of fictional British Royal Navy officer Horatio Hornblower?," She is the sister of Anglo-Irish statesman Arthur Wellesley, the future victor at Waterloo and Duke of Wellington.","She is the sister of Marie Antoinette, infamous for excesses, and executed early in the French Revolution.","She is the sister of Anglo-Irish statesman Arthur Wellesley, the future victor at Waterloo and Duke of Wellington.","She is the widow of Horatio Nelson, hero of the Nile and Trafalgar.",She is the illegitimate daughter of Benjamin Franklin.
"During the Peace of Amiens,” fictional adventure series character Hornblower is beached and penniless. How does Hornblower make ends meet during this period?", Playing whist,Gambling on horses,Playing whist,Prize fighting,Working as a fishing boat captain
"Fictional officer Horatio Hornblower is dispatched round the Horn to assist the Spanish in the Pacific. Hornblower meets and assists a despotic, psychopathic Spanish commander. What is his name?", El Supremo,Hugo Chavez,Augusto Pinochet,El Supremo,El Rey Del Mundo
Where does fictional character Stephanie Plum live?," Trenton, New Jersey","Philadelphia, Pennsylvania","Albany, New York","San Francisco, California","Trenton, New Jersey"
What is the occupation of Janet Evanovichs character Stephanie Plum?, bounty hunter,bounty hunter,police officer,spy,pastry chef
"In Janet Evanovichs series of books, Stephanie Plums relationship with her boyfriend is often overshadowed by her crush on this character.", Ranger,Vinnie,Alex,Ranger,Alfred
"Stephanie Plum has different cars throughout the various novels. However, the one that used to belong to her Uncle Sandor was affectionately called by this name.", Big Blue,Big Bertha,Big Ben,Big Betsy,Big Blue
What is the job of Stephanies boyfriend in the Stephanie Plums series of novels?, a police officer,a police officer,a lifeguard,an EMS,a firefighter
How many children does Harry Potter have as revealed in the last book of the harry Potter series?, 3,1,3,5,4
"Who does Hermione Granger kiss in the Battle of Hogwarts, in the final book of the Harry Potter series?", Ron,None of these,Harry,Ron,Krum
What year were fictional characters Harry Potter and Ron Weasley born?, 1989,1990,1982,1989,1985
"What potion do Harry Potter, Ron Weasley and Hermione Granger use to infiltrate the Ministry of Magic?", Polyjuice Potion,Amortentia,Draught of Living Death,Polyjuice Potion,Felix Felicis
Which student does Slughorn Horace NOT favour in the Harry Potter series?, Ron,Harry,Ron,Zabini,Hermione
What character does Harry Potter first meet at Madam Malkins?, Draco,Ron,Dudley,Draco,Ginny
"In The Silmarillion, Morgoth was a corrupt Ainu, a servant of Iluvatar, responsible for much evil on Middle Earth. What was his original name?", Melkor,Melion,Mordred,The Evil One,Melkor
"The epic love story in The Silmarillion held great significance to Tolkien himself. This is evident by the fact that the names of the two lovers were engraved upon the tombstones of J.R.R. and his wife, Edith. What were these names?", Luthien and Beren,Tuor and Idril,Thingol and Melian,Perseus and Andromeda,Luthien and Beren
What was the name of the Great Elven Prince of the Noldor who created the Silmarils described by J. R. Tolkien?, Feanor,Fingon,Fangorn,Feanor,Finarfin
"In The Silmarillion, the Elves call themselves this, meaning The Speakers, signifying their value of communication.", Quendi,Quenya,Quendi,Quizlings,Quintet
"Known as the Wildman of the Woods, this tragic hero, described in The Silmarillion, was cursed by Morgoth because his father refused to reveal the location of the secret Elvin kingdom of Gondolin.", Turin,Turok,Tuor,Turgon,Turin
What transgression did fictional character Melkor commit to warrant the revenge of the Valor?, Creation fo the Orcs,Creation fo the Orcs,Seduction of the men of Numenor,Creation of the Balrogs,Deception of the Elves
"In Tolkiens writings, Numenor was created as a reward to men by the Valar for their part in the War of the Silmarills. The first king was the son of Earendil, a mortal, and Elwing, an Elf, and brother to Elrond. Who was he?", Elros,Elros,Elendil,El Cid,Elfin
What are the names of the Three Kindreds of Elves in Toliens fictional universe?," Vanya, Noldor , and Teleri","Tanya, Ronald, and Valeri","Noldor, Baldar, and Teleporn","Vanya, Noldor , and Teleri","Vanwe, Manwe, and Elwe"
"At the time of the fictional War of the Ring, who were the only surviving leaders of the Noldor?", Galadriel and Celeborn,Celebrimbor and Cirdan,Gil-galad and Celegorm,Galadriel and Celeborn,Elrond and Celebrian
"In Tolkiens book The Silmarillion, the kings of Numenor increasingly became rebellious against the Valar and mounted an attack against them. The result was that the island of Numenor sank into the sea. What was the reason for their revolt?", They lusted after immortality.,They wanted the Silmarils for themselves.,They were tired of Manna.,They wanted the riches of the Valor.,They lusted after immortality.
"There were a number of notable inter-racial marriages in The Silmarillion. The first one mentioned was between a mortal and a Maia, a servant of the Valar. What were their names?", Thingol and Melian,Tuor and Idril,Thingol and Melian,Earendil and Elwing,Beren and Luthian
"In The Silmarillion, Carcharoth slew Beren after swallowing a Silmaril. What was Carcharoth?", wolf,wolf,dragon,spider,Balrog
What is the name of the dog-like billy-bumbler in the Dark Tower series?, Oy,Doggie,Ogg,Oy,Aye
"In the Dark Tower series, the woman known as Susannah has a dissociative identity disorder. How many personalities does she have?", 4,8,10,6,4
"In the Dark Towere series of books, Eddie Dean mysteriously resembles which one of Rolands dead friends?", Cuthbert Allgood,Alain Johns,Jamie de Curry,Randall Flagg,Cuthbert Allgood
What is the name of Rolands first love in The Dark Tower?, Susan Delgado,Mia,Detta Walker,Susan Delgado,Susannah Dean
There are a number of evil spheres in the Dark Tower books. What is the name of the most sinister of them?, Black Thirteen,Blue Fog,White Mist,Purple Haze,Black Thirteen
"Roland, the protagonist of the Dark Tower books, is a descendant of this great king.", Arthur Eld,Arthur Eld,The Red King,The Prim lord,Steven Deschain
"In the Dark Tower series of books, Jake has a very special ability called The Touch. What is it?", A kind of telekinesis,The power to turn things into gold,A kind of telekinesis,The power to kill by thought,The power to start fires
"Among the servants of the Red King in the Dark Tower, there are bird-like creatures that can assume a human form. What are they called?", Taheen,Grandfathers,Prims,Taheen,Slow muties
In 2007 Marvel started a series of comic books based on The Dark Tower. What is the name of the first volume?, The Gunslinger Born,Roland The Gunslinger,The Gunslinger Born,Roland of Gilead,The Last Gunslinger
"In the beginning of the novel Twilight, Isabella moved from Phoenix, Arizona to what city?"," Forks, Washington","Forks, Washington","Baton Rouge, Louisiana","Miami, Florida","Albany, New York"
"In the book Breaking Dawn, how many children does Bella have?", 1,4,1,3,0
In which book of the Twilight series did Edward propose to Bella?, Eclipse,Breaking Dawn,Eclipse,Twilight,New Moon
What word does Holden Caulfield use to refer to everyone and everything he rejects?, phony,crass,crap,phony,junk
The protagonist of what movie is programmed to buy the novel The Catcher in the Rye whenever he sees it?, Conspiracy Theory,Gattaca,Conspiracy Theory,The Fifth Element,The Matrix
"Holden Caulfields dream to be a catcher in the rye and to guard children playing in a rye field on the edge of a cliff is based on his mishearing of the poem Comin Through the Rye. What poet, known in Scotland as The Bard, wrote that poem?", Robert Burns,Robert Burns,William Blake,Thomas Campbell,Lord Byron
"In the novel The Catcher in the Rye, Holden drops by to see his former English teacher, Mr. Antolini, who offers him advice and a place to sleep. Holden is upset when he wakes up in the middle of the night to find Mr. Antolini doing which of the following?", patting Holdens head,holding Holdens hand,drinking heavily,ransacking Holdens luggage,patting Holdens head
"At one point in the novel The Catcher in the Rye, Holden and his sister Phoebe seem to exchange roles as the catcher and the fallen. What is the Catchers symbol that Holden gives Phoebe?", his hunting hat,his hunting hat,a gold ring,his diary,his fishing rod
Mark David Chapman was found with a copy of The Catcher in the Rye on the night he shot this person., John Lennon,Rebecca Schaeffer,John Lennon,Ronald Reagan,Yoko Ono
"What was written on Allies left-handed baseball glove, one of the most significant symbols in the novel The Catcher in the Rye?", poems,the name of his first girlfriend,poems,the titles of his favourite books,the names of his siblings
J. D. Salingers novel The Catcher in the Rye opens in the week before this major holiday., Christmas,Thanksgiving Day,Memorial Day,Christmas,Easter
"In this Academy Award-winning movie, Woody Allens character says that he only has books with the word death or dying in them. Diane Keatons character holds a copy of The Catcher in the Rye and asks, What about this one?.", Annie Hall,Manhattan,Annie Hall,Husbands and Wives,Hannah and Her Sisters
Who was Nero Wolfes right-hand man?, Archie Goodwin,Archie Goodwin,Theodore Horstmann,Fritz Brenner,Nathaniel Parker
Where was fictional detective Nero Wolfe born?, Montenegro,London,Switzerland,New York City,Montenegro
What color shirt did Nero Wolfe invariably wear?, Yellow,Pink,Yellow,White,Blue
"Who was the newspaperman who helped fictional detective Nero Wolfe on occasion, and was one of the regular poker players.", Lon Cohen,Nathaniel Parker,Saul Panzer,Lon Cohen,Johnny Keems
Which of the following was not one of the regular gang of fictional detectives Nero Wolfe regularly used?, Purley Stebbins,Saul Panzer,Fred Durkin,Orrie Cather,Purley Stebbins
"What was Nero Wolfes hobby, which he engaged in for four hours each day?", Raising orchids,Writing detective stories,Collecting stamps,Building intricate models,Raising orchids
Who was the love interest of Nero Wolfes right-hand man?, Lily Rowan,Carla Lovchen,Sally Colt,Lily Rowan,Del Bonner
What was the name of Nero Wolfes nemesis?, Arnold Zeck,Anson Street,Arnold Zeck,Albert Hall,Arthur Dent
What beverage did detective Nero Wolfe consume copious amounts of?, Beer,Coffee,Beer,Tea,Fine wine
Who was the cigar-chomping fictional police inspector who had a love-hate relationship with Nero Wolfe?, Cramer,Cramer,Noonan,Rowcliff,Stebbins
Which short story is listed with the WRONG author?, The Devils Advocate-John Grisham,The Devil and Daniel Webster-Stephen Vincent  Benet,The Spinoza of Market Street-Isaac Bashevis Singer,Babylon Reconstructed-F. Scott Fitzgerald,The Devils Advocate-John Grisham
What is the essential element of a short story?, A short period of time is covered.,The description of scenery  is used to paint a complete picture.,They open with a historic scene.,The complete description of  the main characters psyche is used to set  the scene.,A short period of time is covered.
Which term refers to a prose fiction work that is longer than a short story but shorter than a novel?, A novella,An allegory,A novella,An intermediary tale,A tale
Which short story is  listed with the WRONG author?, Death in the Afternoon-John Steinbeck,The Death of Ivan Ilych-Leo Tolstoy,The Life in the Iron Mills-Rebecca H. Davis,The Diamond Lens-Fitz James OBrien,Death in the Afternoon-John Steinbeck
Which story is listed with the CORRECT author?, The Man Without a Country-E. E. Hale,The Man Without a Country-E. E. Hale,Marjorie Drew-F. M. Crawford,The Upper Berth-Mary E. Wilkins,The Humble Romance-T. B. Aldrich
Which short story ids listed with the WRONG author?, A Man Called Horse-Louis LAmour,Love in Old Clothes-H. C. Bunner,The Little Countess-Enrico Castlenuovo,A Man Called Horse-Louis LAmour,The Attack on the Mill-Emile Zola
Which story is listed with the WRONG author?, The Gift of Cochise-Leo G. Carroll,The Gift of Cochise-Leo G. Carroll,The Yellow Wallpaper-Charles Perkins Gilman,Eagles Over Croaked Creek-Max Brand,Dubliners-James Joyce
What is The Western Star from Agatha Christies short story The Adventure of The Western Star?, A jewel,A jewel,A ship,A stage play,A hotel
Who is the murderer in Agatha Christies The Tragedy at Marsdon Manor?, The widow of the dead man,The lover of the dead mans wife,The widow of the dead man,It is a suicide,The brother of the dead man
How does Mr Bleibner die in Agatha Christies short story The Adventure of the Egyptian Tomb?, Blood poisoning,Killed by a demon,Blood poisoning,Heart failure,Head trauma
What does Miss Violet Marsh have to do in order to inherit her Uncle Andrews possessions in Agatha Christies story The Case of the Missing Will?, Prove her wits,Cut her long beautiful hair,Live as a beggar for one month,Prove her wits,Remain unmarried for the rest of her life
Who killed the French Deputy Paul Deroulard in Agatha Christies short story The Chocolate Box?, His mother,His cousin,His wife,His doctor,His mother
What type of poison does Mrs. Merrowdene use in Agatha Christies short story Accident?, Arsenic,Mouse poison,Arsenic,Lead,Atropine
What does the blue geranium mean according to the fortuneteller in Agatha Christies exciting short story The Blue Geranium?, Death,Death,Adultery,Danger,Warning
What word was written with a capital letter in the middle of a sentence in the letter from some Georgine in Agatha Christies story The Four Suspects?, Honesty,Love,Again,Honesty,Death
What is the plant employed for the murder in Agatha Christies The Herb of Death?, Foxglove,Thornapple,Hemlock,Foxglove,Belladonna
"What work by Alexandre Dumas, Sr. inspired Hercules Poirot how to solve the case in  The Augean Stables?", The Queens Necklace,The Gold Thieves,The Queens Necklace,The Black Tulip,The Regents Daughter
Who wrote the novel The Grapes of Wrath?, John Steinbeck,John Ford,John Steinbeck,William Faulkner,Ernest Hemingway
When was the novel The Grapes of Wrath first published?, 1939,1961,1928,1950,1939
What statement about the novel The Grapes of Wrath is true?, The author of the novel won the Pulitzer Prize for Literature and the Nobel Prize for Literature.,The author of the novel won neither the Nobel Prize for Literature nor the Pulitzer Prize for Literature.,The author of the novel won the Nobel Prize for Literature but not the Pulitzer Prize for Literature.,The author of the novel won the Pulitzer Prize for Literature and the Nobel Prize for Literature.,The author of the novel won the Pulitzer Prize for Literature but not the Nobel Prize for Literature.
How did the author of The Grapes of Wrath come up with the title of the novel?, The authors wife suggested he use a line from a song.,The author picked it out of The Bible.,The authors wife suggested he use a line from a song.,Marie Hemingway had published a poem containing the line  .. and the grapes of wrath poured forth from Pandoras box....,"When the author was growing up in Mississippi, it  was a common expression for mans  troubles."
When was the original movie The Grapes of Wrath released?, 1940,1960,1950,1940,1970
What is the name of the main family in the novel The Grapes of Wrath and in the movie adaptation?, Joad,Galati,Darwell,Joad,Adams
Where do the main characters travel in the novel The Grapes of Wrath?, From Oklahoma to California,From Oklahoma to California,From rural Mississippi to Texas,"From Chicago, Illinois to San Joaquin, California",From New York to Texas
"In the The Grapes of Wrath, we meet the first character, Tom, as he walks and hitchhikes home. Why is he away from home?", He served time in prison for homicide.,He served time in prison for burglary.,He served time in prison for homicide.,"He had no money for the subway, so he had to walk home.",He lost his job in the Chicago slaughterhouses and had to walk the two miles to the Adams home.
Which of these words best describes the attitudes of the novel The Grapes of Wrath?, Pro-labor,Pro-labor,Pro-big business,Anti-union,Anti-American
"In the original movie The Grapes of Wrath, the part of Jim Casey, the ex-minister is played by an actor  with this last name.", Carradine,Carradine,Fonda,Alda,Douglas
One of the characters in the novel and movie The Grapes of Wrath had this unusual name., Rose of Sharon,Rose of Sharon,Chicago Louie,Tainia,Brooklyn
What animal is used in the novel The Grapes of Wrath to symbolize the familys problems?, Turtle,Turtle,Wolf,Dog,Horse
What two objects are used in the novel The Grapes of Wrath to symbolize evil?, the tractor and the slot machine,the car and the bank,the telephone and the gun,the gun and the tractor,the tractor and the slot machine
What does the name Hudson have to do with the novel The Grapes of Wrath?, It is the brand of car the family uses for transportation.,It is the name of the family the Adams live with in Texas.,It is the brand of car the family uses for transportation.,It is the name of the Texas ranch where the family gets part-time labor.,It is the name of the cruel Illinois governor whose laws force the Darwells out of Chicago.
Find the correct statement about the original movie The Grapes of Wrath., The director refused to let anyone use makeup for the movie.,The character of Nick Adams was played by Robert J. Douglas.,The director refused to let anyone use makeup for the movie.,"The producer had to raise $5,000,000 to make this movie.",Frank Galatai was portrayed by Robert J. Douglas.
Which of the following banned the movie The Grapes of Wrath?, Josef Stalin,Nikita Khrushchev,Charles de Gaulle,Josef Stalin,Adolf Hitler
Which of these performers did not write a song based on the novel The Grapes of Wrath?, Bob Dylan,Woody Guthrie,Bob Dylan,Kris  Kristofferson,Bruce Springsteen
Newspaper magnates Joseph Pulitzer and William Hearst are regarded as the originators of this type of journalism., yellow journalism,yellow journalism,ambush journalism,Gonzo journalism,investigating journalism
"What author, born in the American South, won the Pulitzer Prize for her only novel?", Harper Lee,Harper Lee,Geraldine Brooks,Margaret Leech,Eudora Welty
"In 1918, politician William Cabell Bruce won the Pulitzer Prize for the biography of this Founding Father.", Benjamin Franklin,Benjamin Franklin,Thomas Jefferson,John Adams,John Hancock
"What poet, noted for his realistic depictions of rural life, received four Pulitzer Prizes?", Robert Frost,George Dillon,John Gould Fletcher,Wallace Stevens,Robert Frost
"This Pulitzer Prize-winning work, written in Cuba by Ernest Hemingway, was also an important factor in Hemingways selection for the 1954 Nobel Prize in Literature.", The Old Man and the Sea,Fiesta,A Farewell to Arms,The Old Man and the Sea,For Whom the Bell Tolls
"What Gus Van Sant movie mentions a fictional Pulitzer Prize-winning novel, titled Avalon Landing?", Finding Forrester,My Own Private Idaho,Psycho,Good Will Hunting,Finding Forrester
"Who composed Blood on the Fields, the first piece of jazz music to win the Pulitzer Prize for Music?", Wynton Marsalis,Duke Ellington,Wynton Marsalis,Don Ellis,Miles Davis
"Who portrays Joseph Pulitzer, the founder of the Pulitzer Prize, in the 1992 Disney film musical, Newsies?", Robert Duvall,Sean Connery,Christian Bale,Robert Duvall,Alan Menken
Which of the following authors is not a recipient of both the Pulitzer Prize and the Nobel Prize?, Doris Lessing,Doris Lessing,Sinclair Lewis,William Faulkner,John Steinbeck
"In Phillip Pullmans The Subtle Knife, who does Lyra, the protagonist of the first book, meet first in the new world?", Will,Angelica,Tullio,Moxie,Will
"In the book The Subtle Knife what is the name of the city Lyra finds herself in, in the new world?", CittGazze,Oxford,Bolvanger,Aeshthaer,CittGazze
"In the book, The Subtle Knife by Phillip Pullman, who is Will Parrys father?", Stanislaus Grumman,Lord Asriel,Lee Scoresby,Stanislaus Grumman,Sir Walter
"What does the alethiometer tell Lyra she must do, in the book The Subtle Knife?", Help Will find his father,Find Lord Asriel,Help Will find his father,Search for a scholar who knows about dust,Find The Subtle Knife
In The Subtle Knife” Angelica’s younger brother is Paolo. Who is her older brother?, Tullio,Will,Oliver Payne,Asriel,Tullio
"In the second His Dark Materials book, how does the subtle knife indicate who it has chosen to be his bearer?", It cuts off the pinky and ring fingers on one hand.,It gouges out an eye.,It splits a hair.,It leaves a scar across his forehead.,It cuts off the pinky and ring fingers on one hand.
"In His Dark Materials trilogy, what can be the subtle knife used for?", All of these,To cut windows between worlds.,All of these,"To cut through anything, even metals, stones and souls.",To destroy The Authority.
"In The Subtle Knife, what is the name by which the witches call Lyra, that if known by the wrong people, could mean her destruction?", Eve,Metatron,Lillith,Eve,Baroch
"In Tales of a Fourth Grade Nothing, what was the name of the turtle Peter got at Jimmy Fargos birthday party?", Dribble,Buster,Dribble,Pickle,speedy
"In the book Tales of a Fourth Grade Nothing, what big account did Peters father lose because of Fudge?", Juicy-O,Jelly-Yum,Juicy-O,Juice-Pop,Jell-O
What is Fudges real name in the novel Tales of a Fourth Grade Nothing?, Farley Drexel Hatcher,Frank Oslow Hatcher,Farley Drexel Hatcher,Franklin Osmond Hatcher,Bartholomew Isaac Hatcher
How old is Peter in Tales of a Fourth Grade Nothing?, 9,9,7,2,8
What did Fudge do to Peters turtle in the book Tales of a Fourth Grade Nothing?, He swallowed it.,He swallowed it.,He dropped it out of the window.,He hit it with a hammer.,He took it for a walk.
