Questions,Correct,A,B,C,D
What does the word cretin refer to?, An idiot,Cyst on the brain stem,None of these,An idiot,Swelling of the cerebrum caused by spinal fluid
Leaves of Grass, Walt Whitman,Carl Sandberg,T.S. Eliot,Robert Frost,Walt Whitman
At The Mountains of Madness, H.P. Lovecraft,H.P. Lovecraft,Peter Straub,Edgar Allan Poe,C.S. Lewis
Ape and Essance; Eyeless in Gaza; Point Counter Point, Aldous Huxley,J.D. Salinger,Aldous Huxley,Maya Angelou,William Butler Yeatts
1984; Animal Farm, George Orwell,Herman Hesse,Rudyard Kipling,George Orwell,Aldous Huxley
Return of the Native; Jude the Obscure; Far From the Madding Crowd, Thomas Hardy,Thomas Hardy,William Faulkner,Rudyard Kipling,James Dickey
The Antichrist; The Gay Science; Beyond Good and Evil; Thus Spoke Zarathustra, Frederick Nietzche,none of these,Frederick Nietzche,Amari Baraka,Stephen King
What language can Harry Potter speak?, Parseltounge,Goblin,English,Mermish,Parseltounge
What was Hagrid buying in Knockturn Alley?, Flesh-Eating Slug Repellent,Flesh-Eating Slug Attractor,Fresh-Skin Slug Repellent,Flesh-Eating Ant Repellent,Flesh-Eating Slug Repellent
"This book by James Joyce was forbidden by the US authorities for 15 years, because it was considered obsene. The ban was lifted in 1933.", Ulysses,Ulysses,Portrait of the Artist,Dubliners,Fanny Hill
This book about the life of a prostitute was written by John Cleland. It has been banned in the past due to frank sexual descriptions., Fanny Hill,Candide,Lysistrata,Fanny Hill,Decameron
This book tells the story of two women who meet and fall in love with each other. They openly declare their homosexuality to family and friends. Thats why the Kansas school system ordered the removal of all copies of this book from high school libraries., Annie on My Mind,Daddys Roommate,Andersonville,Annie on My Mind,Catch 22
This book led Austin Miles to the courts in 1992.  Miles was sued because his book was ...a vitriolic attack upon organized Christianity., Dont Call Me Brother,Leaves of Grass,Dictionary of American Slang,Jerusalem Delivered,Dont Call Me Brother
This book by Judy Blume was censored as it discussed adolescent sexuality in too much detail., Forever,Grapes of Wrath,Lolita,Freedom and Order,Forever
This book by George Orwell was banned as it was pro-communist., 1984,The Sun Also Rises,Coming Up for Air,1984,Deliverance
This Lewis Carrolls work was banned in China because in it humans and animals used the same language., Alices Adventures in Wonderland,Sylvie and Bruno,Alices Adventures in Wonderland,Through The Looking Glass,The Hunting of the Snark
Its translation into local languages was forbidden in Burma., The Bible,The Quran,The Cabala,Arabian Nights,The Bible
"This book was censored in 1985 in Cairo, Egypt as it contained obscene passages which posed a threat to the countrys moral fabric.", Arabian Nights,Arabian Nights,Don Quixote,Analects,Brave New World
An edition of Miltons works was bound in:, Human skin,Human skin,Golden plates,Bears fur,Used newspapers
Binding books with human hide was a common practice once. Why?, Because the narrative in the book was about the story of the hides owner,Because of lack of any other proper material,Because this sold the books more quickly than anything,Because the narrative in the book was about the story of the hides owner,Because it was fashionable at the time
The name of Cruella de Vil from 101 Dalmatians is meaningful because:, She wants the puppies for their fur,She actually likes cats and not dogs,She is the owner of the dalmatians,She doesnt give them any food,She wants the puppies for their fur
Who is the Shakespearean villain who had his own brother executed and innocent children killed because they were hindrances to his kingly ambition?, Richard III,Edmund,Richard III,Aaron the Moor,Othello
"According to psychologists villains in fairy-tales actually have an important role for the childrens mind formation, namely:", They help children decide what is bad,They help children decide what is bad,They make the story really funny,They are interesting models of behaviour,They always lose the battle
The famous evil female Baba Yaga comes from:, Russian folklore,A Norse legend,An Uzbekistanian fairy-tale,A Moroccan song,Russian folklore
"Harry Potter is concidered malicious literature by some, because:", It is about witchcraft,Most of its characters are strange beings,Its characters are mainly clad in black clothes,It comprises too many volulmes,It is about witchcraft
It turns out that people like reading about crime. The top-selling English-language author of all time is:, Agatha Christie,Agatha Christie,Ben Johnson,Edgar-Allan Poe,Virginia Woolf
"Who wrote about the early whodunit archetype, inspector Auguste Dupin?", Edgar Allan Poe,Georges Sands,Edgar Allan Poe,Washington Irving,Nathaniel Hawthorne
Dr. Alex Delaware is the creation of which of these authors?, Jonathan Kellerman,Jonathan Kellerman,Kathy Reichs,Faye Kellerman,Ross McDonald
"What is the name of Colin Creevys brother, who appears in the book Harry Potter and the Order of the Phoenix?", Dennis Creevy,Carson Creevy,Darian Creevy,Dennis Creevy,James Creevy
Why was Hagrid missing in the beginning of Harry Potter and the Order of the Phoenix?, He went hunting giants.,He went hunting unicorns.,He went looking for Dumbleodre.,He went looking for Sirius Black.,He went hunting giants.
What did Hermione do to Ron before she stormed out of the charms classroom in Harry Potter and the Half-Blood Prince?, She charmed little yellow birds to fly at Ron and peck him.,She charmed a desk to fly over to Ron.,She charmed pencils to fly and poke Ron.,She charmed little yellow birds to fly at Ron and peck him.,She charmed a chair to fly across the room at Ron.
"What was the name of the handsome, selfish teacher in Harry Potter and the Chamber of Secrets?", Professor Gilderoy Lockhart,Professor Gilderoy Lockhart,Professor Godric Gryffindor,Professor Severus Snape,Professor Cedric Diggory
"In Harry Potter and the Philosophers Stone, what was the password to the Gryffindor tower during Halloween?", Pig snout,Pig snout,Fairy lights,None of these,Zebras tail
"In Harry Potter and the Philosophers Stone, who gave Nearly-Headless Nick the rejection letter from the Headless Hunt?", Sir Patrick Delaney-Podmore,Sir Delaney Patrick-Podmore,Sir Sturgis Podmore,Sir Patrick Delaney-Podmore,Sir Bloody Baron
"In the Harry Potter series, who created the Ravenclaw House when Hogwarts was built?", Rowena Ravenclaw,Rowena Ravenclaw,Ronald Ravenclaw,Rowana Ravenclaw,Ricky Ravenclaw
What was the name of the child who delivered Ron his parcels in Harry Potter and the Goblet of Fire?, Nigel,Creevy,Dennis,Collin,Nigel
Who lost the list of passwords for the Gryffindor tower in Harry Potter and the Prisoner of Azkaban?, Neville Longbottom,Dean Thomas,Neville Longbottom,Ron Weasley,Padma Patil
"In Harry Potter and the Half-Blood Prince, who was bitten by the werewolf Fenfir Greyback?", Bill,Ron,Bill,Charlie,Percy
Who killed Dumbledore in Harry Potter and the Half-Blood Prince?, Professor Snape,Professor Binns,Lucius Malfoy,Professor Snape,Bellatrix Lestrange
What is James Potter called by Lily Evans in Harry Potter and the Order of the Phoenix?," A selfish, bullying toerag","A bullying, selfish git",A big-headed git,"A selfish, bullying toerag",An ignorant git
"What house was Cho Chang in, as explained in Harry Potter and the Prisoner of Azkaban, Order of the Pheonix, and Goblet of Fire?", Ravenclaw,Griffyndor,Slytherin,Hufflepuff,Ravenclaw
Who gave Dudley a pigs tail using a pink umbrella in the book Harry Potter and the Philosophers Stone?, Rubeus Hagrid,Draco Malfoy,Rubeus Hagrid,Vernon Dursley,Harry Potter
Who saved Harry from Voldemort in the Forbidden Forest in the first volume of the Harry Potter series?, Firenze,Firenze,Fred and George Weasley,Albus Dumbledore,Hermione Granger
In which Stephen King story do we meet the evil Randall Flagg?, The Stand,Salems Lot,It,Rose Madder,The Stand
In which Stephen King story do we meet a banker from Maine named Andy Dufresne?, Shawshank Redemption,Shawshank Redemption,Children of the Corn,Cujo,Needful Things
Paul Edgecomb is a character in which Stephen King story?, The Green Mile,Misery,Dolores Claiborne,Graveyard Shift,The Green Mile
Jud Crandall and Louis Creed are characters in which Stephen King story?, Pet Sematary,Christine,Pet Sematary,The Lawnmower Man,Night Shift
In which Stephen King story do we meet a red-headed character named Malachai?, Children of the Corn,Children of the Corn,The Tommyknockers,Firestarter,The Shining
In which Stephen King story are we introduced to a recovering alcoholic named Jack Torrance?, The Shining,The Shining,Creepshow,The Boogeyman,Thinner
"Billy Halleck, a rather rotund lawyer, is a character from which Stephen King story?", Thinner,Insomnia,Thinner,Rose Madder,Storm of the Century
The paraplegic Marty Coslaw is a character in which Stephen King story?, Silver Bullet,The Stand,Bag of Bones,Night Shift,Silver Bullet
In which Stephen King story to we meet the intriguing stranger Andre Linoge?, Storm of the Century,Misery,Salems Lot,Carrie,Storm of the Century
The former nurse Annie Wilkes is a character from which Stephen King story?, Misery,Dolores Claiborne,Rose Madder,Firestarter,Misery
Pennywise is introduced to us in a storm sewer from which Stephen King story?, It,Creepshow,Pet Sematary,It,Needful Things
Johnny Smith is a character that awakens from a coma in which Stephen King story?, The Dead Zone,The Green Mile,The Dead Zone,The Tommyknockers,Graveyard Shift
Arnie Cunninghams character is a nerdy high school student from which Stephen King story?, Christine,Children of the Corn,Christine,Cujo,Carrie
"What fantasy series tells us first about a sword, then about the elfstones and finally about a wishsong?", Shannara,Shannara,Dragon Riders of Pern,Sword of Truth,Chronicles of Narnia
"In this sci-fi story, a young boy is given advanced training and then tricked into destroying an invading an alien fleet.", Enders Game,Enders Game,The Boat of a Million Years,Wisdom Beyond Fear,Harsh Reality
Which author describes the worlds of the Belgariad and the Malloreon?, David Eddings,David Eddings,Terry Goodkind,J. R. R. Tolkien,Robert Jordan
The fictional spice-drug Melange has a central role in which Sci-fi epic?, DUNE,The Black Legion,The Pirates of Orion,War of the Worlds,DUNE
"This fantasy series features channelers, who can control the One Power, a mighty force that comes from the True Source, and is separated into two halves: a male part -saidin, and a female one - saidar.", The Wheel of Time,The Wheel of Time,Running with the Demon,Ring World,Corinthia
"This series depicts a unicorn-riding wizard, who is actually a contestant in a game show, in the futuristic world of Proton.", Apprentice Adept,Endless Recursion,Xanth,Apprentice Adept,The Divided Wolrd
"This popular fantasy series tells the story of a small human-like character, sent on a mission to save the world. He has to destroy an item of dark and terrible power by casting it into the fires of the mountain, where it was made.", Lord of the Rings,The Wheel of Time,The Chronicles of Narnia,The Sword of Truth,Lord of the Rings
"Which Fantasy Series tells the story of  the War Wizard, Richard Rahl?", The Sword of Truth,The Wheel of Time,Greystone Trilogy,The Sword of Truth,Battle Mage Trilogy
Which sci-fi classic features the story of an alien invasion thwarted by earths microorganisms?, War of the Worlds,Speaker for the Dead,Close Encounters,2001: Space Odyssey,War of the Worlds
Which fantasy series by C.S. Lewis includes a book entitled The Voyage of the Dawn Treader?, The Chronicles of Narnia,The Magic of Xanth,The Chronicles of Narnia,Lord of the Rings,The Pirates of Psion
"In the novel Gone with the Wind, what is Scarlett O Haras first name?", Katie,Scarlett,Carreen,Melanie,Katie
Which war is described in the novel Gone with the Wind?, The Civil War,The war in Iraq,The war of 1812,The Revolutionary War,The Civil War
"In the novel Gone with the Wind, what was the name of Scarletts first house -- the house she had her childhood in and loved more than anything?", Tara,Tara,Leps,Ward,Yern
How many children did Scarlett have in the novel Gone with the Wind?, 3,3,4,1,6
"In the novel Gone with the Wind, what were the names of the two slaves Scarletts father bought, and what relationship did they have?"," DIlcey and Prissy, mother and daughter","Dilcey and Prissy, cousins","DIlcey and Prissy, mother and daughter","Mammie and Prissy, sisters","Mammie and Dilcey, best friends"
"Name the 19th century novel, which begins with the following sentence: ‘It is a truth universally acknowledged, that a single man in possession of a good fortune, must be in want of a wife.’", Pride and Prejudice,Sense and Sensibility,North and South,Pride and Prejudice,Vanity Fair
"This quote is from a novel which focuses on the myth of hedonism: ‘The only way to get rid of a temptation is to yield to it. Resist it, and your soul grows sick with longing for the things it has forbidden to itself, with desire for what its monstrous laws have made monstrous and unlawful.’  Name the novel.", The Picture of Dorian Gray,Lady Chatterleys Lover,The Picture of Dorian Gray,A Portrait of the Artist As a Young Man,Ulysses
"The following quote is from a novel which describes a society, characterized mainly by the lack of freedom: ‘Freedom is the freedom to say that two plus two make four. If that is granted, all else follows.’  Name the novel.", 1984,A Good man in Africa,1984,Lord of the Flies,Heart of Darkness
"The main character from this literary work by Philip Roth addresses the following words to his domineering and meticulous Jewish mother: ‘Because to be bad, Mother, that is the real struggle: to be bad and to enjoy it. That is what makes men of us boys.’", Portnoys Complaint,Portnoys Complaint,My Life As a Man,The Sun Also Rises,The Catcher in the Rye
"In this novel, with the following sentences, David Lodge sums up the fact that his Catholic characters ceased to believe in the existence of hell: ‘At some point in the nineteen-sixties, Hell disappeared. No one could say for certain when this happened. First it was there and then it wasn’t.", How Far Can You Go,The Remains of the Day,How Far Can You Go,The Bloody Chamber,The Silence in the Garden
"The following quote is from a literary work by Kurt Vonnegut in which the characters search for an important and dangerous substance called ‘ice-nine’: ‘Beware of the man who works hard to learn something, learns it, and finds himself no wiser than before. He is full of murderous resentment of people who are ignorant without having come by their ignorance the hard way.’  Name the literary work.", Cats Cradle,Breakfast of Champions,Cats Cradle,Catch-22,Slaughterhouse 5
"The following speculation is from a novel set in the gloomy Fen Country of East Anglia: ‘Realitys not strange, not unexpected. Reality doesnt reside in the sudden hallucination of events. Reality is uneventfulness, vacancy, flatness. Reality is that nothing happens. How many of the events of history have occurred, ask yourselves, for this and for that reason, but for no other reason, fundamentally, than the desire to make things happen?’  Can you name the novel?", Waterland,Times Arrow,Last Orders,Waterland,Sugar and Rum
"This quote is from a novel by Somerset Maugham, which tells the story of a young man searching for the meaning of life:  ‘It is an illusion that youth is happy, an illusion of those who have lost it; but the young know they are wretched, for they are full of the truthless ideals which have been instilled into them and each time they come in contact with the real they are bruised and wounded.", Of Human Bondage,Of Human Bondage,Theatre,Sons and Lovers,Dombey and Son
"In this novel, the following words are said by the protagonist, Isadora Wing, who is in pursuit of liberation: ‘I was nobody’s baby now. Liberated. Utterly free. It was the most terrifying sensation I’d ever known in my life. Like teetering on the edge of the Grand Canyon and hoping you’d learn to fly before you hit the bottom.", Fear of Flying,A Good Man Is Hard to Find,Editha,Tropic of Cancer,Fear of Flying
"This is a quote from a novel in which the action takes place in a mental institution: ‘You have to laugh at the things that hurt you just to keep yourself in balance, just to keep the world from running you plumb crazy.’  Name the novel.", ‘One Flew Over the Cuckoo’s Nest’,‘One Flew Over the Cuckoo’s Nest’,Lost in the Funhouse,Something Happened,The Winter of Our Discontent
"After Dr. Seuss used 236 different words to write The Cat in the Hat, his publisher, Bennett Cerf, bet $50 that Seuss could not write a book of only fifty words. Seuss won the bet with this book in 1960.", Green Eggs and Ham,Hop on Pop,Theres a Wocket in My Pocket!,Green Eggs and Ham,One Fish Two Fish Red Fish Blue Fish
"Published in January 1990, this is the last book written and illustrated by Dr. Seuss. In the US, its a popular graduation gift."," Oh, the Places Youll Go!",My Book about ME,I Am NOT Going to Get Up Today!,"Oh, the Places Youll Go!",Fox in Socks
The plot of this 1984 Seuss satire has been likened to the war between Blefuscu and Lilliput in Jonathan Swifts Gullivers Travel and their war over which end of an egg is supposed to be cracked., The Butter Battle Book,The Butter Battle Book,Oh Say Can You Say?,Green Eggs and Ham,Theres a Wocket in My Pocket!
"Published in 1937, this is Dr. Seusss first book. Its main character Marco is based on Marco McClintock, the son of Mike McClintock, Seuss editor, and Helene McClintock, to whom he dedicated the book.", And to Think That I Saw It on Mulberry Street,Theres a Wocket in My Pocket!,And to Think That I Saw It on Mulberry Street,Horton Hatches the Egg,The Cat in the Hat
In this 1954 Dr. Seuss book the moral of the story (and a repeated phrase throughout the book) is: a persons a person no matter how small. This was the first of two Seuss books starring this kind-hearted elephant., Horton Hears a Who!,Hop on Pop,Theres a Wocket in My Pocket!,Horton Hears a Who!,Hooper Humperdink...? Not Him!
"This 1971 Dr. Seuss book about a mossy,  bossy creature, the Once-ler and the Truffula trees has been banned by some schools and libraries for its anti-forestry industry content.", The Lorax,The Butter Battle Book,Horton Hears a Who!,Fox in Socks,The Lorax
"What book by Dr. Seuss contains the quote: When a Fox is in the bottle where the Tweetle Beetles battle with their paddles in a puddle on a noodle-eating poodle, THIS is what they call......a Tweetle Beetle Noodle Poodle Bottled Paddled Muddled Duddled Fuddled Wuddled Fox In Socks, Sir!?", Fox in Socks,The 500 Hats of Bartholomew Cubbins,If I Ran the Circus,Fox in Socks,"Oh, the Places Youll Go!"
Voyage of the Dawn Treader was written by this author., C S Lewis,T S Elliot,C S Lewis,Lewis Carrol,Brothers Grimm
This famous childrens poet wrote Where the Sidewalk Ends and The Giving Tree., Shel Silverstien,Dr Seuss,none of these,Lewis Carrol,Shel Silverstien
"Dante Alighieri (1265-1321) probably began this work in 1306. Its first canto begins with: Midway upon the journey of our life I found myself within a forest dark, for the straightforward pathway had been lost.", The Divine Comedy,Troilus and Cressida,The Divine Comedy,The Decameron,Gargantua and Pantagruel
The Canterbury Tales is a collection of stories written by Geoffrey Chaucer. It recounts the tales told by individuals on a pilgrimage to the shrine of Saint Thomas Becket at Canterbury Cathedral. Which of the following was not a character in this work?, Tax Collector,Physician,Reeve,Tax Collector,Yeoman
"In the novel Don Quixote by Spanish author Miguel de Cervantes Saavedra, who is the witty squire and companion to Alonso Quixano?", Sancho Panza,Aldonzo Lorenzo,Antonio de la Gandara,Che Guevara,Sancho Panza
"In this tragic play by William Shakespeare, three witches tell a general in the army of King Duncan that he will never be vanquishd until Great Birnam wood to high Dunsinane Hill shall come against him.", Macbeth,The Tempest,Macbeth,Hamlet,Titus Andronicus
"This 1971 novel by Anthony Burgess relates the story of a fifteen-year-old boy named Alex, who, with his gang members (known as droogs) roam the streets at night, committing violent crimes for enjoyment.", A Clockwork Orange,Helter Skelter,A Clockwork Orange,Fahrenheit 451,Catcher in the Rye
"The famous line In the room the women come and go, talking of Michelangelo is from the poem The Love Song of J. Alfred Prufrock by this influential 20th century poet.", T. S. Eliot,W. H. Auden,Robert Browning,Robert Frost,T. S. Eliot
"This great work of Russian literature by Fyodor Dostoevsky features the character Raskolnikov, an impoverished St. Petersburg student who kills an unscrupulous pawnbroker.", Crime and Punishment,Dead Souls,And Quiet Flows the Don,The Brothers Karamazov,Crime and Punishment
"This novel by Charles Dickens, published in 1850, is considered his most autobiographical. It begins with: Whether I shall turn out to be the hero of my own life, or whether that station will be held by anybody else, these pages must show. Characters include Wilkins Micawber and Uriah Heep.", David Copperfield,Great Expectations,David Copperfield,A Tale of Two Cities,Bleak House
As Gregor Samsa awoke one morning from uneasy dreams he found himself transformed in his bed into a gigantic insect is the opening line to this famous work of German fiction by Franz Kafka., The Metamorphosis,The Metamorphosis,Thus Spoke Zarathustra,As I Lay Dying,Heart of Darkness
"This novel by Charlotte Brontë includes the character Mr. Rochester, whose wife is a violent lunatic.", Jane Eyre,Jane Eyre,Wuthering Heights,A Room with a View,The Turn of the Screw
"Fifteen men on the dead mans chest— Yo-ho-ho, and a bottle of rum! is a famous line from Treasure Island, a novel by this author published in 1883.", Robert Louis Stevenson,James Fenimore Cooper,Robert Louis Stevenson,Ralph Waldo Emerson,William Makepeace Thackeray
"Death be not proud, though some have called thee mighty and dreadfull, for, thou art not so is a portion of a work by this poet who lived from 1572-1631.", John Donne,John Milton,John Donne,Lord Byron,William Blake
"In what 1851 novel would you find the characters Ishmael, Captain Ahab, Queequeg and Starbuck?", Moby Dick by Herman Melville,Voyage of the Dawn Treader by C. S. Lewis,Heart of Darkness by Joseph Conrad,Moby Dick by Herman Melville,The Jungle by Upton Sinclair
"This early Anglo-Saxon work, possibly from the 800s, features the antagonist Grendel, a descendant of Cain who invades the mead-hall of the Danes and eats the men within. The title character ultimately beheads Grendel and keeps it as a trophy.", Beowulf,Oedipus Rex,Morte Arthure,Beowulf,Epic of Gilgamesh
"In Stephen Kings novel Bag of Bones, what is the location of the Noonans summer home?", Sarah Laughs,Sarah Laughs,Black House,Parilloud,Lewiston
What is the name of Dolores Claibornes wealthy employer in the Stephen King novel Dolores Claiborne?, Vera Donovan,Jamie ONeal,Selena Cook,Joe St. George,Vera Donovan
"In the horror novel Misery, Annie Wilkes was referred to by the newspapers as what?", The Dragon Lady,The Dragon Lady,The Baby Slayer,The Black Widow,Misery
What is Stephen Kings first published novel?, Carrie,Salems Lot,Carrie,The Stand,The Shining
What novel did Stephen King and Peter Straub co-author in 1983?, The Talisman,Twilight Eyes,The Talisman,Black House,Shadowland
"In the novel Pet Semetary, what is the name of the Creeds cat that is buried and returns to life?", Church,Jud,Church,Gage,Louis
Who fell into the lake?, Dennis,Neville,Colin,Hermione,Dennis
Goblet of Fire started a series of deaths in the books. Who died in Goblet of Fire?, Cedric Diggory,Wormtail,Padfoot,Dumbledore,Cedric Diggory
"How long does Dudleys tongue become, after eating Fred and Georges candies, in the fourth book of the Harry Potter series?", 1 ft.,1 ft.,2 ft.,2.5 ft.,3 ft.
"In chapter 24 of book 5, what breaks Snapes attempt to use Legilimency on Harry Potter?", The vision of Cedrics dead body,"Fluffys attack on Harry, Hermione and Ron",The vision of Cedrics dead body,Voldemorts re-birth,The Dementors kiss on Sirius
"In 2000, Alice Randall wrote a new version of Gone With the Wind in which the story is told from the point of view of the slaves. What was the name of this novel?", The Wind Done Gone,Scarletts Troubles,Went With the Wind,The Wind Done Gone,Tomorrow Aint  Another Day
"In 1962, the best known music theme from the movie Gone with the Wind often called Taras Theme, was made into a hit record on the pop charts. Which group had a 1962 hit with My Own True Love?", The Duprees,The Coasters,The Dovells,The Duprees,The Shangri-Las
Who portrayed Ashley Wilkes in the popular movie Gone with the Wind?, Leslie Howard,Gary Cooper,Groucho Marx,Leslie Howard,Voctor Jory
"Excluding the opening music, the intermission, and exit music, how long does the movie Gone with the Wind run?", 222 minutes,148 minutes,127 minutes,180 minutes,222 minutes
Three men are given credit as directors of the movie Gone with the Wind. Which one of the following directors is not among them?, Raoul Walsh,Sam Wood,Raoul Walsh,George Cukor,Victor Fleming
The producer of the movie Gone with the Wind was short of money and needed a male lead. With whom did he make a deal?, With his father-in-law,With his father-in-law,With Columbia Films,With his father,With  United Artists
Which novel by Ernest Hemingway was published in Great Britain under the title Fiesta?, The Sun Also Rises,Death in the Afternoon,A Farewell to Arms,The Sun Also Rises,For Whom the Bell Tolls
