Questions,Correct,A,B,C,D
"In the Gears of War game, which member of Alpha Team is first found fighting in a small courtyard, alone and taunting the Locust?", Cole,Cole,Baird,Rojas,Kim
Which difficulty setting can only be unlocked by completing Gears of War once on any difficulty?, Insane,Normal,Casual,Insane,Hardcore
Which of these Runescape creatures drops a Dragon 2H Sword?, Chaos Elemental,Mithral Dragon,King Black Dragon,Chaos Elemental,Calphite Queen
What is the name of the city in Runescape that you unlock after the Lost City Quest?, Zanaris,Falador,Zanaris,Catherbys,Camalot
Which of these is the postal service in Runescape?, RPDT,NYER,LPOG,LAPD,RPDT
Which of these pets can you own in Runescape?, Kitten,Hamster,Kitten,Dog,Bird
Which persona from the Killer7 game is the one with the Scope on his/her Automatic?, Kaede,Harman,Con,Dan,Kaede
"In Killer7, what is the character Con Smiths’ age?", 14,17,14,It is not stated.,25
"Which voice-over actress, who has also done voices for Nickelodeon, is the voice of Kaede in Killer7?", Tara Strong,Debby Derryberry,Tara Strong,Lacey Chabert,E.G Daily
What is the name of character Iwazarus ex-wife in the action/adventure game Killer7?, Mizaru,Mizaru,None of the above,Mizaro,Mizari
"In the game Killer7, what is the name of Harmans maid?", Samantha,Susan,Suzie,Polly,Samantha
The only time you can use the save feature in Killer7 is when character Samantha is in what costume?, Maid uniform,Tight black overall,Normal clothing,Evening gown,Maid uniform
What was Mask De Smith’s profession before coming apart of the killers’ team in Killer7?, Professional wrestler,Costume artist,Professional boxer,Bodyguard,Professional wrestler
"In the action/adventure Killer7, who is the only informant able to contact the Killer7 team?", Christopher Mills,Kun Lan,Christopher Mills,Heaven Smile,Travis
"Besides your Avatar, what other characters can you get at the beginning of the game Baldurs Gate II: Shadows of Amn?"," Imoen, Jahiera, Minsc","Imoen, Jahiera, Minsc","Aerie, Jahiera, Jan","Khalid, Jahiera, Minsc","Valygar, Jahiera, Minsc"
Where can you get the gauntlets of ogre power in the game Baldurs Gate II: Shadows of Amn?, The Planar Sphere,The Shadow thieves cellar,The Temple ruins,The Planar prison,The Planar Sphere
What ranger can you save in the game Baldurs Gate II: Shadows of Amn by defeating the Shadow lord in the ruin temple?, Merella,Merella,Valygar,Minsc,Drizzt
"What organization takes Imoen from you, after you escape the first level in the game Baldurs Gate II: Shadows of Amn?", The Cowled Wizards,The Athkatla Guard,The Emerald warriors,The Shadow Thieves,The Cowled Wizards
Who kidnaps Nalia in the game Baldurs Gate II: Shadows of Amn?, Isaea Roenal,Isaea Roenal,Jon Irenicus,Corieg Axehand,Stumpy Ironfoot
"In the 2007 RuneScape Easter special, what item or items do you earn by helping the Easter bunny?", A chicken suit,An egg that you eat that brings you up one level,A chicken suit,A bunny suit,A ring that transforms you into an egg
What two special benefits do RuneScape members get?, special tree logs and special locations,rainbow boots and fighting boots,special money and no extra lands,special tree logs and special locations,you can kill demons and go to the barbarian village
"On a non-member world in RuneScape, how many places can you travel to on the ship in Port Sarim?", 1,3,6,1,4
What animal is Santa on the 2005 RuneScape Christmas special?, wolf,polar bear,wolf,reindeer,penguin
What is the name of the dog the main character is trying to save in the Dogs Life video game?, Daisy,Butter,Jesse,Daisy,Katie
What changes on the dog every time you go to a different Poodle Parlour in the video game Dogs Life?, his collar,his attitude,the markings on his coat,his collar,his leash
At what location do you first have to run away from the dog catcher in the Dogs Life video game?, Village center,Boom City Park,Lake Minniwahwah Cafe,Village center,Farmhouse
"When you pick up scents in the game Dogs Life, which of the following is not part of a competition with another dog?", Barking competition,Marking territory,Barking competition,Digging holes,Doing tricks
What are the names of Miss Peaches henchmen in the Dogs Life game?, Wayne and Dwayne,Wayne and Dwayne,Bob and Rob,Ryan and Bryan,John and Ron
"In the Dogs Life video game, what challenge do the purple scents start?", Collect them all before time runs out,Obtain more territory than the other dog,Dig holes faster than the other dog,Collect them all before time runs out,Get all the food before the other dog does
"What improves your speed, stamina, and health in the game Dogs Life?", bones,bones,washing,people,collars
Which of the following is NOT found at the grooming parlour in the video game Dogs Life?, shaver,scissors,shower head,shaver,a sponge
How many places can you go to by train in the Dogs Life game?, 3,3,5,50,7
What is the name of the radio show in the game Dogs Life?, The Loud Brothers Live,Lake Minniwahah Chat,Miss Peaches Radio Show,"Blues, Smooths, and Clues Live",The Loud Brothers Live
What button do you press to dig in Dogs Life (PS2)?, Circle,Cross,Square,Triangle,Circle
What color is Miss Peaches hair in the video game Dogs Life?, Orange,Orange,Brown,Blonde,Black
Where is the Lucky 7s Machine located in the game Dogs Life?, Lake Minniwahwah Cafe,Lake Minniwahwah Slopes,Lake Minniwahwah Hotel,Lake Minniwahwah Mountain Top,Lake Minniwahwah Cafe
"In the Dogs Life video game, what is the name of the group of bandits at Boom City?", The Sleeping Bandits,The Sleeping Bandits,The Danger Bandits,The Ruthless Bandits,The Masked Bandits
What color is the jacket the girl wants you to get from the ski slopes in the video game Dogs Life?, yellow,black,white,yellow,red
"In the Dogs Life video game, what does the girl NOT ask you to bring to make her snowman?", a scarf,a scarf,a hat,twigs,coal
