Questions,Correct,A,B,C,D
What is the official language of India?, Hindi and English,Urdu and Hindi,Hindi and English,Hindi,"Nepali, Hindi and English"
"Which of these is true about the Commonwealth of Australia, or simply Australia?"," It consists of Tasmania, Australia and several other islands.","It consists of Tasmania, Australia and several other islands.",None of these,It comprises of mainland Australia and Tasmania.,It encompasses only mainland Australia.
What is the largest country in South America in terms of territory?, Brazil,Argentina,Colombia,Brazil,Peru
What is the largest US state in terms of area?, Alaska,Texas,California,Montana,Alaska
What is the name of the capital city of the Peoples Republic of China?, Beijing,Beijing,Hong Kong,Shanghai,Taipei
What is the largest country in the Americas in terms of territory?, Canada,United States,Canada,Brazil,Mexico
What is the largest country on the planet in terms of territory?, Russia,Russia,Australia,Peoples Republic of China,United States
What was Thailands previous official name?, Siam,It has always been called Thailand.,Siam,Lan Na,Bangkok
"In 1767, the ancient capital of Thailand was destroyed by an army from what country?", Burma,Laos,Burma,Vietnam,Cambodia
"What was the name of the old capital of Thailand, founded in 1350?", Ayutthaya,Ayutthaya,Nakon Ratchisma,Korat,Phuket
What is the principal religion of Thailand?, Buddhism,Christianity,Buddhism,Hinduism,Islam
"What is the title of the King of Thailand, Bhumipol, who started reigning in 1946?", King Rama IX,King of the Orient,King Rama IX,King Rama V,King Mongkut IV
"Name King Bhumipols wife whom he married on April 28, 1950.", Queen Sirikit,Queen Sirikit,Queen Lannai,Princess Siriwan,Princess Sawatdee
You are a US Ranger patrolling the whole Mexican border. What is the order of the American states you visit if your patrol starts at the Gulf of Mexico?," Texas, New Mexico, Arizona, California","Texas, New Mexico, Arizona, California","California, New Mexico, Arizona, Texas","California, Nevada, Arizona, Texas","Texas, Arizona, Nevada, California"
"We move 500 years back in time. You are on a ship with Ferdinand Magellan, and you are trying to find the Western passage to India. In which order will you pass the estuaries of South American rivers?"," Orinoko, Amazon, La Platta","Orinoko, Amazon, La Platta","La Platta, Amazon, Orinoko","Amazon, Orinoko, La Platta","Amazon, La Platta, Orinoko"
"If you rent a yacht in Monte Carlo and sail to Athens, which Mediterranean islands can you visit staying on the course?"," Corsica, Sardinia, Sicily, Crete","Ibiza, Crete, Lesbos, Bornholm","Corsica, Sardinia, Sicily, Crete","Sealand, Malta, Cyprus, Rhodos","Crete, Majorca, Sicily, Jersey"
You are sailing around Australia. In which order will you visit Australian seaports if you sail clockwise from Sydney?," Adelaide, Perth, Darwin, Brisbane","Perth, Darwin, Melbourne, Brisbane","Canberra, Melbourne, Perth, Darwin","Brisbane, Perth, Adelaide, Melbourne","Adelaide, Perth, Darwin, Brisbane"
"Take some warm clothes. You are traveling the Trans-Siberian railway. In which order will you pass the great Asian rivers, if you start in Moscow and travel to Vladyvostok?"," Irtysh, Ob, Yenisei","Volga, Irtysh, Yenisei","Irtysh, Ob, Yenisei","Dniepr, Yenisei, Lena","Yenisei, Ob, Volga"
"If you fly from Amsterdam to Tokyo, what will you you be seeing below the plane during most of the trip, if the plane takes the shortest possible path?", The ice of the Arctic Ocean,The ice of the Arctic Ocean,"Mountain ranges (flying over Turkey, Iran, Pakistan and China)",The forests of Russia,The waters of the Atlantic and Pacific oceans
You get on your motorbike in Chicago and travel west down the famous Route 66. Which US state will you NOT visit?, Colorado,California,Kansas,Texas,Colorado
Imagine you travel with Vasco da Gama to find the sea route to India. In which order will you pass the capes of Africa?," Cape Verde, Cape of Good Hope, Ras Hafun","Ras ben Sakka, Ras Hafun","Ras ben Sakka, Cape of Good Hope, Cape Verde","Cape Verde, Cape of Good Hope, Ras Hafun","York, Cape Verde, Ras Hafun"
"You want to learn about the history of the Teutonic Knights, so you travel from Marienburg (present-day Malbork in Poland) to Reval (present-day Talinn) ALONG the Baltic shore. Which countries will you visit?"," Russia, Lithuania, Latvia, Estonia","Lithuania, Latvia, Estonia","Lithuania, Latvia, Estonia, Finland","Estonia, Latvia, Lithuania","Russia, Lithuania, Latvia, Estonia"
You are now the captain of a German boat and you take tourists down the river Danube. Which European capitals can you visit?," Bratislava, Vienna, Budapest, Belgrade","Vienna, Belgrade, Bucharest","Berlin, Bratislava, Budapest, Belgrade","Bratislava, Vienna, Budapest, Belgrade","Prague, Vienna, Budapest"
"If you were a Japanese fisherman sailing from north to south, in which order will you pass the main islands of your country?"," Hokkaido, Honshu, Shikoku, Kyushu","Hokkaido, Honshu, Shikoku, Kyushu","Honshu, Okinawa, Iwo Jima","Kyushu, Honshu, Hokkaido","Shikoku, Okinawa, Honshu, Shikoku"
What French city is known as the “Wine Capital of Alsace”?, Colmar,Cannes,Colmar,Lyon,Avignon
Which of these places was chosen by Peter Jackson as the Middle Earth in The Lord of the Rings?, New Zealand,Iceland,All of these,New Zealand,Greenland
What castle was the inspiration for Disneylands Sleeping Beauty Castle?, Neuschwanstein Castle,Hohenzollern Castle,Neuschwanstein Castle,Wartburg,Stolzenfels Castle
Which Turkish town is home to the odd-looking rock formations called fairy chimneys?, Cappadocia,Istanbul,Izmir,Bursa,Cappadocia
"What European city has been known as the La Dominante, Queen of the Adriatic, City of Water, City of Masks?", Venice,Athens,London,Venice,Paris
"What city, located in the Himalayas, is known as “The Land of Gods” .", Kathmandu,Lahore,Pyongyang,Yangon,Kathmandu
"Located in San Diego County, legally, La Jolla is recognized as what?", An unincorporated community,A village,A city,An unincorporated community,A town
"Academicians have debated the origins of La Jollas name, but it is generally accepted that the name comes from a variation of the Spanish la joya which means what?", The jewel,The cove,The jewel,The joy (of life),The palm tree
"Mt. Soledad, a peak overlooking La Jolla, became world-famous primarily because of what situation?", A separation-of-Religion and State battle raging over a cross at the summit,A separation-of-Religion and State battle raging over a cross at the summit,"Residents trying to ban bicyclists from racing down the steep, narrow highway leading to the summit.",Hang glider enthusiasts suing for the right to launch off the peak,Illegal immigrants homesteading at the summit
On what date was the US Marine Corps founded?, November 10,November 25,September 19,June 20,November 10
What sword do US Marine Officers carry?, Mameluke Sword,Saber,Command Sword,Mameluke Sword,Semper Fi sword
What is the first line of the US Marine Corps hymn?, From the halls of Montezuma...,God bless the Marines...,God save the Enemy...,From the halls of Montezuma...,Oh Say can you see...
Which of these British territories are located in North America?, British Virgin Islands and Anguilla,British Virgin Islands and Anguilla,Saint Helena and Montserrat,Niue and Bermuda,Gilbraltar and Isle of Man
Where are the Pitcairn Islands located?, in the Pacific Ocean,in the Indian Ocean,in the Atlantic Ocean,in the Pacific Ocean,in the Arctic Ocean
What is the capital of Montserrat?," Plymouth(de jure), Brades(de facto)","Plymouth(de jure), Brades(de facto)",La Paz,Adamstown,Brazaville
"What is the capital of the group of four volcanic islands, known as the Pitcairn Islands?", Adamstown,Montserrat,Adamstown,Nuku Alofa,Catalonia
Who is in charge of the Vatican City?, The Pope,The Pope,International laws,Italys government,The Roman Catholic Church
"How is the residence of the Bishtop of Rome, the Prope, referred to?", Apostolic Palace,None of thee,Holy Palace,Apostolic Palace,Heaven Palace
The name of the Vatican City comes from which of the following?, The name of a region,None of these,The name of a region,A title in the Roman Catholic Church,The name of a saint
For what period of time are Popes elected to be the head of the Vatican City?, For a life term,For a life term,3 years,5 years,2 years
"The members of the Pontifical Guard, which reside in the Vatican City and serve as personal bodyguards of the Pope, are Catholic male citizens predominantly of this nationality.", Swiss,Swiss,German,Italian,French
The Vatican City has its own bank – Instituto per le Opere di Releigione or simply the Vatican Bank as it is more popular. This bank is owner of the only ATM in the country which is unique and famous with which of these features?, Its instructions are in Latin.,Its instructions are in Latin.,It is blessed by the Pope.,It works only on Sunday.,It is a holy ATM.
What is the official language of the Vatican City?, Italian,It has no official language,Latin,French,Italian
"According to Vatican jurisdiction, what happens to a person who loses his/her Vatican citizenship and has no other citizenship?", Becomes Italian citizen,Vatican citizenship cannot be lost - it is granted for life,Becomes international citizen,Becomes Italian citizen,Becomes citizen of whatever country he/she decides
Which of the following facilities is not present in the Vatican City?, Airport,Internet TLD,Railway,Television centre,Airport
In what year did Cardiff become the capital city of Wales?, 1955,1755,1955,1855,1655
The Welsh football (soccer) team qualified for the World Cup finals in 1958. What were the circumstances of their entry?, They won a play-off match with Israel who were grouped with various Arab nations - none of whom would play them.,They won a play-off match with Israel who were grouped with various Arab nations - none of whom would play them.,"Scotland dropped out due to financial pressures and Wales, being near neighbours, were invited to take their place.",They topped their qualifying group.,All the countries that applied to enter were allowed into the competition.
"The castles and town walls of North Wales, built under the orders of Edward I (in the late 13th and early 14th century) to suppress the Welsh, have always been regarded as an impressive sight. However, which of the castles was considered the nearest to perfect in the concentric castle design of the time?", Beaumaris,Flint,Conwy,Rhuddlan,Beaumaris
Who was the first Prime Minister of the UK to be born in Wales?, There hasnt been one,There hasnt been one,David Lloyd George,Lord Melbourne,Neil Kinnock
What abbreviation is used for a member of the Welsh Assembly?, AM,WAM,MSP,AM,MP
"In the America Bowl at Wembley stadium in 1987, the Welsh Full Back Paul Thorburn made a guest appearance for which NFL team?", L. A. Rams,Green Bay Packers,L. A. Rams,Chicago Bears,Denver Broncos
The Welsh are renowned for singing. One of their popular hymns is known in Welsh as Cwm Rhondda. By what name is it more commonly referred to in English?, Bread of Heaven,The River Song,All Things Bright and Beautiful,Bread of Heaven,When you come home again to Wales
In which South American country is there a small population that speaks only Spanish and Welsh?, Argentina,Guyana,Peru,Argentina,Chile
"Sushi, the icon of Japanese cuisine, is characterized by which of the following?", Specially prepared rice,Raw fish,Soy based dipping sauces and wasabi,Specially prepared rice,Seaweed wraps
The Japanese call Mount Fuji Fuji-san. San refers to which of the following?, A reading of the Chinese character that means mountain,A suffix adopted from WWII American troops,A reading of the Chinese character that means mountain,The Japanese word for the number three,"A term of respect, like the san that follows Japanese names"
Rooms in Japanese houses and apartments are typically measured by which of the following?, The number of tatami mats in the room,The number of tatami mats in the room,The number of futons that will fit in the room,Square feet,Square meters
The Japanese word baitoh (pronounced BUY-toe) means part time job and is adapted from which language?, German,English,French,German,Finnish
"In America, horror films are often released in October, to cash in on the Halloween season. In Japan, horror films are a staple of which season?", Summer,Spring,Fall,Winter,Summer
"In America, it is not unusual to find buildings with no thirteenth floor. In Japan, which floor of a hotel might one find missing?", 4,17,25,4,9
"Before money existed, people obtained goods this way.", Trading,Singing,Trading,Exchanging their children,Working
"The first money appeared around 1,200 BC in the form of this.", Oyster shells,Willow twigs,Corn,White pebbles,Oyster shells
This is when the first metal coins appeared., 1000 BC,2000 BC,3000 BC,4000 BC,1000 BC
American Indians used beaded shells as money. They called them this., Wampum,Wampum,Benjamins,Shavaya,Inda
"The first European metal coins, which resembled modern currency were made of this.", Silver,Brass,Silver,Gold,Copper
The first bills (banknotes) appeared in this country., China,China,India,Japan,Rome
The first banknotes were made of this., Leather,Oak leaves,Cloth,Leather,Paper
The first paper bills (banknotes) appeared in this year., 806,1700,1542,806,1420
Paper money were very convenient and much used. This led to their devaluation and they disappeared around this year., 1400,1300,1500,1400,1900
Oyster shells were used as money until this time., Until the middle of the 20th century,Until the 12th century,Until 1000 BC,Until the 15th century,Until the middle of the 20th century
"This successful Russian submarine, used during World War II, was responsible for the sinking of the German refugee transport Goya in April 1945.", L-3,U-110,U-505,L-3,L-4
"Which of these is not a class of American submarines, used during World War II?", Kairyu,Balao,Kairyu,Tench,Gato
"Operation Deadlight was the code name for the scuttling of U-boats surrendered to the Allies after the defeat of Germany, near the end of World War II. How many U-boats were scuttled?", 121,49,104,79,121
"In 1942, during World War II, RMS Laconia was sunk by what type of U-boat?", U-156,U-507,U-110,U-156,U-513
"This British submarine, under the command of lieutenant-commander Malcolm David Wanklyn, completed 24 patrols, sinking around 120,000 tons of enemy shipping.", HMS Upholder (P37),HMS Odin (N84),HMS Swordfish (61S),HMS Umbra (P35),HMS Upholder (P37)
What is the official state animal of Connecticut?, The sperm whale,The Husky dog,The wild turkey,The Connecticut river coon cat,The sperm whale
Who established the colony of Connecticut in 1636?, Thomas Hooker,Thomas Hooker,Adrian Block,Roger Williams,Henry Hudson
Why is Connecticut sometimes referred to as The Nutmeg State?, Yankee peddlers used to sell wooden nutmegs and try to pawn them off as the real thing.,Nutmeg grows wild in Southern New England and is the state plant of Connecticut.,New Englanders used to flavor all their cooking with nutmeg.,Yankee peddlers used to sell wooden nutmegs and try to pawn them off as the real thing.,The nutmeg spice was one of Connecticuts major trade commodities.
What is the capital city of Connecticut?, Hartford,New Haven,Waterbury,Hartford,Bridgeport
One of the statesmen on the Committee that drafted the Declaration of Independence was the delegate from Connecticut. What was his name?, Roger Sherman,Roger Sherman,Seth Thomas,Elihu Burritt,Oliver Wolcott
Which of these was one of the early heroes of the American Revolution who was executed by the British?, Nathan Hale,William Hart,Jonathan Groton,Charles Morgan,Nathan Hale
What is the state song of Connecticut?, Yankee Doodle,Connecticut is My Home,Long Live the Glories of  Old Connecticut,Yankee Doodle,Its a Grand Old Flag
When did Time magazine begin selecting Man of the Year?, 1927,1927,1937,1932,1942
When was the title Man of the Year changed to Person of the Year?, 1999,1949,2002,1982,1999
Who was selected as Time magazines first Man of the Year?, Charles Lindbergh,Charles Lindbergh,Owen D. Young,John F. Kennedy,Haille Selassie
Who was Time magazines first Man of the Year to be under 26 years old?, Charles Lindbergh,Nelson Mandela,Jeff Bezos,Charles Lindbergh,John F. Kennedy
Who was the first woman to win Time magazines title Man of the Year?, Bessie Wallis Warfield Spencer Simpson,Mother Teresa,Bessie Wallis Warfield Spencer Simpson,Queen Elizabeth II,Princess Diana
Who was the first non-American to be granted Time magazines title Man of the Year?, Mahatma Gandhi,Winston Churchill,Mahatma Gandhi,Joseph Stalin,Alfred Nobel
He was the first person involved in the automobile industry to win Time magazines title Man (or Person) of the Year., Walter Percy Chrysler,Walter Percy Chrysler,Gottlieb Daimler,Otto Benz,Henry  Ford
He was the first European to be selected Man of the Year by Time magazine. He was also the first winner to be executed in his country for treason., Pierre Laval,Hans von  Drucker,Konrad Adenauer,Pierre Laval,Laurence  des Lemaussanne
In 1986 this brave woman won Time magazines Man of the Year award. Three years earlier she witnessed the assassination of her husband., Corazon C. Aquino,Benazir Bhutto,Jacqueline Kennedy,Corazon C. Aquino,Indira Gandhi
Find the correct statement about Dwight David Eisenhower., He won Time magazines Man of the Year award once as President and once before he was President.,He never won Time magazines Man of the Year award.,He was the first person to win Time magazines Man of the Year award three times.,He won Time magazines Man of the Year award twice as US President.,He won Time magazines Man of the Year award once as President and once before he was President.
He was the first person chosen for Time magazines Man of the Year award two years in a row., Richard M. Nixon,Richard M. Nixon,Bill Gates,Vladimir  Putin,Franklin Delano Roosevelt
This American jurist won Time magazines Man of the Year award in 1973 and was influential in getting rid of the man who won the award in 1971., John Sirica,John Sirica,Yuri Andropov,King Faisal,Lech Walesa
In 1968 the Apollo astronauts were chosen for Time magazines Man of the Year award. Who were they ?," Anders, Borman, Lovell","Cernan, Lovell, Young","Schirra, Stafford, Sweigert","Anders, Borman, Lovell","Cunningham, Eisele, Young"
This two-time winner of Time magazines Man of the Year title came up with a plan to rebuild Europe after World War II., George Marshall,James F. Byrnes,George Marshall,William Westmoreland,Charles de Gaulle
In 1956 the Freedom Fighters of this country won Time magazines Man of the Year award., Hungary,Algeria,Nepal,Hungary,Czechoslovakia
She was the first Queen to win Time magazines title Man of the Year., Queen Elizabeth II,Queen Elizabeth II,Queen Latifah,Queen Margarethe,Queen Naor
"This man, named Person of the Year by Time magazine in 2001, stood tall after the 9/11 and inspired his city to get  through the terrible attack.", Rudy Giuliani,David Ho,Rudy Giuliani,Adrien Fenty,Peter Uberroth
"Cynthia Cooper, Coleen Rowley, and Sherron Watkins were granted Time magazines Person of the Year award. Under what title did they win?", The Whistleblowers,The Whistleblowers,The American Nurse,The European Union,The American Woman
"The name of which continent is believed to mean dust, cave, and sunny according to various theories on the origin of its name?", Africa,Europe,Asia,Australia,Africa
Valletta is the capital city of an island country belonging to the territory of this continent., Europe,Asia,Africa,Europe,South America
On what continent is the Quechua language spoken by its indigenous peoples?, South America,Africa,Australia,North America,South America
Victoria Land is a region located on this continent., Antarctica,North America,Europe,South America,Antarctica
"The Emu, the second-largest bird living on the planet, is indigenous to this continent.", Australia,South America,Asia,Africa,Australia
What is the largest and most populous continent on the planet?, Asia,North America,Africa,Asia,South America
"Mount McKinley, or Denali, is the highest mountain peak on this continent.", North America,Europe,Australia,South America,North America
"The longest river in the world is located on this continent, which is the second largest on the planet.", Africa,South America,Asia,North America,Africa
On which two continents are there cities named Darwin?, North America and Australia,North America and Europe,North America and Antarctica,North America and Australia,Europe and Australia
"The dishes Tom yum soup, hummus, chicken tikka and Nasi goreng belong to the cuisine of what continent?", Asia,Africa,Asia,South America,Europe
Which is the highest peak in the Canadian Rockies?, Mt. Robson,Mt. McKinley,Mt. Robson,Mt. Everest,Mt. Logan
"The name Canada comes from the St. Lawrence Iroquoian word, kanata. What does it mean in English?"," village, settlement",peace,"village, settlement",ocean,north
"This sea captain, who was second-in-command of the English fleet against the Spanish Armada, claimed for the Queen a North American territory called New Albion.", Drake,Champlain,Drake,Magellan,Cartier
What government agency was Newsweek Magazines CW 2008 referring to when they wrote Asleep at the regulatory switch?, SEC,FBI,SEC,CIA,DOT
"The arrow points up for this lady who, according to Newsweeks CW 2008, has brains, experience and a great work ethic. Who is Barack Obamas choice for U. S. Secretary of State?", Hillary Clinton,Hillary Clinton,Condoleezza Rice,Madeleine Albright,Nancy Pelosi
"Arrow down. Who according to Newsweeks CW 2008 is ill-informed, inarticulate shopaholic that has an ego bigger than Alaska?", Sarah Palin,Sarah Palin,Condi Rice,Nancy Pelosi,Tina Fey
Which is the longest river flowing through Poland?, Vistula,Danube,Odra,Vistula,Dniester
Which of the following countries is smaller (in terms of land area) than Poland?, Italy,Finland,Spain,Ukraine,Italy
Who was the first President of Poland?, Gabirel Narutowicz,Lech Kaczynski,Jozef Pilsudski,Gabirel Narutowicz,Lech Walesa
Poland was one of the first countries to have a constitution (1791). Which constitution/s was/were passed earlier than the Polish one?, American,French,"American, French and British",American,American and French
Which country does not have a land border with Poland?, Latvia,Germany,Lithuania,Latvia,Russia
In 1569 Poland united with this country to form a Commonwealth that covered an area of almost one million square kilometers., Lithuania,Lithuania,Ukraine,Austria,Russia
When was Poland accepted into the European Union?, 2004,1995,2007,2004,1989
"Between late XV and XVIII centuries, Polands kings were elected. Theoretically any noble man could become king. On many occasions a foreigner would be chosen. Which European ruling family did not have a member who was elected king of Poland?", Austrian Habsburgs,Swedish Vasa,Saxonys Wettin,French Valois,Austrian Habsburgs
Which city did not serve as capital of Poland?, Gdansk,Krakow,Poznan,Warsaw,Gdansk
What are the national colors of Poland?, white and red,"white, red and blue","red, black and yellow",blue and yellow,white and red
Poland has suffered many wars and has been occupied for many years. But Polish troops have been the attacking side as well. Which current European capital has never been occupied by the Polish army?, Budapest,Prague,Moscow,Berlin,Budapest
What is the lower house of the Polish Parliament called?, Sejm,Diet,Sejm,Bundestag,Duma
Which city lying on the Missouri River is the capital of North Dakota?, Bismarck,Pierre,Grand Forks,Fargo,Bismarck
This park lies on the border between Canada and North Dakota. It could be why this border needs no fences., International Peace Gardens,Glacier National Park,Teddy Roosevelt National Park,International Peace Gardens,Icelandic National Park
Which U.S. president stated he would have never been president had it not been for his experiences in North Dakota as a cattle rancher?, Theodore Roosevelt,Theodore Roosevelt,Lyndon B. Johnson,George W. Bush,Rutherford B. Hayes
This U.S. Senator from the 60s and 70s was known as Senator Wheat for his work at getting a higher price for wheat which during that time North Dakota was the leading producer., Milton R. Young,Quentin Burdick,Milton R. Young,Byron Dorgan,Mark Andrews
"This city and historical park in North Dakota boasts the rarity of having an albino buffalo. At the birth of White Cloud, Native American people from around the country came to view this creature, which is looked on spiritually by Native American Indians.", Jamestown,Medora,Fargo,Bismarck,Jamestown
The North Dakota State Fair is held in which city each August?, Minot,Fargo,Grand Forks,Minot,Bismarck
"Cleveland Indians 1st baseman/DH, Travis Hafner was born and raised in this North Dakota town.", Sykeston,Fargo,Carrington,Jamestown,Sykeston
General George Armstrong Custer left Fort Lincoln on the southern edge of this North Dakota town (named after the Native American tribes from that area) on his fateful trip to The Little Bighorn., Mandan,Bismarck,Standing Rock,Mandan,Dickinson
"This Police Woman was born and raised at Kulm, ND which also was the flax capital of North America!", Angie Dickinson,Angie Dickinson,Margita Hargitay,Cheryl Ladd,Peggy Lee
"The best walleye fishing lake in North America, according to Field and Stream Magazine, is this lake in northeast central North Dakota.", Devils Lake,Lake Audobon,Lake Lida,Lake Metigoshe,Devils Lake
"In 1953, television first came to Alaska. What were the call letters of the first broadcasting television station in Alaska?", KENI,KTVA,KYES,KTUU,KENI
