Questions,Correct,A,B,C,D
"This was the monumental marble tomb of the Anatolian king Mausolus. 140 feet high, it rivalled even the Egyptian pyramids.", The Mausoleum,The Mausoleum,The Colosseum,The Temple of Artemis,The Ziggurat of Marduk
"These temples were built on the islands of Malta and Gozo earlier than the Egyptian pyramids and Stonehenge. They date from the Bronze Age - 3,600 BC.", Ggantija and the Megalithic Temples,The Mayan Pyramids,Ggantija and the Megalithic Temples,The Ziggurat of Marduk,The Temple of Solomon
"This building inspired the Biblical myth of the Tower of Babel. It was a gigantic seven-stage multicolored pyramidal tower, over 300 feet high. However, only the ground plan and traces of the three stairs leading up to it have been preserved.", The Ziggurat of Marduk,The fortifications at Khattusas,Troy,The Ziggurat of Marduk,The Parthenon
"These buildings were designed to be both tombs and temples.  Mayan royalties carried out self-torture and mutilation rites on the roofs, as they believed that blood nourished gods.", The Mayan Pyramids,Ggantija and the Megalithic Temples on Malta,The Hanging Gardens,The Giants of Easter Island,The Mayan Pyramids
This First Lady of the United States started the first White House library., Abigail Fillmore,Abigail Washington,Abigail Fillmore,Abigail Lincoln,Abigail Adams
"When George Washington first won the Presidency, how many states did he carry?", 10 - he did not carry three states,"None - he was appointed, not voted in",13 - all of the states,10 - he did not carry three states,14 - the 13 original colonies plus Ohio
"Who was the first incumbent, one-term President not to be even nominated for another term although he wanted the office?", Millard Fillmore,Millard Fillmore,Zachary Taylor,Lyndon Johnson,Richard Nixon
Who was the first US president with no natural children?, George Washington,James Madison,George Washington,James Buchannan,John Tyler
"Who actually built Monticello, the estate of Thomas Jefferson?", Jeffersons slaves,Jefferson built it with his own two hands.,Jeffersons slaves,James Madisons construction company,Masons brought over from Europe by Jefferson
This very important Supreme Court case struck down a Connecticut law banning the use of contraceptives., Griswold v. Connecticut,Phillips v. Martin,Roe v. Wade,Connecticut v. Hutchinson,Griswold v. Connecticut
Who was the first US President to be born in the 19th century?, Millard Fillmore,Millard Fillmore,John Tyler,Andrew Johnson,Martin Van Buren
Two streets in Jerusalem are named after US Presidents. Which two?, Washington and Lincoln,Washington and Lincoln,Washington and  Kennedy,Lincoln and Kennedy,Kennedy and Nixon
This city in California bills itself as The Avocado Capital of the World., Fall Brook,Yorba Linda,Fall Brook,Pacific Grove,Sacramento
"This candy bar, produced by the Hershey Company, was created around 1928 by a former dairy farmer and shipping foreman for Milton S. Hershey.", Reeses peanut butter cups,Hersheys kisses,Reeses peanut butter cups,HEATH toffee bar,Hersheys chocolate bar
"Which African country is bordered by Nigeria, Cameroon, Niger, Libya, Sudan and the Central African Republic?", Chad,Mauritania,Chad,Togo,Mali
"I am thinking of a US state. The capitals of the states bordering it are Sacramento, Salem, Boise, Salt Lake City and Phoenix. What is the capital of the state I am thinking of?", Carson City,Denver,Olympia,Madison,Carson City
"This country, bordering the Arabian Sea on the south, also has land borders with Iran, Afghanistan, China and India.", Pakistan,Iraq,Azerbaijan,Turkmenistan,Pakistan
Oklahoma has borders with how may other states?, 6,7,5,6,4
"Switzerland has borders with France, Germany, Italy, Austria and which other country?", Liechtenstein,Luxembourg,Slovenia,Liechtenstein,Czech Republic
"The English county of Yorkshire was originally split into 3 districts that bordered each other. These districts were historically called, Ridings. Which of these was not one of the historic Ridings?", South Riding,North Riding,East Riding,South Riding,West Riding
"Take a good look, one of these US cities is as counterfeit as that fiver you spent on coffee this morning!"," North Orange, NJ","Millbrae, CA","North Orange, NJ","Osage, Florida","Bessemer, AL"
"Drat, I hate when the phone rings so early! Got another list for ya.  Who could imagine thered be so many fake towns out there!? Can you spot the fake one?"," St. Albins, MO","Grapevine, TX","St. Albins, MO","West Allis, WI","Cementville, IN"
"Help me with this list, one of these towns does not exist."," W. Memphis, TN","Covington, KY","Gastonia, NC","Collinsville, IL","W. Memphis, TN"
One of these towns is about as fake as that clip - on tie youre wearing.," Carruthers, SC","Cerritos, CA","Carruthers, SC","Des Moines, WA","Schaumburg, IL"
"Before we go to lunch, lets knock out one more list. Ya get it right, I buy you lunch!  Hows that for a deal?  Here, youll probably need this list, so you can spot the fake town on it."," Eden Prarie, MT","Eden Prarie, MT","Willow, AK","Edina, MN","Bloomfield Hills, MI"
"Lets look at this next file.  One of these towns aint kosher, pal! Which one?"," Menlo, CT","Strongsville, OH","Linthicum, MD","Menlo, CT","Hialeah, FL"
"Here, have a go at this while we wait to order.  These towns all look good to me, but what do I know?  One of them is fake."," Kentfield, ND","Moline, IL","Oil City, OK","Kentfield, ND","Plano, TX"
Which town on this list is fake?," Proctors Corner, VA","Leeds, AL","Burlingame, CA","Proctors Corner, VA","Federal Way, WA"
"Splendid lunch, but now I need a nap! Before we go, can you tell me which of these towns does not exist?"," Barclay, ME","Brentwood, TN","Barclay, ME","Conyers, GA","Humble, TX"
Which of these is an unofficial nickname of South Dakota?, Sunshine State,Sunshine State,Independence State,First State,Palmetto State
Which of these states is called The Cactus State?, New Mexico,New Jersey,New Hampshire,New Mexico,New York
What is Nebraskas nickname?, Cornhusker State,Cornhusker State,White Mountain State,Sagebrush State,Garden State
What Roman Goddess is the month of June named after?, Juno,Juno,Venus,Janus,Vera
What day is Flag Day celebrated on in the United States?, 14 June,20 June,26 June,6 June,14 June
Seattle was named after the Native American chief Seattle who belonged to what tribe?, The Suquamish,The Navajo,The Suquamish,The Cree,The Cheyenne
"Seattle, Washington, is regarded as the birth place of what style of music?", Grunge,Punk,Death metal,Blues,Grunge
Which of these is not a symbol of the city of Seattle?, Excelsior! - official motto,Seattle the Peerless City - official song,Great Blue Heron - official bird,Dahlia - official flower,Excelsior! - official motto
What animal is the official mascot of the baseball team the Seattle Mariners?, Moose,Bear,Whale,Moose,Fox
"Which of these is a sister city to Seattle, Washington?"," Reykjavík, Iceland","Reykjavík, Iceland","Paris, France","Warsaw, Poland","Kalmar, Sweden"
The 1993 movie Sleepless in Seattle starred Tom Hanks and which famous actress?, Meg Ryan,Audrey Tautou,Andie MacDowell,Nicole Kidman,Meg Ryan
"The Space Needle, Seattles 184-meter high symbol, is featured in the logo of which popular sitcom?", Frasier,Sex and the City,Married With Children,Frasier,Friends
"Which of these songs, referring to Seattle, was recorded by the famous grunge band Nirvana?", Frances Farmer Will Have Her Revenge On Seattle,The Shadow of Seattle,Frances Farmer Will Have Her Revenge On Seattle,The Day Seattle Died,Seattle Head
"Which of these statements about Seattle, Washington, is NOT true?", Seattle is the capital of the State of Washington.,"The original settlement, later to become Seattle, was initially called New York.",Seattle is the capital of the State of Washington.,In 2005 Seattle was proclaimed the most literate city in the USA.,Three people committed suicide jumping from the Space Needle in the 1970s.
Which man made lake lies in North Georgia?, Lake Lanier,Lake Michigan,Lake Lanier,Lake Burton,Lake Okeechobee
What mountain range is Mt. Rushmore located in?, Black Hills,Blue Ridge,Black Hills,Appalachian,Rockies
Which of these lakes is not part of the Great Lakes?, Great Salt Lake,Erie,Superior,Great Salt Lake,Michigan
What large river forms most of the border between the states of South Carolina and Georgia?, Savannah River,Georgia River,South Carolina River,Santee River,Savannah River
What is the largest saltwater lake in the United States?, Great Salt Lake,Great Salt Lake,none of these,Lake Pontchartrain,Lake Superior
"What river connects Lake Ontario, one of the Great Lakes, to the Atlantic Ocean?", St. Lawrence River,St. Marys River,St. Lawrence River,Niagara River,St. Clair River
The US shares water borders with all but one of these countries. Which is the odd one?, Argentina,Canada,Russia,Mexico,Argentina
What US state is situated to the East of the Bering Strait?, Alaska,Alaska,New Mexico,Florida,Hawaii
The Great Plains lie west of this river and east of the Rocky Mountains., Mississippi River,Tennessee River,Ohio River,Niagara River,Mississippi River
"Christopher Columbus went on his first voyage across the Atlantic Ocean in 1492, using three famous ships. Which of the following was not among them?", Doria,Pinta,Santa Maria,Niña,Doria
"What was special about Jacques-Yves Cousteaus ship Calypso, which was originally built for the British Royal Navy?", She was equipped as a mobile laboratory for field research,She sank mysteriously and was never seen again,Cousteau inherited her,She was equipped as a mobile laboratory for field research,She had 38 cannons
"This notorious passenger steamer was first launched in 1865. On the evening of September 3, 1878, it collided with another vessel and sank in the Thames.", Princess Alice,Princess Alice,Britannic,Queen Mary,Lady Nelson
"Lusitania and Mauretania were sister ships, built to compete with fast German liners. Which one of them was torpedoed and sunk by a German submarine in 1915?", Lusitania,Lusitania,None,Both,Mauretania
"In 1620, this ship made a historical voyage from Plymouth, England to North Virginia, transporting the Pilgrims to America.", Mayflower,Lady Nelson,Christopher Jones,Mayflower,Nimreid
Three of the following vessels are sister ships. Which one does not belong to the group?, Austric,Olympic,Titanic,Austric,Britannic
"This famous French ocean liner was launched in 1932 and received a lot of applause. It was the first liner to surpass 60,000 tons, the first ship with 1,000 feet of length and the first to make an Atlantic crossing with an average speed of over 30 knots.", Normandie,Adriatic,Achille Lauro,Aramis,Normandie
"This 8,600-ton transatlantic passenger steamship became famous after rescuing the survivors after the sinking of Titanic.", Carpathia,Belfast,United States,Queen Elizabeth,Carpathia
Which ship was named after the consort of George V of the United Kingdom and sailed the North Atlantic Ocean from 1936 to 1967?, Queen Mary,Princess Alice,Queen Mary,Queen Elizabeth,Victoria
All of these vessels except one are famous steam-powered ships crossing the Atlantic Ocean. Name the odd vessel., Cutty Sark,Carpathia,Savannah,Cutty Sark,El Horria
"The highest waterfall on the planet, the Angel Falls, is located on this continent.", South America,Africa,Asia,South America,North America
The Republic of Djibouti is a small country located in the northeastern part of this continent., Africa,South America,Asia,Africa,North America
The most populous country in the world is in this continent., Asia,North America,Africa,South America,Asia
"The Jutland Peninsula, a.k.a. the Cimbrian Peninsula in the past, is located in this continent.", Europe,Australia,Europe,Antarctica,Africa
On what continent is the Great Victoria Desert located?, Australia,Africa,South America,Australia,North America
On what continent is the largest fresh water reserve on the planet located?, Antarctica,Antarctica,North America,Asia,South America
On what continent is the city of Puebla located?, North America,South America,Europe,Africa,North America
"The capybara, the largest extant rodent species on the planet, is endemic to this continent.", South America,Europe,South America,Australia,Asia
"The Amur River, the ninth longest river in the world, is located on this continent.", Asia,North America,Europe,Asia,South America
On what continent is the Yoruba language spoken as a native language of the indigenous people?, Africa,Africa,Asia,South America,North America
One of the most notable civilizations of pre-Columbian America was the Inca Empire. The Incas referred to their king by what title?, Child of the sun,Child of the mountains,Child of the sun,Child of the lands,Child of the winds
"What is the official language of the smallest sovereign state of South America, Suriname?", Dutch,Portuguese,Spanish,Dutch,French
Which of the following South American countries is paired with the wrong capital?, Colombia - Santiago,Colombia - Santiago,Uruguay - Montevideo,Paraguay - Asunción,Ecuador - Quito
Which of these is a music genre NOT typical for South America?, None of these,None of these,Tango,Samba,Cumbia
The Amazon River is the largest river in the world by volume. Because of its dimensions it has been nicknamed The River Sea. What width does the Amazon River reach at its widest point during the dry season?, 11 km (7 mi),3 km (2 mi),11 km (7 mi),7 km (4 mi),35 km (21 mi)
What makes the South American Atacama Desert one of the driest places on Earth?, The proximity to the Andes,The acid rains,The altitude of the desert,The proximity to the Andes,The lava flows
"With the Louisiana Purchase of 1803 America was able to double the size of its territory, and for a bargain price to boot. Who was the generous salesman?", Napoleon Bonaparte as First Consul,Emperor Napoleon I,The (French) Directory,Napoleon Bonaparte as First Consul,The (French) National Convention
In what year was the Halloween novelty song Monster Mash released?, 1962,1969,1971,1962,1965
The novelty song Monster Mash is narrated by whom?, A Mad Scientist,Dracula,Frankensteins Monster,An Evil Ghoul,A Mad Scientist
"In a 1978 episode of Happy Days, this character sang Monster Mash using a Peter Lorre impersonation.", Richie Cunningham,Chachi,Potsy Webber,The Fonz,Richie Cunningham
The Monster Mash song was performed in an impersonation of which famous horror actor?, Boris Karloff,Vincent Price,Boris Karloff,Bela Lugosi,Peter Lorre
"According to the American Greeting Card Association, approximately how many cards are sent out each year on Valentine’s Day?", billion,billion,750 million,1.5 billion,500 million
In what decade were the first commercial Valentines cards produced in the United States?, 1840s,1920s,1870s,1840s,1930s
Where is the Easter Island located?, Southeastern Pacific,Southeastern Pacific,South Atlantic,In the Caribbean,Northwestern Indian Ocean
Which of these rivers is considered sacred in Hinduism?, Ganges,Danube,Amazon,Nile,Ganges
On which island did Napoleon die?, Saint Helena,Saint Thomas,Saint Lucia,Saint Helena,Saint Martin
Which part of the US is known as the Bible Belt?, Southeastern,Southeastern,Southwestern,Northeastern,Northwestern
Which capital city name can be translated as God-given (or Gods gift)?, Baghdad,Tokyo,Baghdad,Rome,Jerusalem
Which country name does not have Christian origin?, Cape Verde,Cape Verde,San Marino,Trinidad and Tobago,El Salvador
Which saint does not have his/her own island in the Caribbean?, Saint Clara,Saint Martin,Saint Barthelemy,Saint Clara,Saint Lucia
To which country does the term Holy Land refer?, Israel,Bhutan,Israel,India,Saudi Arabia
Which saint country is the oldest functioning republic in the world?, San Marino,Saint Kitts and Nevis,São Tomé and Príncipe,Saint Vincent and the Grenadines,San Marino
Brahma is a Hindu god of creation. What does the name of the river Brahmaputra mean?, Son of Brahma,Brahma is the King,Son of Brahma,Gift of Brahma,Curse of Brahma
"This TV tower in Shanghai, China, was designed around a Tang Dynasty poem.", Oriental Pearl Tower,Ostankino Tower,Oriental Pearl Tower,Tianjin Radio and Television Tower,Milad Tower
"Which is the tower located in Toronto, Canada, whose construction was started on February 6, 1973 by the Canadian National Railway?", CN Tower,Chimney of Mitchell Power Plant,CN Tower,Kennecott Smokestack,Stratosphere Tower
"Which tall tower in Malaysia, built in 1995, is a place for annual races up the stairs to the top?", Menara Kuala Lumpur,Endesa Termic,Tashkent Tower,Menara Kuala Lumpur,Liberation Tower
"Which 350-meter tower in Las Vegas, Nevada, is actually a famous hotel and casino?", Stratosphere Tower,Stratosphere Tower,West Pearl Tower,Alma-Ata Tower,Inco Superstack
"What is the name of the tower that was built in Kuwait before the Iraqi invasion on August 2, 1990?", Liberation Tower,Europaturm,Liberation Tower,Central Radio and TV Tower,Tashkent Tower
The design of which Japanese tower is based on the Eiffel Tower in Paris?, Tokyo Tower,Tokyo Tower,Zhuzhou Television Tower,Donauturm,Hillbrow Tower
"Which of the following is a tall tower in New Zealand, part of the SKYCITY Auckland casino complex.", Sky Tower,Star Tower,Sky Tower,Stratosphere Tower,Space Tower
Which Australian tower was previously known as the AP Tower or The Centrepoint?, Sydney Tower,Pirelli Tower,Sydney Tower,KUL Control Tower,Gyrotour
Which famous Moscow TV and radio tower was designed by Nikolai Nikitin?, Ostankino Tower,Ostankino Tower,Rousse TV Tower,St. Petersburg TV Tower,Space Needle
"What is the name of the tall tower in Rotterdam, built specially for the 1960 Floriade in the Netherlands?", Euromast,Nigoya,Euromast,Clagary,Criggion
"Which city houses the oldest Polish university, established in 1364?", Kraków (Cracow),Kraków (Cracow),Warszawa (Warsaw),Praha (Prague),Vilnius
"In 1991 inhabitants of this Balkan city celebrated after their football club, Crvena Zvezda, won the European Cup.", Belgrade,Berno,Budapest,Belgrade,Bucharest
"Legend has it that Martin Luther nailed a copy of his 95 Theses to the door of the Castle Church in this city, thus beginning the Reformation.", Wittenberg,Insbruck,Mainz,Nuernberg,Wittenberg
Which city is nicknamed Queen of the Adriatic?, Venice (Venezia),Venice (Venezia),Dubrovnik,Genoa,Trieste
In which Danish city was Hans Christian Andersen born?, Odense,Goeteborg,Aalborg,Odense,Copenhagen
Strasbourg is the main city of the Alsace region which is located in this country., France,Switzerland,the Netherlands,France,Germany
Which citys name literally means merchants harbour?, Copenhagen,Seville,Gdansk,Copenhagen,Venice
The former name of this city was Breslau and it used to be a major city of south-eastern Germany. It came under Polish administration in 1945. What is its present-day name?, Wrocław,Chemnitz,Brzeg,Brno,Wrocław
Which city was surrounded by an enormous Turkish army in 1683 and was saved by a much smaller multinational army led by the Polish king Jan III Sobieski?, Vienna,Warsaw,Vienna,Budapest,Prague
In what city is the European Central Bank located?, Frankfurt,Paris,Frankfurt,Zurich,Brussels
"This city, which is an administrative center of a Russian enclave, was once a Prussian city called Königsberg.", Kaliningrad,Królewiec,Kaliningrad,St. Petersburg,Leningrad
"This European capital consists of two parts, which used to be separate cities until 1873.", Budapest,Paris,Madrid,Vienna,Budapest
Pittsburgh is known as three of these alternative names. Which is the odd one?, Quaker City,Iron City,City of Bridges,Quaker City,Steel City
"Bangs, Gun Barrel City, Honey Island, Oatmeal, Chocolate Bayeau, Ben Franklin, Cut and Shoot, Ben Hur, Lollipop, Uncertain are cities in this state.", Texas,Pennsylvania,Louisiana,Texas,Colorado
"Roscoe, Bonesteel, Box Elder, Eaglebutte, Red Butte, Crooks are the names of cities in this state.", South Dakota,Pennsylvania,South Dakota,Vermont,Colorado
"Where are the cities Eros, Vixen, Waterproof,  Ft. Necessity, Cutoff, Plain Dealer, Angie?", Louisiana,California,Washington,Oregon,Louisiana
New York was established by European colonists who named it after the capital of their country. What was the former name of New York?, New Amsterdam,New Brussels,New Amsterdam,New Paris,New Edinburgh
What was the name of St. Petersburg in Soviet times?, Leningrad,Karl Marx Stadt,Stalingrad,Kaliningrad,Leningrad
Which European capital was known as Reval?, Talinn,Valetta,Tirana,Talinn,Riga
Which city was formerly known as Kaapstad?, Cape Town,New York,Kaliningrad,the Hague,Cape Town
The capital of the Russian enclave located between Poland and Lithuania is called Kaliningrad. What was its former name?, Königsberg,Königsberg,Królewiec,Volgograd,St. Petersburg
Which port on the Danube river was called Pressburg?, Bratislava,Belgrade,Budapest,Vienna,Bratislava
Stalingrad was the scene of an important battle during WW II. What is the name of the city today?, Volgograd,Volgograd,Kiev,St. Petersburg,Nizny Novogorod
"Ho Chi Minh City, the largest city of Vietnam, is widely known under its former name. What was it?", Saigon,Hanoi,Edo,Bien Hoa,Saigon
Communists liked to name cities after their leaders. Which German city was known as Karl Marx Stadt?, Chemnitz,Berlin,Dresden,Chemnitz,Erfurt
What was the former name of Istanbul?, All of these,Byzantium,Constantinople,Augusta Antonina,All of these
"What is the modern name of Tenochtitlan, the capital of the Aztec civilization?", Mexico City,Lima,Mexico City,Guatemala City,Quito
Edo was an important Japanese city and capital of the Togukawa shogunate. Under what name is it known nowadays?, Tokyo,Hiroshima,Osaka,Kyoto,Tokyo
"Francis Scott Key wrote this poem in 1814, which later became the lyrics of the US national anthem.", Defence of Fort McHenry,The Unforgiven,My Dear Country,Stars in the Sky,Defence of Fort McHenry
"In 1931, this president signed a Congressional resolution, by which The Star-Spangled Banner was adopted as the national anthem of the United States.", Herbert Hoover,Herbert Hoover,John F Kennedy,Lyndon Johnson,Woodrow Wilson
The National Anthem of Russia was adopted in this year., 2000,1946,1884,1917,2000
"This actress, writer, talk-show host and comedian performed The Star Spangled Banner before a baseball game in San Diego on July 25, 1990.", Roseanne Barr,Jerry Seinfeld,Stephen Lynch,Jennifer Lopez,Roseanne Barr
What country is this national anthem of?, Canada,Mexico,France,Canada,Italy
Which General Motors brand name honors a Native American Chief?, Pontiac,Chevrolet,Hummer,Pontiac,Vauxhall
Which of these cars was named after a girl?, Mercedes,Corolla,Laguna,Cordoba,Mercedes
"French automobile manufacturer Citroen is not very creative. C2, C3, C4.. are not interesting for us. However one of their models bears the name of a famous painter. Which one?", Picasso,Dali,Picasso,Monet,Renoir
Which GM model is really a STAR?, Opel ASTRA,Opel ASTRA,Chevrolet AVEO,Pontiac G8,Cadillac ESCALADE
"SEAT, the subsidiary of the VW group, names car models after Spanish cities or regions. Which is not one of them?", Corsa,Toledo,Malaga,Corsa,Ibiza
What do Renaults Clio and Thalia have in common?, Both were Greek Muses.,Both are cities in France.,They bear the names of their constructors.,Both were Greek Muses.,They are produced on the same frame.
The Ferrari Testarossa went into production in 1984. What does Testarossa mean?, Red head,White rose,Red head,Black horse,Subtle taste
Which car is not WINDY?, Renault MEGANE,Maserati MISTRAL,Lincoln ZEPHYR,VW BORA,Renault MEGANE
The name of this car was also the name of a ship used for the exploration of the New World in the 15th century., Caravelle,Pajero,Caravelle,Transporter,Pathfinder
The name of which car can be associated with a DATE?, Buick RENDEZVOUS,Renault LAGUNA,Buick RENDEZVOUS,Lotus ELISE,Fiat MIRAFIORI
Where was the Titanic built?, Ireland,France,Ireland,United States,England
What company owned the Titanic?, White Star,Cunard,Red Star,White Star,America Lines
When was the Titanic launched?," May, 1911","June, 1889","August, 1949","May, 1911","May, 1918"
From what harbor did the Titanic set sail?, Southampton,New York,London,Belfast,Southampton
Who was the Captain for the Titanics Maiden voyage?, E. J. Smith,Nate Turner,E. J. Smith,Stanley Lord,J. M. Grube
Which of the following was not a passenger on the Titanic?, J. Pierpont Morgan,Margaret Molly Brown,Benjamin Guggenheim,John Jacob Astor,J. Pierpont Morgan
What time did the Titanic strike the iceberg?, 11:40 PM,5:30 PM,11:40 PM,8:01 am,7:20 PM
The Titanic had a total of how many lifeboats?, 20,10,32,20,14
How many people could the Titanic hold fully loaded?," 3,547","6,751","3,547","2,850","1,887"
What was the name of the ship that rescued the passengers from the sea after the Titanic hit the iceberg?, Carpathia,Carpathia,Olympic,Normandie,Lusitania
Which of the following Latin American dictators was once courtmartialed for kidnapping and rape?, Rafael Trujillo,Juan Peron,Francois Duvalier,Porfirio Diaz,Rafael Trujillo
Which of the following had the nickname Papa Doc?, Francois Duvalier,Hugo Chavez,Fidel Castro,Manuel Noriega,Francois Duvalier
The name of which dictator became a catchphrase on the TV show Saturday Night Live during its first season in 1975?, Franco,Salazar,Idi Amin,Franco,Pinochet
"This Philippine president was forced to leave his country in 1986, amidst growing opposition sparked by his fraudulent election.", Ferdinand Marcos,Corazon Aquino,Manuel Roxas,Ferdinand Marcos,Diosdado Macapagal
Which one of the following ruled Taiwan until his death in 1975?, Chiang Kai-Shek,Deng Xiaoping,Chiang Kai-Shek,Chou En Lai,Sun Yat- Sen
Which one of the following was commonly referred to as El Caudillo?, Franco,Mubarak,Suharto,Franco,Peron
On what date is Festivus celebrated?, December 23,December 26,December 23,December 25,July 14
