Questions,Correct,A,B,C,D
"No state has as many different species of mammals as this one. The average square mile of land contains 1.4 elk, 1.4 pronghorn antelope, and 3.3 deer.", Montana,Nebraska,Nevada,Colorado,Montana
One of the following pairs (state - its capital) is wrong., North Dakota - Fargo,Kentucky - Frankfort,Kansas - Topeka,Maine - Augusta,North Dakota - Fargo
The 3rd Monday in April is Patriots Day - a legal holiday in this state., Massachusetts,California,Washington,Oregon,Massachusetts
Francis Drake was 66 years old at his inauguration and the oldest governor of this state., Iowa,Nevada,Ohio,Minnesota,Iowa
What is the state capital of Washington?, Olympia,Olympia,Seattle,Walla Walla,Spokane
What is the state capital of Oregon?, Salem,Bend,Portland,Eugene,Salem
What is the state capital of California?, Sacramento,Sacramento,Los Angeles,San Diego,San Francisco
What is the state capital of Idaho?, Boise,Boise,Idaho Falls,Pocatello,Coeur DAlene
What is the state capital of Nevada?, Carson City,Reno,Las vegas,Carson City,Austin
What is the state capital of Utah?, Salt Lake city,Cedar City,Provo,Price,Salt Lake city
What is the state capital of Arizona?, Phoenix,Phoenix,Kingman,Tucson,Flagstaff
What is the state capital of Alaska?, Juneau,Kodiak,Juneau,Anchorage,Fairbanks
"During World War II, this country was able to successfully defend its freedom and resist invasions by the Soviet Union - despite some loss of territory. It joined the European Union in 1995.", Finland,Poland,Czech Republic,Finland,Lituania
This country shares common boundaries with every South American country except Chile and Ecuador., Brazil,Colombia,Argentina,Bolivia,Brazil
"After gaining its independence in 1991, it has retained closer political and economic ties to Russia than any of the other former Soviet republics.", Belarus,Ukraine,Latvia,Bulgaria,Belarus
"It was once the center of power for an empire.  Occupied by the allies in 1945, a state treaty ended its occupation in 1955 and recognized its independence.", Austria,Belgium,Denmark,Austria,Hungary
This country is home to the northernmost capital in mainland Europe?, Finland,Sweden,Denmark,Finland,United Kingdom
It is the sixth largest country and home of The Doctor breeze., Australia,Ukraine,Canada,Australia,United Kingdom
Its three-year-old Socialist government was overthrown in 1973 by a dictatorial military regime led by Augusto Pinochet., Chile,Peru,Paraguay,Chile,Uruguay
"This country dominates the Aegian Sea and possesses an archipelago of about 2,000 islands.", Greece,Italy,Cyprus,Greece,Turkey
"This country controls the Sinai Peninsula.  Following the completion of the Suez Canal in 1869, it became an important world transportation hub.", Egypt,Thailand,Egypt,Hong Kong,Libya
The first American capital.  It has a nick name coined by musicians - it means  to play the big time., New York,Washington D.C.,New York,Boston,San Francisco
The cable cars of this city are the only mobile National Monument., San Francisco,Oklahoma,San Francisco,Nevada,Los Angeles
"When broken down into kanji, the name of this capital city means east and capital.", Tokyo,Nagoya,Osaka,Kyoto,Tokyo
The Seine river divides this city into the Rive Droite (French for Right Bank) north of the river and the Rive Gauche (French for Left Bank) south of the river., Paris,Lille,Lyon,Marseille,Paris
"This city situated south of China is made up of 230 islands, Lantau Island being the largest.", Hong Kong,Taipei,Peking,Shanghai,Hong Kong
This city is the only one located on two continents., Istanbul,Kadis,Istanbul,Tanjer,Athens
In the devilish year of  1666 a great fire occured in this European capital city. Half of it burned down., London,Rome,Paris,Vienna,London
One of this citys most prominent landmarks is the Brandenburger Tor (Brandenburg Gate).  It once marked the boundary between East and West Germany., Berlin,Berlin,Munchen,Frankfurt,Bonn
This city is famous for its water-channel traffic. It has been designated a World Heritage Site., Venice,Barri,Naples,Venice,Rome
This Peruvian city is stuck between the desert and the sea. It is also known as The City of the Kings., Lima,Trujillo,Cuzco,Chimbote,Lima
Which of these U.S. states is not a Four Corners state?, Wyoming,New Mexico,Utah,Colorado,Wyoming
The Appalachian Trail divides two states as it makes its trek through Great Smoky Mountains National Park. Name the states it divides., North Carolina and Tennessee.,New Hampshire and Maine.,North Carolina and Tennessee.,West Virginia and Maryland.,Georgia and Alabama.
"The town of San Ysidro is located in what state, near what border?"," California, near the border with Mexico.","California, near the border with Mexico.","Washington, near the border with Oregon","California,  near the border with Arizona","Iowa, near the border with Missouri"
Mount Fuji is a nearly perfectly shaped volcano.  It has been worshipped as a sacred mountain., Japan,Thailand,China,Japan,Malaysia
Mount Everest was formed some 50 million years ago. It rises a few meters each year because of geological forces. On the border between which two countries is this mount situated?, China and Nepal,Sumatra and China,Thailand and Nepal,China and Nepal,Nepal and India
"From forest to desert, the Grand Canyon has the most extreme nature climate.", USA,Mexico,Canada,USA,Brazil
"Through thousands of years in existence, Niagara Falls has been eroding at a rate of 4 feet (1.5 meters) per year.", Canada,Mexico,Equador,Canada,Argentina
The name of mount Kilimanjaro comes from Swahili and means the mountain that glitters., Tanzania,Tanzania,Zimbabwe,Uruguai,Zambia
The Great Barrier Reef consists of many colonies of corals. That is why it is sometimes referred to as the largest living animal in the world., Australia,Armenia,Australia,Austria,Anrgentina
"Krakatoa volcano caused the most violent volcanic eruption recorded in worlds history.  In 1883, it destroyed 75 % of the territory of its island.", Indonesia,Thailand,Malaysia,Indonesia,Surinam
"Local Batonga people had named Victoria Falls Mosi-Oa-Tunya, which stands for the smoke that thunders.", Zimbabwe,Malawi,Zimbabwe,Mozambique,Namibia
The scientific name for the Northern Lights phenomenon is Aurora Borealis. They are often mistaken for UFOs.  Where do they happen?, In the northern part of our planet,In the southern part of our planet,On the Equator,In Newfoundlend,In the northern part of our planet
"Nicknamed the Grand Canyon State, it entered the Union on Feb 14, 1912.", Arizona,Utah,Nevada,New Mexico,Arizona
"This US state, nicknamed The Sunshine State, is famous with its beaches and theme parks.", Florida,Texas,California,Georgia,Florida
"Nicknamed the Treasure State, this western US state is fourth largest in area.", Montana,Nevada,Oregon,Montana,California
"Nicknamed the Ocean State, it is the smallest US state.", Rhode Island,Hawaii,Delaware,New Hampshire,Rhode Island
"The Beehive State requested admission to the Union in 1849 under the name Deseret.  After polygamous marriage practices were discontinued, it was finally admitted in 1896, under what name?", Utah,Arizona,Colorado,South Dakota,Utah
"Nicknamed the Green Mountain State, this eastern US state was admitted to the Union on March 4, 1791.", Vermont,Vermont,Pennsylvania,Connecticut,Delaware
"Nicknamed The Buckeye State, it is the birthplace many former US presidents, including Ulysses S. Grant.", Ohio,Nebraska,Iowa,Ohio,Indiana
"This US state, known as the Equality State, is home of Devils Tower, featured in the movie Close Encounters of the Third Kind.", Wyoming,North Dakota,Wyoming,Idaho,Washington
"Home on the Range is the state song of this US mid-western state, known as The Sunflower State.", Kansas,Kansas,Nebraska,Indiana,Illinois
"This Bluegrass State hosts a famous horserace in Louisville, and is the birthplace of President Abraham Lincoln.", Kentucky,Kentucky,Kansas,Nebraska,Illinois
"This volcano, featured in a short 1933 Academy Award-winning movie, is located near the Indonesian island of Rakata, in the Sunda Strait.", Krakatoa,Ruapehu,Krakatoa,Kilauea,Pinatubo
"Located in Tanzania, it is Africas highest mountain.", Mount Kilimanjaro,Mount Kenya,Maromokotro,Mount Kilimanjaro,Ras Dascian
"One of the most intriguing attractions of Venice is Ponte dei Sospiri, which means this in English.", The Bridge of Sighs,The River of Tears,The Bridge of Sighs,The Street of Sorrow,The House of Death
"If you think you can see the Statue of Liberty only in New York City, think again! I went to this huge European city and saw it right there, standing near the Grenelle Bridge and looking towards the Atlantic Ocean, facing its larger sister in New York Harbor.", Paris,Paris,Madrid,London,Barcelona
When I visited this lonely continent I was so moved by the spherical-sectioned shells of the opera house in this city., Sydney,Sydney,Melbourne,Brisbane,Adelaide
"Madrid is the largest city and capital of this country, whose the most valuable natural resource is the soil - nearly one-third of the land is suitable for cultivation.", Spain,Spain,Portugal,Argentina,Brazil
"Bern is the capital of this country, where most rivers are not suitable for navigation due to their great falls and swift currents.", Switzerland,Denmark,Sweden,Finland,Switzerland
"Ulaan Baator is the capital of this sparsely populated country, where domesticated animals outnumber people.", Mongolia,Chile,Brazil,Mongolia,Uruguay
"This country’s capital, Sucre, is nicknamed “the white city” because most of the colonial buildings in the city centre are white.", Bolivia,Bolivia,Pakistan,Honduras,Kenya
This country is about the size of California but has about one -sixth of its population. Its capital city is Asunción., Paraguay,Cuba,Paraguay,Peru,Honduras
"Vientiane is the capital of this country, which has more than 50 ethnic groups, divided into three broad categories.", Laos,North Korea,Vietnam,Laos,Cambodia
"Phnom Penh is the capital of this country, whose official language is Khmer.", Cambodia,Cambodia,South Vietnam,Laos,North Vietnam
"Vienna is the capital of this landlocked country, which became a member of the European Union in 1995.", Austria,Australia,Belgium,Austria,Germany
"Montevideo is the capital of this second smallest country in South America, after Suriname.", Uruguay,Paraguay,Bolivia,Chile,Uruguay
"Caracas is the capital of this country, a Spanish colony for more than 300 years, before it declared its independence in the early 19th century.", Venezuela,Peru,Columbia,Venezuela,Chile
"With the aid of Queen Isabella of Spain, Christopher Columbus set off in 1492 using three tiny ships.  One of these ships was not part of the expedition.", The Victoria,The Santa Maria,The Pinta,The Victoria,The Nina
Which of the following pairs (explorer - region he discovered) is not correct?, Cabral - Uruguay,Cortez - Mexico,Pizarro - Peru,Cabral - Uruguay,Vespucci - Argentina
Which of the following was not a cause of the Great Geographical Discoveries?, The Portuguese King thought his admirals would dethrone him and he wanted to send them away.,The Portuguese King thought his admirals would dethrone him and he wanted to send them away.,Many new inventions like the compass helped the sailors a lot.,The Turks controlled the land route to India. That forced the Western countries to seek alternative routes.,Western monarchs along with the Pope wanted to spread their influence through converting the newly discovered nations to Christianity.
Trenton is the capital of this eastern state., New Jersey,Maryland,New York,New Jersey,Connecticut
Juneau is the capital of this last frontier state., Alaska,Utah,Alaska,California,Nevada
"Columbus discovered the Americas in 1492, and is rewarded with this midwestern state naming its capital after him.", Ohio,North Carolina,South Carolina,Ohio,Georgia
Helena is this Rocky Mountain states capital., Montana,Nevada,California,Wyoming,Montana
Richmond is the capital of this state where many US presidents were born., Virginia,Maryland,Virginia,West Virginia,Delaware
The capital of this diverse northwestern state is Salem., Oregon,Massachusetts,Oregon,New Hampshire,Washington
"This state, which houses one of the largest cities in the world, has Albany as its capital.", New York,New York,New Mexico,Georgia,Minnesota
Jefferson City serves as the capital of this Midwestern state., Missouri,Texas,California,Missouri,Florida
The capital of this southern state is also known as music city., Tennessee,Delaware,Tennessee,Kentucky,Georgia
Carson City is the capital of this Battle Born State., Nevada,Arizona,Nevada,California,Utah
Tallahassee is situated on the panhandle of this southern state and serves as its capital., Florida,Pennsylvania,Florida,North Dakota,California
"If you are in Sacramento, the capital of this western state, you are within a days drive to beautiful beaches, high mountains with famous national parks, and one of the deepest, most picturesque lakes in the world.", California,Arizona,California,Utah,Washington
Austin is the capital of this US state which once existed as an independent republic., Texas,Texas,Maine,Georgia,South Carolina
This northeast state has Augusta as its capital., Maine,New Hampshire,Maine,Pennsylvania,Vermont
"This southern state has many beaches, an incredible fort from the revolutionary war, and Columbia as its capital.", South Carolina,South Carolina,Ohio,Illinois,North Carolina
This midwestern state has Madison as its capital., Wisconsin,Wisconsin,Indiana,Kentucky,Illinois
"Salt Lake City, known for the salty, barren desert lake to the west of the city, was founded by mormons and is the capital of this geographically diverse state.", Utah,Utah,South Dakota,Nevada,North Dakota
This eastern state with rich history has Annapolis as its capital., Maryland,Maryland,New Mexico,New Jersey,Virginia
Springfield is the capital of this midwestern state., Illinois,Kentucky,Missouri,Illinois,Ohio
Only this one of the seven wonders of the world survived the trials of time and is open to visitors., Great Pyramid of Giza,Colossus of Rhodes,Statue of Zeus at Olympia,Great Pyramid of Giza,Lighthouse of Alexandria
"A wonder of the ancient world was built on the territory of all of these modern-day countries, but one.  Which is the odd one?", Syria,Iraq,Syria,Egypt,Turkey
In what century was the original version of the Seven Wonders of the World list created by Antipater of Sidon?, 2nd century BC,6th century BC,2nd century BC,7th century AD,3th century AD
"The Great Pyramid of Giza, the oldest of the Seven Wonders of the Ancient World, was built approximately how long ago?", 4500 years ago,1000 years ago,2000 years ago,700 years ago,4500 years ago
"According to legends, what was the purpose of the most mysterious of the Seven Wonders of the Ancient World -- The Hanging Gardens of Babylon?", Comfort a rulers wife,Resemble the Heavens,Please the gods,Comfort a rulers wife,Provide a place of solace and recreation for the rulers
"The Statue of Zeus, a Wonder of the Ancient World created in the ancient city of Olympia in 435 BC, was made primarily of what material?", Ivory,Copper,Gold,Marble,Ivory
"Built in honor of the Greek goddess Artemis, the Temple of Artemis was an enormous architectural construction for its time. In Greek mythology, Artemis is the goddes of what?", Hunt and the moon,"Wisdom, strategy, and war",Beauty and Love,"Plague, beauty, light, healing, colonists, medicine",Hunt and the moon
"Like the Great Pyramid of Giza, the Mausoleum of Maussollos is the burial place of an ancient ruler - king Mausollos of Caria. Who conceived the idea of building this ancient wonder of the world?", Maussolloss sister,Maussolloss best friend and advisor,Maussolloss son,Maussolloss sister,Maussolloss brother
"The Colossus of Rhodes was a giant statue, erected at the Greek island Rhodes harbor in 3rd century BC. Which ancient Greek god did the statue depict?", Helios,Ares,Helios,Zeus,Eurus
"The Lighthouse of Alexandria, the only one of the Seven Wonders, which had a practical use in addition to architectural elegance, included this remarkable device that astonishes even modern researchers.", A huge mirror,A huge mirror,A telescope,A heavy catapult,A windsock
Over 125 million people of more than 250 ethnic groups share the territory of this African country. This constitutes 1/5 of the population of the entire continent., Nigeria,Nigeria,Egypt,Zaire,South Africa
There is a vending machine for every 23 of the almost 130 million people that live in this country., Japan,China,Singapore,Japan,Korea
"Dhaka, formerly Dacca, is the capital and largest city of this  country with over 140 million citizens.  Families there are large, unfortunately so is infant mortality.", Bangladesh,Ecuador,Pakistan,Nauru,Bangladesh
This home to 144 million spans 11 time zones and its territory takes up 1/8th of the entire Earth surface., Russia,Australia,Canada,USA,Russia
"Islam, Christianity and Hinduism all coexist in this country of 160 million.", Pakistan,Bangladesh,Pakistan,Iran,Iraq
About 75% of the 185 million citizens of this country live in the cities. The largest city is Sao Paulo with a population of 16 million., Brazil,Peru,Brazil,Bolivia,Argentina
"Constituted of 17,508 islands this country gives home to about 240 million. Its tropical rain forest accounts for 10% of the worlds rain forests.", Indonesia,Bali,Singapore,Malaysia,Indonesia
"It is home of almost 300 million.  There were millions of buffaloes before the first settlers arrived, but urbanization has been a factor in their decrease.", USA,Canada,Mexico,Australia,USA
"The first medical school, Ayurveda was founded in this populous country.", India,Israel,India,Pakistan,China
"This is the most populated country in the world - 1.3 billion people live there.  The native language, Mandarin, is most widely spoken, with 885 million speakers.", China,Japan,India,China,South Korea
The famous Bull Run is held in this Spanish city., Pamplona,Valencia,Pamplona,Cordoba,Barcelona
This American city used to be called  El Pueblo de Nuestra Senora la Reina de (blank) de Porciuncula., Los Angeles,Las Vegas,New York,Los Angeles,Kansas
"This East European capital city is famous for its wide, tree-lined boulevards and glorious Belle Epoque buildings. Some call it Little Paris because of these buildings."," Bucharest, Romania","Belgrade, Serbia","Sofia, Bulgaria","Athens, Greece","Bucharest, Romania"
The famous Forbidden City located in this Chinese city., Beijing,Fujian,Beijing,Guangdong,Yunnan
This Indian city was the capital of Mogul sovereigns from 1526 to 1658.  Its most notable building is the Taj Mahal., Agra,Agra,Varanasi,Mumbay,Jaipur
"Indian city again. This one, founded in 1727 AD  is known as The Pink City and is often visited by honeymooners.", Jaipur,Delhi,Jaipur,Bengal,Agra
"In close proximity to this Italian city are the famous ruins of Pompeii, which once was a thriving town for wealthy Romans. The city of Pompeii was destroyed in the cataclysmic eruption of Mount Vesuvius in 79 AD.", Naples,Bologna,Venice,Naples,Rome
"This city is famous for the fact, that a living goddess dwells there.  She is a young girl by the name of Kumari,  believed to have appeared in the 18th century.", Katmandu,Tansen,Kurari,Pokhara,Katmandu
"The name of this 5th largest city in North America originates from a Mohawk word, meaning where there are trees standing in the water.", Toronto,Toronto,Quebec,Montreal,Ottawa
The name of this city means the capital in the native language.  It is the capital of South Korea., Seoul,Seoul,Taegu,Taejeon,Pusan
"This state, officially nicknamed The Golden State, is situated in the southern half of the west coast of the USA.", California,Florida,Utah,California,Miami
This mid-Atlantic state is called The First State due to the fact that it was the first to ratify the US Constitution., Delaware,Columbia,Georgia,Maine,Delaware
"Widely known for huge gambling and the legalization of gambling industry, this states official nickname is The Silver State.", Nevada,Kansas,Nevada,Florida,Alaska
"Due to its natural beauty and relative wilderness, this Southern state is called The Natural State.", Arkansas,Arkansas,Alabama,Alaska,Arizona
This state of the New England region of the United States has the nicknames Pine Tree State and Vacationland., Maine,Michigan,Maryland,Massachusetts,Maine
Which Southern state of the United States has a nickname The Magnolia State and a name that is the same as that of a big river?, Mississippi,South Dakota,Mississippi,South Carolina,Colorado
"This state, located in the mid-Atlantic region of the USA, has a capital called Trenton and is usually nicknamed The Garden State.", New Jersey,Wyoming,New Jersey,Rhode Island,Maine
"Nicknamed after the international park located in it, this state is often called The Peace Garden State.", North Dakota,North Dakota,Oregon,South Dakota,Tennessee
"What is the real name of the Evergreen State, situated in the Pacific Northwest of the United States.", Washington,Pennsylvania,New Jersey,Massachusetts,Washington
This small Mountain Sate is located in the region of Appalachia in the Eastern parts of the USA., West Virginia,New Jersey,Pennsylvania,East Virginia,West Virginia
"This country, a victor in both World War I and World War II is the largest West European nation.", France,Spain,United Kingdom,France,Germany
"After multiple agreements between 1772 and 1795, Russia, Prussia, and Austria divided this central European country among themselves.  It finally regained its independence in 1918.", Poland,Slovakia,Belarus,Germany,Poland
"This Central America country, slightly smaller than South Carolina, withdrew from Colombia in 1903 with the help of US support.", Panama,Chile,Panama,Ecuador,Venezuela
"In 1895, military defeat forced China to cede this country to Japan. China re-gained control after World War II.", Taiwan,Thailand,Hong Kong,Singapore,Taiwan
"This kingdom was a founding member of NATO and the EU.  It remained neutral during World War I, but was invaded and occupied by Germany during World War II.", Netherlands,Denmark,Switzerland,Netherlands,Belgium
"This island country tried to gain its independence from Spain in 1821, but was conquered and ruled by the Haitians for 22 years.  It finally became independent in 1844.", Dominican Republic,Peru,Chile,Dominican Republic,Costa Rica
"This independent country, located in Southeastern Asia was first colonized by Portugal in the 16th century.  Between 1976 and 1999 it was a provice of Indonesia.", East Timor,Brunei,Myanmar (formerly Burma),East Timor,Philippines
"This Southeast European country allied with the Axis powers and participated in the 1941 German invasion of the USSR.  In 1947, overrun by the Soviets, it bacame a Communist peoples republic.", Romania,Hungary,Yugoslavia,Slovenia,Romania
"This powerful world empire of the 16th and 17th centuries borders Andorra, France, Gibraltar, Portugal and  Morocco.", Spain,France,Tunisia,Algeria,Spain
"Frances conquest of this country began in 1858 and was completed by 1884.  Independence was declared after World War II, but the French continued to rule until 1954.", Vietnam,Tunisia,Morocco,Vietnam,Algeria
"Who is the little brother of Ralphie, the main character of A Christmas Story?", Randy,Rascal,Rudy,Rocky,Randy
"In the movie A Christmas Story, which of Ralphies friends gets his tongue stuck to a pole?", Flick,Scutt,Schwartz,Grover,Flick
What does Ralphies dad win in A Christmas Story?, Womans Leg Lamp,Womans Leg Trophy,Womans Leg Lamp,Womans Leg Can Opener,Womans Leg Statue
"In A Christmas Story which famous piece of music always played in the background, when the bully and his minion entered a scene?", Peter and the Wolf,Ode to Joy,William Tell Overture,Pachelbels Canon,Peter and the Wolf
What present does Ralphie want more than anything in the film A Christmas Story?, Red Ryder BB Gun,Slingshot,Bow and Arrow,Red Ryder BB Gun,Brandywine Cannon
Where do the Parkers end up having Christmas dinner in the film A Christmas Story?, Chinese Restaurant,Chinese Restaurant,Goldblatts Department Store,The Bumpass,Griffith
What favorite television show did the film A Christmas Story inspire?, The Wonder Years,That 70s Show,Full House,Happy Days,The Wonder Years
"Christmas is the Christian holiday that celebrates the birth of Christ.  Christ was born in this city, according to the Bible.", Bethlehem,Nazareth,Jerusalem,Bethlehem,Rome
"In the United Kingdom, what holiday is December 26th?", Boxing Day,Perihelion,Boxing Day,Candlemas,St Patricks Day
"The origins of the widespread tradition of decorating a Christmas tree can be traced back to the 16th century, in this country.", Germany,The United States,France,Russia,Germany
"For Catholics, Protestants and most Orthodox Christians, the 25th of December is celebrated as Christmas. However, the Jerusalem, Russian, Coptic, Serbian and Georgian Orthodox churches celebrate the birth of Jesus on this date.", January 7,December 31,February 15,January 7,November 25
The burning of the Yule Log is one of many Christmas traditions that come from the Yule festival. Do you know what this tradition symbolizes?, The returning light,The mortality of humans,The returning light,The Holy Spirit,The life-cycle
"Jingle Bells, undoubtedly one of the most famous Christmas songs in the world, was written in 1857 by this person.", James Pierpont,Joyce Ballantyne,Iza Trapani,Haddon Sundblom,James Pierpont
Three of these names are of reindeers of Santa Claus. Which is the odd one?, Clement,Comet,Rudolph,Clement,Donder
"Even though Jack Nicholson and Eddie Murphy were considered for the role of the Grinch in the 2000 movie, How the Grinch Stole Christmas, this man was the one who played the part.", Jim Carrey,Al Pachino,Jim Carrey,Danny DeVito,Eddie Griffin
